"","user","type"
"375","Volkswagen's U.S. chief knew in early 2014 that it might not be following emissions rules http://t.co/YpPg4CowbR http://t.co/3gyki7fMIB","business"
"376","The prescription drugs on sale in Hong Kong - without prescriptions http://t.co/pS9OM9zRRH http://t.co/hrfEfJZvTZ","business"
"377","There's a De Beers lab outside London that makes diamonds it'll never sell http://t.co/P8mvqnxUX0 http://t.co/O1Y2BAeZZN","business"
"378","25 British firms visit Iran to assess opportunities - but big banks stay away http://t.co/c16aTtvMzu http://t.co/BXYgIYoG5r","business"
"379","27% profit rise at Mondi, largest producer of industrial bags in Europe and North America http://t.co/O83giLLhcx","business"
"380","NATO stands by Turkey and says Russia is engaging in a ""troubling escalation"" in Syria http://t.co/YycjdOV0R5 http://t.co/r34h0KLILS","business"
"381","German bonds rise as drop in exports adds to weaker economic outlook http://t.co/grm10X5Irn","business"
"382","U.K. stocks fall ahead of Bank of England rate decision, with Glencore down 2.5% http://t.co/BbZhd4VQnX","business"
"383","Rolls-Royce plans Asian manufacturing push, with China still key http://t.co/59aeVPZFgG http://t.co/AdJZi0DF0p","business"
"384","Former Twitter CEO Dick Costolo is working on the next season of ""Silicon Valley"" http://t.co/T50wX3dK9M http://t.co/vAnQgMJfv8","business"
"385","Fiat Chrysler reaches tentative deal with United Auto Workers, averting U.S. strike http://t.co/sW1vDfEAwi http://t.co/XAacaibiPT","business"
"386","Use this rally to sell, says the man who forecast China's boom and bust http://t.co/5DzcfAIvvX http://t.co/DX3xafXb0w","business"
"387","Longest ever waiting list for places at Lloyd's of London underwriting floor http://t.co/CHXuQSM0IA http://t.co/S1CfzsKsxt","business"
"388","BREAKING: Deutsche Bank shares fall 3.6% in Frankfurt after it warned of €6.2 billion ($7 billion) loss http://t.co/7LYCV2WeXA","business"
"389","Hong Kong must wait 8 years for a third runway - and that's hurting Cathay Pacific http://t.co/MZZu756yIC http://t.co/lNgY1koQtK","business"
"390","Pound drops against euro before Bank of England rate decision - we'll tweet it at 12:00 London time http://t.co/4KsVNl6ejv","business"
"391","Populations of Sydney and Melbourne ""will almost double by 2060"" http://t.co/nAVkZgq2uv http://t.co/PJko5hAQqb","business"
"392","Those merger plans may not solve one of the megabrewers' biggest problems: craft beer http://t.co/f0nfNVfZ9j http://t.co/9KHUPxIxAA","business"
"393","Full-year profit forecast misses estimates at Uniqlo's owner, Fast Retailing http://t.co/DppNQqAFXs http://t.co/DNHIXDFqSP","business"
"394","New questions for Volkswagen about death and injury claims that were well below average http://t.co/ErzkBnZPgn http://t.co/vX5b6T8Flz","business"
"395","Britain's home sales rise at fastest pace in more than a year http://t.co/4UhesSduxL http://t.co/1yBnZx82lv","business"
"396","Indonesia to accept help from other nations to fight forest fires and haze http://t.co/gznr6OIXQt http://t.co/WayopvOolT","business"
"397","Tesco hasn't been offered deal to settle British accounts investigation, CEO says http://t.co/PBhRVXjiBq http://t.co/1pQGnfBLPJ","business"
"398","These 5 charts show the Bank of England's predicament, ahead of Thursday's rate decision http://t.co/OUD02osw0i http://t.co/hMXRpDV57E","business"
"399","Germany's 5.2% fall in exports was far greater than forecast - drop of 0.9% was expected http://t.co/XHKI1cB0gY","business"
"400","BREAKING: Germany's exports unexpectedly fell by 5.2% in August, the most since January 2009 http://t.co/XHKI1cB0gY","business"
"401","Deutsche Bank expects third-quarter loss of €6.2 billion ($7 billion) and may scrap dividend http://t.co/7LYCV2WeXA http://t.co/S40E0FmRp5","business"
"402","Car dealers are steering clear of Volkswagen's dirty diesels, but drivers are still buying http://t.co/ASUKVeCwGT http://t.co/FcAO9ePDfE","business"
"403","7 things we learned about David Cameron's Conservatives at Britain's #CPC15 conference http://t.co/t2tXavmhgR http://t.co/sTRb83NkF6","business"
"404","IMF warns officials to protect financial systems from possible instability as Fed prepares to raise rates http://t.co/j0mPKaoemK","business"
"405","Deutsche Bank sued by 2 employees fired amid an investigation into possible money laundering at its Russian unit http://t.co/Gbz4TG66Lv","business"
"406","Controversial plan for Air France cuts is backed by French government http://t.co/zqiYbCUx0l http://t.co/0gbE4VKBCC","business"
"407","Bill Ackman on what's wrong with GE http://t.co/3IOY3z2NYP http://t.co/cR4pXI07PA","business"
"408","How a sex scandal rocked Stanford’s business school and prompted the dean's resignation http://t.co/pvKboRfFt9","business"
"409","Is Japan really on the threshold of a new golden age? http://t.co/OQrRN7diQv http://t.co/bo0Q17fkFl","business"
"410","France will seek to halt trade talks between Europe and U.S. if no progress made http://t.co/RGvp0ji4m1 http://t.co/kSdhPdzKKa","business"
"411","The new Pill+ is a Beats speaker to the core, but clearly shows some Apple influence http://t.co/jceFrYShws http://t.co/xVFFiJLUPB","business"
"412","Wall Street's compliance with settlements probed by top Democrat http://t.co/i0littKRb8 http://t.co/FWDbitEbDm","business"
"413","Monsanto will eliminate 12% of workforce, forecasting 2016 earnings that trail expectations http://t.co/NpcRhdVJCD http://t.co/j6CLhKiwAn","business"
"414","Why Chinese consumers have suddenly stopped buying cars http://t.co/7FXx6IO14T http://t.co/OFc1GgiKa8","business"
"415","157 artists and over 400 artworks in one show. How did MoMA PS1 pull it off? http://t.co/v9NfNAfbgR http://t.co/38nn7UbesG","business"
"416","Parsing the incredible shrinking petrodollar http://t.co/pV3eTBOh9C http://t.co/X7rVRqxWO3","business"
"417","Volkswagen's stock chart is starting to look like BP's after oil spill http://t.co/IK62g3vi52 http://t.co/fGf1klZMe5","business"
"418","10 of Paris Fashion Week's most surreal photos http://t.co/fydvyqOjEn #PFW http://t.co/iFwhzBhOJZ","business"
"419","See the 50 people on this year's Markets Most Influential list http://t.co/AwUMqsp36D #bmarkets2015 http://t.co/ndjEneCkqA","business"
"420","Why Warren Buffett thinks a rail superhighway is the future http://t.co/hzu5Ng3eHF http://t.co/PUgo80vHf5","business"
"421","New York is about to become a hub for U.S. solar manufacturing, luring a start-up called 1366 Technologies Inc http://t.co/NJdagxxpmt","business"
"422","U.S. retiree health-care costs rise by 11%, with estimated $245,000 bill in years ahead http://t.co/qfjhZCOpPy http://t.co/i1Vfhez58U","business"
"423","From ghost tours to on-site psychics, hotels are capitalizing on creepiness http://t.co/twIvMANIo3 #AHSHotel http://t.co/lq6SFULmef","business"
"424","Janet Yellen is pursuing a monetary policy that critics say had disastrous results in the 60s and 70s http://t.co/eXIAc2jA2s","business"
"425","4 ways the oil price crash is hurting the global economy http://t.co/oZuI2y67sy http://t.co/erYzMsJK7z","business"
"426","Why LinkedIn's Reid Hoffman is on @markets Most Influential list http://t.co/t1ioKLY4Yv http://t.co/B7lWMCjsQr","business"
"427","Medical entrepreneur Dr. Rodney Perkins on how he got there http://t.co/foyTxP5JBC http://t.co/ok3vhdIj4u","business"
"428","Our gallery offers a snapshot of life in Iran http://t.co/OCBT9NzznS #InsideIran http://t.co/4LdibvMrDP","business"
"429","Twitter's ex-CEO Dick Costolo has his next gig - writing for HBO's Silicon Valley http://t.co/KQ5dzumaRi http://t.co/0nlj6b5wmw","business"
"430","Here is our gold. Every. Single. Bit of it. Germany's central bank says http://t.co/K7Kf4sbfc9 http://t.co/KwVcGlPIjz","business"
"431","JPMorgan says its felony plea for market rigging shouldn’t bar it from owning part of LightSquared http://t.co/2gZrTxvfWQ","business"
"432","Nespresso capsules to help develop coffee industry in war-torn South Sudan http://t.co/Mn3kIIpfEf http://t.co/0usG1nHFkI","business"
"433","An inside look at Under Armour's growth strategy http://t.co/CY60HXgZjX http://t.co/9hSIMxDY49","business"
"434","Oil producers see a long period of low prices ahead http://t.co/x5nz5Z8Kdq http://t.co/BPqYQIiApS","business"
"435","Indonesia considers how much its reputation has been polluted by haze http://t.co/NwLpQ92nri http://t.co/vQKY4RODm5","business"
"436","Iran is in the midst of a shopping mall boom. Meet the man behind the biggest http://t.co/e71EN00Fn6 http://t.co/7DcxGsJZcu","business"
