"","user","type"
"198","A wallet so chic, it‚Äôs impossible to forget‚Äîbecause Monday is hard enough already http://t.co/11Plho06Kr #AutumnLuxe http://t.co/lKzRHnimg0","fashion"
"199","Street-style cool: a luxe leather backpack is on everyone‚Äôs list. http://t.co/nTOzJEN80E #AutumnLuxe http://t.co/rapOtcBPzT","fashion"
"200","A single pav√© bracelet is a sexy, simple touch that works with almost any look. #StyleTip","fashion"
"201","Fall fashion on your mind? Don‚Äôt buy another thing until you read these: http://t.co/mm8en4zvZK #AutumnLuxe","fashion"
"202","This fall bag will help you get over the end-of-summer blues. http://t.co/AhJYVmvysG #AutumnLuxe http://t.co/nYPTlhncs7","fashion"
"203","If you could leave right now, where would the road take you? #WhatsInYourKors","fashion"
"204","It‚Äôs the perfect time to book a fall getaway‚Ä¶ http://t.co/qnYRZT1okR #WhatsInYourKors http://t.co/cIUZiEmWep","fashion"
"205","The Thea wedge‚Äîleading the suede parade all season long. http://t.co/KedjauHJW0 #AutumnLuxe http://t.co/oulGle64LN","fashion"
"206","The apple of our eye: road-trip-ready frames. http://t.co/5nOBMJ1iZm #WhatsInYourKors http://t.co/X495JmUpKy","fashion"
"207","End the summer with a splash in a chic high-waisted swimsuit. #StyleTip","fashion"
"208","A wrap-around leather bracelet goes the distance. http://t.co/O1deAndJxf #WhatsInYourKors http://t.co/Fsc3GVE3l6","fashion"
"209","Easy to pack and even easier to wear, this is the ultimate road trip extra. http://t.co/m1hAxuSPbq #WhatsInYourKors http://t.co/lcAQXODCz4","fashion"
"210","Here comes fall...is your closet ready? http://t.co/41yoBYOF83 #AutumnLuxe https://t.co/AZSWkRg7P9","fashion"
"211","A denim jacket or crochet knit will carry your summer dresses through the first few weeks of fall. #StyleTip","fashion"
"212","Apple picking, vineyard tours, harvest festivals‚Äîwhat‚Äôs your favorite fall getaway? #WhatsInYourKors","fashion"
"213","This wallet was made for wandering. http://t.co/ayPw43XJjm #WhatsInYourKors http://t.co/NenjWJUPoO","fashion"
"214","Spot on: #JohnBaldessari takes on Resort 16 in @VogueMagazine. To our fans‚Äîwhat inspires you? #VogueForcesOfFashion http://t.co/xf3iolQkST","fashion"
"215","We handpicked these fall escape essentials just for you: http://t.co/pnIYSvGFgy #WhatsInYourKors http://t.co/8MGQMyBmZp","fashion"
"216","As the air gets crisp we all start to crave rich, luxe shades. ‚ÄìxxMK","fashion"
"217","Lead the way this fall with ‚Äò70s-inspired essentials. http://t.co/mUxnW4XH7w #AutumnLuxe http://t.co/BtcKWvJ7qx","fashion"
"218","When the temperatures start to drop, what pieces do you reach for first? #AutumnLuxe","fashion"
"219","Because personal style is in the details. http://t.co/Z850nG0UCN #AutumnLuxe http://t.co/XHJk8Ib0i0","fashion"
"220","The point is to feel chic every day. ‚ÄìxxMK","fashion"
"221","What‚Äôs the one piece you can‚Äôt wait to get your hands on this fall? #AutumnLuxe","fashion"
"222","#SetYourSights on our Playa Norte shades‚Äîbecause sunglasses aren‚Äôt only a summer essential. http://t.co/LsbAB6swNr http://t.co/leWLU8uc9T","fashion"
"223","In these pages, you‚Äôll find the pieces you‚Äôll reach for all season long. http://t.co/6qaQunhFX5 #AutumnLuxe http://t.co/wJglB2kz6d","fashion"
"224","Fall is all about blurring the lines‚Äîcasual sophistication, cozy elegance, laid-back luxe. ‚ÄìxxMK","fashion"
"225","There‚Äôs nothing like going behind the scenes with @KarlieKloss. http://t.co/oFBzBxNIgi","fashion"
"226","Shades of burgundy, exotic prints, suede statements‚Äîwhich fall trend are you most excited for? #AutumnLuxe","fashion"
"227","#SetYourSights on the easiest way to look polished and cool: http://t.co/4UjHfE1SX6 http://t.co/yCS6bNT3aW","fashion"
"228","This bag is the definition of practical chic: http://t.co/Z7aWELr5Hb #AutumnLuxe http://t.co/5zlvSTUWBA","fashion"
"229","A backpack should be on everyone‚Äôs list for fall. ‚ÄìxxMK","fashion"
"230","We think it‚Äôs time for a little change. See our fall watches here: http://t.co/vDfyCXqOJQ #PerfectTiming","fashion"
"231","Our catalog is almost here‚Äîbut you can shop some of our favorites early! http://t.co/CKIlt0wqEg #AutumnLuxe http://t.co/BfSnFOVojJ","fashion"
"232","I love how sneakers give everything a sport-chic attitude. ‚ÄìxxMK","fashion"
"233","Send sparks flying tonight with our Rose Radiant Gold fragrance. http://t.co/KHTqdcEBNb #FlashYourGold http://t.co/GUaJwiEl9G","fashion"
"234","Personal style is all about the details‚Ä¶ http://t.co/4jZG9Lp71i #AutumnLuxe http://t.co/XQo9ETAmex","fashion"
"235","Maxi dresses are the new minis. #StyleTip","fashion"
"236","Which Golden Rule of Going Out do you always follow? #FlashYourGold","fashion"
"237","The camera loves you @KarlieKloss, and so do we!  https://t.co/Xm3OiDUtbV","fashion"
"238","Get the skinny on one of the season‚Äôs sleekest watches. http://t.co/2Q3svjcKeF #PerfectTiming http://t.co/41KLFyrDaD","fashion"
"239","Fall is all about texture‚Äîfrom handbags to jackets to shoes. ‚ÄìxxMK","fashion"
"240","Golden Girls: @DevWindsor, @JLJablonski and @GraceMahary fill in the ______! http://t.co/tCp8hc5waK #FlashYourGold http://t.co/iySEDkhERH","fashion"
"241","Don‚Äôt be afraid to dial up the drama this fall. http://t.co/4s8lUXfT0a #PerfectTiming","fashion"
"242","Hitting the sweet spot with @GraceMahary on set for #FlashYourGold. http://t.co/nHZ3xfuFKn http://t.co/0FfEV23VBl","fashion"
"243","There‚Äôs a message in every bottle‚Äîthis one reads glamour. http://t.co/hiAIwkYM4C #FlashYourGold http://t.co/aaQLB21c8P","fashion"
"244","A denim skirt or high-waisted jean makes it easy to channel the season‚Äôs ‚Äò70s vibe. #StyleTip","fashion"
"245","The new kicks on the block‚Ä¶ http://t.co/DN01dRv6cU #JetSetGo","fashion"
"246","Channel fall‚Äôs city-chic mood, wherever you are: http://t.co/ylegaFYfvJ #AutumnLuxe http://t.co/BNZxPRh2WG","fashion"
"247","Running around town has never looked so good: http://t.co/45g6rYoIEj #JetSetGo http://t.co/SmHKX9EUXs","fashion"
"248","Sculptural accents give simple sundresses a modern twist. #StyleTip","fashion"
"249","Screen queen: A behind-the-scenes look at @KPedaru for our Gold Campaign. http://t.co/t2GwSvabZX #FlashYourGold http://t.co/zFuusTPdMb","fashion"
"250","Model @JLJablonski dials up the glamour on set. http://t.co/hMuDRCxezE #FlashYourGold http://t.co/JACQfaFPYY","fashion"
"251","Sparkling and sensuous, tantalizing and hypnotic or feminine and seductive‚Äîwhat‚Äôs your favorite fragrance for a night out? #FlashYourGold","fashion"
"252","An intimate look at the mood for the season: see the full Fall 2015 Ad Campaign. http://t.co/L04iZO70vM #AutumnLuxe http://t.co/8wS9PMB0Or","fashion"
"253","The 4 must-haves for fall‚Äîdesigned to make big city living a little more luxe. http://t.co/4XUf9TYl70 #AutumnLuxe","fashion"
"254","Meet the Sawyer watch‚Äîa key style for this season and beyond. http://t.co/Z9ubhVgF7W #PerfectTiming http://t.co/Zk1ZmkZMp4","fashion"
"255","Leather bands are back in a big way. ‚ÄìxxMK","fashion"
"256","Beautiful beauty essentials are a total do: http://t.co/7ioPPdtNE6 #FlashYourGold http://t.co/VEaz9oq8y1","fashion"
"257","When it comes to gold, what‚Äôs your approach‚Äîpile it on or go for a singular statement? #FlashYourGold","fashion"
"258","Always go for the gold. http://t.co/QwzYfrjIDS #FlashYourGold http://t.co/ws0jQ8MkcX","fashion"
"259","Late summer‚Äôs boho romance is paving the way for fall‚Äôs laid-back luxe. #StyleTip","fashion"
"260","Our Saturday is looking pretty sweet‚Ä¶ http://t.co/MkLhbrR4PX #FlashYourGold http://t.co/9oFS965Bq7","fashion"
"261","A monochrome crop top and skirt combo looks fresh in the heat. #StyleTip","fashion"
"262","All the pretty faces‚Ä¶ http://t.co/cqwSnzW0Lr #PerfectTiming","fashion"
"263","Grace Mahary gets a sweet new look on set for The Golden Rules of Going Out. http://t.co/X0LvKwoM9B #FlashYourGold http://t.co/rYndJC0fgf","fashion"
"264","Congratulations on 30 incredibly chic years, @ELLEmagazine! #ELLEat30","fashion"
"265","A touch of fragrance behind the ears lasts all day long and never borders on overpowering. #StyleTip","fashion"
"266","Up-to-the-second style statement: Sable is the new staple. http://t.co/Au664iaX2i #PerfectTiming http://t.co/AZhiEvze6v","fashion"
"267","Make a major statement with our army green Greenwich bucket bag. http://t.co/39u8MUk2g8 #AutumnLuxe http://t.co/kH4OpsWOrJ","fashion"
"268","The hair, the outfit, the makeup‚Äîwhich do you spend the most time on when prepping for a night out? #FlashYourGold","fashion"
"269","Ready, set, smile! Study up on how to look picture perfect for any event: http://t.co/agj8MmbhAo #FlashYourGold http://t.co/ahvs9WMtn5","fashion"
"270","An oxford, a cool sneaker and a suede boot will keep you a step ahead all through fall. #StyleTip","fashion"
"271","You deserve to feel glamorous every day. http://t.co/MJ9nPUYp0p #FlashYourGold http://t.co/mH4WD5h2z7","fashion"
"272","Spotted: @JLJablonski behind the scenes of our Gold Collection campaign! http://t.co/Q2ko4gKNQZ #FlashYourGold http://t.co/HQIUI8LiAX","fashion"
"273","Get a head start on fall with our new city-chic arrivals: http://t.co/RbqGjjNDWC #AutumnLuxe http://t.co/LeoEzmwobk","fashion"
"274","A great white t-shirt will always be in style. #StyleTip","fashion"
"275","Because Mondays don‚Äôt have to be boring: http://t.co/kP3zlPONSm #FlashYourGold http://t.co/TdWiSSI7Cn","fashion"
"276","Sequins, metallics, jewelry‚Äîwhat‚Äôs your favorite way to add a little shine for a night out? #FlashYourGold","fashion"
"277","The pair to wear now and later‚Äîa burgundy heel. http://t.co/cen4IqxE1P #JetSetGo http://t.co/Mu6Uy5hltY","fashion"
"278","Thank you for all the birthday wishes! -xxMK","fashion"
"279","A white blazer adds instant polish to August‚Äôs boho mood. #StyleTip","fashion"
"280","The key to our heart? Defining details. http://t.co/IxrfLokxFf #AutumnLuxe http://t.co/AFhc42LSyc","fashion"
"281","The grass is always greener with our Greenwich bag. http://t.co/4XaOg7NWwu #AutumnLuxe http://t.co/w632c8dxsm","fashion"
"282","It‚Äôs time to start thinking about your fall wardrobe‚Äîdo some research, make a list and start shopping! #StyleTip","fashion"
"283","The new gold standard: discover the full collection today: http://t.co/xSOtZ2fUUt #FlashYourGold http://t.co/Ay6yFZRIla","fashion"
"284","Golden rule number 1: Be fashionably late. http://t.co/kBWaYv2tUd #FlashYourGold http://t.co/JCPFyUhqM5","fashion"
"285","Summer weekends call for strappy sandals and simple sundresses. #StyleTip","fashion"
"286","With the Gold Fragrance Collection glamour is just a spritz away. http://t.co/uGzilObfCU #FlashYourGold http://t.co/YYJKfAvGxv","fashion"
"287","A great fragrance can instantly lift your mood. ‚ÄìxxMK","fashion"
"288","Just in: our fall spin on everyone‚Äôs favorite Greenwich bag. http://t.co/bibKGAo4nG #AutumnLuxe http://t.co/Wggfs5U6og","fashion"
"289","Shades of army green and khaki will help you transition into fall flawlessly. #StyleTip","fashion"
"290","Trend prediction: prepare to fall hard for leather watches. http://t.co/q5kxeW9aOG #AutumnLuxe http://t.co/Z8TPSQFDsX","fashion"
"291","Prepare to reach a whole new level of glamour‚Äîcue the Collins stud. http://t.co/eviJupDOKD #AutumnLuxe http://t.co/ws8IciGgcb","fashion"
"292","A breezy maxi dress or caftan is one of the easiest ways to survive August in style. #StyleTip","fashion"
"293","How time flies: Hello, August. http://t.co/dGoijdr73A #PerfectTiming","fashion"
"294","#ToTheMan who takes the road less traveled‚Äî this one‚Äôs for you: http://t.co/ChHgbT8PfJ http://t.co/fpmXeKzyhq","fashion"
"295","Every woman should own a shirtdress. #StyleTip","fashion"
"296","Fragrance: just for date night or an everyday essential? #ToTheMan","fashion"
"297","#ToTheMan who fears nothing‚Äîour Extreme Blue fragrance was made for you. http://t.co/Re6lVwiBOX http://t.co/5oz2P0H8zz","fashion"
"298","Heels at the beach are a don‚Äôt. If you need a little height, wear a wedge. #StyleTip","fashion"
"299","#ToTheMan who see‚Äôs the world a little differently‚Äîdiscover Extreme Blue: http://t.co/y62VGrybif http://t.co/qzz37D6K6J","fashion"
"300","#ToTheMan who views every weekend as an adventure: http://t.co/FSjcMjRv4H http://t.co/4FX7DOBcqL","fashion"
"301","When it comes to fragrance, you want memorable, not overpowering. -xxMK","fashion"
"302","#ToTheMan who‚Äôs not afraid to test the limits‚ÄîExtreme Blue has arrived. http://t.co/l3cn7IsJAq http://t.co/JZJSJNch5k","fashion"
"303","Introducing Michael Kors Extreme Blue‚Äîcrisp, spicy, smooth and sensual. http://t.co/Ad1YNVLYca #ToTheMan http://t.co/qJtrEOfgip","fashion"
"304","I believe you can be bold and refined at the same time. ‚ÄìxxMK #ToTheMan","fashion"
"305","Going monochrome‚Äîsee all of Michael‚Äôs must-haves of the moment here: http://t.co/cPxIk4S6Wl #sunkissed","fashion"
"306","The Cary bag‚Äîyour answer to uncomplicated accessorizing. http://t.co/wtwGDFqOVs #sunkissed http://t.co/MWQBUyE2zm","fashion"
"307","Accessories make it easy to look hot in the heat. #StyleTip","fashion"
"308","From gift guides to city guides, we‚Äôre making summer plans a breeze: http://t.co/xBooJauWik #sunkissed","fashion"
"309","Life's a beach with our Greenwich satchel. http://t.co/1mgbxsAajA #sunkissed https://t.co/fjJmnoOBB0","fashion"
"310","Beat the heat with a t-shirt dress and sporty slides. #StyleTip","fashion"
"311","The only thing missing is the perfect summer look‚Äîwe‚Äôve got you covered: http://t.co/TamDW5knHt #sunkissed http://t.co/SmnYO2Wa5K","fashion"
"312","Our new color crush? Gold and jet-black. http://t.co/B2eirLC3EN #PerfectTiming http://t.co/R5Xsq5CKpQ","fashion"
"313","Great clothes should make you feel like a more fabulous version of yourself. ‚ÄìxxMK","fashion"
"314","Written in the stars: See how the world‚Äôs leading ladies wear their Michael Kors. http://t.co/E5dz2OmEZX #FameFrame","fashion"
"315","#ToTheMan‚Äîwe found the warm weather alternative to your wool suit. http://t.co/0xuJbYBjK7 http://t.co/9SPozqzlsu","fashion"
"316","A white linen blazer equals instant summertime sophistication. #StyleTip","fashion"
"317","Color it chic‚Äîthe inspiration behind today‚Äôs must-have hues. http://t.co/2DyV7az1ZE #sunkissed","fashion"
"318","We‚Äôre dying over these pants: http://t.co/cN3DsCmZdh #sunkissed http://t.co/jrqtexAqwD","fashion"
"319","A neutral nail color is always a great complement to summer‚Äôs bold prints and flashy extras. #StyleTip","fashion"
"320","West coast, East coast, Amalfi coast‚Äîlook the part, wherever you are: http://t.co/fkOoJyotOd #sunkissed","fashion"
"321","Summer‚Äôs key piece? Look-at-me lenses‚Äîrain or shine. http://t.co/7Gb0iGmCrt #SetYourSights http://t.co/I43Yi1I5Q2","fashion"
"322","More often than not, less is more. ‚ÄìxxMK","fashion"
"323","In case you missed it: Kate Hudson is helping us in the fight against hunger! http://t.co/Qg9rgKRabh #WatchHungerStop http://t.co/pt49OzlhU4","fashion"
"324","Brights + Whites = Summer style done right. http://t.co/RJ1IQ3AlS1 #sunkissed http://t.co/mK3sNyUIyf","fashion"
"325","A force of nature: http://t.co/rcR2r52TYo #ToTheMan http://t.co/lz4aT19TkW","fashion"
"326","Tap into the season‚Äôs sport-luxe trend by adding chic white sneaks to a feminine dress. #StyleTip","fashion"
"327","An inside look at what it's like to work for @WFP: http://t.co/9l7eTlxehM #WatchHungerStop","fashion"
"328","A larger-than-life hat or face-framing aviators‚Äîhow do you stay cool? #sunkissed","fashion"
"329","It‚Äôs an honor @WFP . #WatchHungerStop  https://t.co/ulnEfL9lfB","fashion"
"330","#SetYourSights on our newest summer obsession‚Äîour Polynesia shades. http://t.co/KgRVAoFi51 http://t.co/n6NgeAp0UW","fashion"
"331","Everyone has to stop thinking about size and age‚Äîif it makes you feel great, then go for it. ‚ÄìxxMK","fashion"
"332","We‚Äôre excited to have Kate Hudson join us in the fight against world hunger. http://t.co/Jr056L2A1v #WatchHungerStop http://t.co/NU0v62P8a0","fashion"
"333","Thank you for helping us spread the word @CNNImpact! http://t.co/o6xbm34ML2 #WatchHungerStop https://t.co/DYKdniwPlx","fashion"
"334","A special thanks to all of you‚Äî10 million meals and counting! http://t.co/o6xbm34ML2 #WatchHungerStop https://t.co/uUdRQpZwCo","fashion"
"335","I‚Äôm very fortunate to do what I love and to be able to give back, because really, there‚Äôs no greater feeling than helping others. ‚ÄìxxMK","fashion"
"336","Lacking summer style inspiration? Look no further‚ÄîMichael shares his tips for the season: http://t.co/lpGz6i7ZuR #sunkissed","fashion"
"337","Survive the summer in style with wide-leg pants, tunics and caftans‚Äîthe breezier, the better. #StyleTip","fashion"
"338","Jump right in to the season‚Äôs coolest trend with our Darci watch: http://t.co/4T7e6kFkhf #PerfectTiming http://t.co/HOUScRTTsI","fashion"
"339","Dive into our Tumblr page‚Äîfeaturing every watch that‚Äôs sure to make a splash. http://t.co/N8NKupJfe3 #PerfectTiming","fashion"
"340","Michael‚Äôs current must-haves? Monochrome cool. http://t.co/Oesd00owhj #sunkissed","fashion"
"341","Everyone needs a sandal with substance‚Äîespecially in the city. ‚ÄìxxMK","fashion"
"342","State of the art: thanks @sunflowerman for this take on a look from our Men‚Äôs Spring 16 Collection! #MKMens #NYFWM http://t.co/z4FOQ9kUGo","fashion"
"343","I like color and neutrals for summer, but I can‚Äôt imagine getting dressed without some great black pieces. ‚ÄìMK #MKMens #NYFWM","fashion"
"344","Shades of blue. See all the hues of Spring 16: http://t.co/d185qSjvI2 #MKMens #NYFWM http://t.co/d2CeTyufXZ","fashion"
"345","A behind-the-scenes take on our Men‚Äôs Spring 2016 presentation: http://t.co/ZOpkE34Jlr #MKMens #NYFWM http://t.co/PxozsJWKaG","fashion"
"346","I think every man craves a little laid-back ease during the spring and summer. ‚ÄìMK #MKMens #NYFWM","fashion"
"347","The new way to do seersucker. http://t.co/AJKSuGTIVD #MKMens #NYFWM http://t.co/hxud52mZiP","fashion"
"348","Get a grip with Men‚Äôs Spring 2016: http://t.co/uRWNtuyqdF #MKMens #NYFWM http://t.co/EbCDbcVihr","fashion"
"349","You can‚Äôt travel to Capri without white. http://t.co/FscS9qgMLU #MKMens #NYFWM http://t.co/Mu6meue9Z4","fashion"
"350","I love steel-colored cotton. Gray for hot weather? Perfect. ‚ÄìxxMK #MKMens #NYFWM","fashion"
"351","Around-the-globe appeal‚Äîinspired by island life. See our Spring 16 Collection: http://t.co/wicgnREJuW #MKMens #NYFWM http://t.co/nLeArMyTEB","fashion"
"352","I like taking something laid-back, like a backpack, and showing it in the most luxurious way. ‚ÄìxxMK #MKMens #NYFWM http://t.co/IB44mbKKDU","fashion"
"353","Today, people are dressed down in the city and they‚Äôre more polished on vacation‚Äîso we create clothes that can do both. ‚ÄìxxMK #MKMens #NYFWM","fashion"
"354","Rugged boat shoes that go from the city to the coast. http://t.co/UTZDKn5Dyb #MKMens #NYFWM http://t.co/seemw7ioul","fashion"
"355","The summer trench‚Äîall of the polish, none of the weight. http://t.co/ziypzndsDz #MKMens #NYFWM http://t.co/QClrvA8qHn","fashion"
"356","Suiting without structure. http://t.co/CBiuIyO8s6 #MKMens #NYFWM http://t.co/6nddKxc5Cq","fashion"
"357","Artists always knew how to do off-duty, and now off-duty is 24/7. ‚ÄìxxMK #MKMens #NYFWM","fashion"
"358","Working on today‚Äôs Men‚Äôs Spring 2016 line-up. #MKMens #NYFWM http://t.co/NXmi5swcf5","fashion"
"359","Today‚Äôs the day for Men‚Äôs Spring 2016. #MKMens http://t.co/p1dC4mY9bc","fashion"
"360","An afternoon break: All of our watches, all in one place. http://t.co/7DS6bgzO51 #PerfectTiming","fashion"
"361","This is how you shine brighter than the sun. 
http://t.co/SM1S7hZ5An #sunkissed https://t.co/sCQ9xwo25h","fashion"
"362","A printed dress in black and white looks right from day to night. #StyleTip","fashion"
"363","Everyone deserves a lunch break that‚Äôs a little more luxe. http://t.co/hp1HJsKcRe #PerfectTiming http://t.co/e2YP1YKQCJ","fashion"
"364","When it comes to our Greenwich bag‚Äîit‚Äôs what‚Äôs on the inside that counts: http://t.co/u1Chjq71WX #sunkissed http://t.co/ycK5Jb8Bfk","fashion"
"365","I love an easy shoe that looks like you woke up, slipped it on and walked out the door. ‚ÄìxxMK","fashion"
"366","Sealed with a kiss! @AngelAlessandra, talks fashion icons and more: http://t.co/VhIf3d9NpR #KorsPanama http://t.co/vRgBMi311M","fashion"
"367","A lace-up shoe lends a polished panache to summer‚Äôs breezy looks. #StyleTip","fashion"
"368","Pearls of wisdom‚Äîalways a smart choice: http://t.co/JaY2Vfcc48 #sunkissed http://t.co/aWtwG4Blpq","fashion"
"369","Take us to Toronto! A fashionable food tour with @TheCoveteur and Dylan Penn. http://t.co/8RAyra3Mfc #JetSetToronto http://t.co/EH8G7a6CCp","fashion"
"370","Invest in a pair of cropped wide-leg pants to stay cool when the temps soar. #StyleTip","fashion"
"371","Put yourself in our shoes‚Ä¶ http://t.co/ey7FSUdTVM #JetSetGo","fashion"
"372","Make your lunch break a little more chic with our Girl‚Äôs Guide to Watches. http://t.co/aT4GgTFoAO #PerfectTiming http://t.co/gvi6kYTfGF","fashion"
"373","Black and white together is the yin and yang of fashion. ‚ÄìxxMK","fashion"
"374","Smooth sailing: See Michael‚Äôs must-haves for a season by the sea. http://t.co/lg9Dr3WXUK #sunkissed","fashion"
"375","With this many studs, it‚Äôs impossible to choose just one! http://t.co/g4gWFwUkHi #JetSetSelma http://t.co/Zf7X2iISjG","fashion"
"376","I always think people look the best when they feel comfortable in what they‚Äôre wearing. ‚ÄìxxMK","fashion"
"377","A sexy two-piece or a chic maillot‚Äîwhat‚Äôs your go-to swimsuit? #sunkissed","fashion"
"378","Stacked or single, these rings make a statement. http://t.co/rsaBxVKQFs #sunkissed http://t.co/9vk7oUaFEn","fashion"
"379","Invest in a shirtdress for a look that‚Äôs as comfortable as it is polished. #StyleTip","fashion"
"380","From the silver screen to your screen‚Äîstyle inspiration from Hollywood‚Äôs chicest stars. http://t.co/60OsDJJhwL #sunkissed","fashion"
"381","Gingham: how to wear the perennial go-anywhere print. http://t.co/SZAoVBhkSR http://t.co/MJPLpjqAVE","fashion"
"382","If you want to be stylish, you have to have a point of view. ‚ÄìxxMK","fashion"
"383","There‚Äôs no wrong way to wear a denim dress. #StyleTip","fashion"
"384","From a red lip to a striped tee‚Äîhow are you sporting your spirit today? #sunkissed","fashion"
"385","Here‚Äôs to a weekend of sun, sand and style‚ÄîHappy Fourth of July! http://t.co/mzw8o92WRq #sunkissed http://t.co/Hqx0rUODlG","fashion"
"386","American style is about making the most casual things a little more glamorous, and the most glamorous things a little more casual. ‚ÄìxxMK","fashion"
"387","Off to the beach? You‚Äôre going to want to see this: http://t.co/5n9ZGDAeuV #sunkissed","fashion"
"388","Feeling blue? That‚Äôs a good thing. http://t.co/Crw5nIM2BC #SetYourSights http://t.co/aupGwYUDF0","fashion"
"389","Pair feminine dresses with menswear-inspired shoes for a sweet juxtaposition. #StyleTip","fashion"
"390","Spot on: the trend you‚Äôll want to wear now and later. http://t.co/7eUG1ssE1o #sunkissed","fashion"
"391","Our Harper bag proves that two tones are always better than one. http://t.co/FK4I226C7p #sunkissed http://t.co/Gvj0oAfjxd","fashion"
"392","Red is the one color that‚Äôs not a color‚Äîbecause it really works for every occasion, and in every situation. ‚ÄìxxMK","fashion"
"393","Where are you watching the fireworks this year? #sunkissed","fashion"
"394","The perfect summer. http://t.co/Tjx2PeLq3n #sunkissed https://t.co/Xr5VQ4xiF1","fashion"
"395","Shimmering by the shore: our Holly sandals. http://t.co/JNTB5kSsf1 #JetSetGo http://t.co/gZH7ert68H","fashion"
"396","The trick to the shorts suit? Keep it monochrome and add sculptural accessories. #StyleTip","fashion"
"397","Don‚Äôt leave for the beach without these! http://t.co/7v4UNcCuJV #sunkissed","fashion"
"398","Our bucket list just got a little longer: meet the newest Miranda. http://t.co/ikhg3lFdMN #sunkissed http://t.co/K1r7buiwor","fashion"
"399","From flower power to geometric glamour, head-to-toe prints are a summer must. #StyleTip","fashion"
"400","The new laws of style: Jennifer Lawrence heats things up looking monochrome cool. #FameFrame http://t.co/loOfMQOVMl","fashion"
"401","Take a peek at the mood board behind our Resort 2016 Collection, only on Pinterest. http://t.co/pIqTpAx2jE #MKResort","fashion"
"402","Make this summer white hot: http://t.co/TBvDeYdxBU #PerfectTiming http://t.co/26ECjxCccZ","fashion"
"403","Everyone loves a little boho charm in the summer. #StyleTip","fashion"
"404","Polka dots or stripes‚Äîwhat‚Äôs your summer standby? #sunkissed","fashion"
"405","For wherever the road takes you‚Ä¶ http://t.co/tC6A7Vc20w #JetSetSelma http://t.co/FwjZjoynhc","fashion"
"406","Monochromatic neutrals feel crisp, modern and polished for hot summer days. #StyleTip","fashion"
"407","Shades of blue: We‚Äôre celebrating #NationalSunglassesDay with a flash-lens fave! http://t.co/o8SnokUQts http://t.co/mma4cifWCs","fashion"
"408","One of our favorite days of the year! What shades are you sporting today? #NationalSunglassesDay","fashion"
"409","From the pool to the plane. http://t.co/GS1ifG204s #sunkissed http://t.co/OkGrptPoqq","fashion"
