"","user","type"
"1","Cr√®me de la cr√®me: Sienna Miller in a dress from Spring 2016. #FameFrame http://t.co/G3ggMUkQrs","fashion"
"2","Make every second count with our #WatchHungerStop watch collection: http://t.co/HMTLx2kdI2","fashion"
"3","Personalize, pose and post‚Äîthree easy steps, one way to make the world a better place. http://t.co/vazd8l7A4d  #WatchHungerStop","fashion"
"4","Loving the ever-stylish @jxxsy in our #WatchHungerStop t-shirt ‚Äì create your own digital t-shirt to join the cause!  https://t.co/0sLdRSFplh","fashion"
"5","Food for thought: @WFP provides school meals to more than 20 million children each year‚Äîwe can help them deliver even more. #WatchHungerStop","fashion"
"6","Change the world, help someone, share a meal‚Äîwhat do you want to do today? http://t.co/LNLWuUV5D3 #WatchHungerStop http://t.co/Fk76BHyupk","fashion"
"7","Make your next Instagram count‚Äîwe‚Äôre donating meals for every picture shared to our gallery: http://t.co/0S07qVTEXZ #WatchHungerStop","fashion"
"8","A-peeling: @HilaryHRhoda, Michael and team in the kitchen at @GodsLoveNYC. http://t.co/KFhCBrEJGP #WatchHungerStop http://t.co/FaNHskaxX0","fashion"
"9","We have to care about the local community and the global community. We‚Äôre all in this together. -xxMK","fashion"
"10","If you could change one thing in the world, what would it be? #WatchHungerStop","fashion"
"11","For children in need, school meals programs make the possibility of escaping the cycle of hunger and poverty much greater. #WatchHungerStop","fashion"
"12","It‚Äôs tee time‚Äîmake your digital shirt today to help us #WatchHungerStop http://t.co/nOFoZ5fv5h","fashion"
"13","Strike a pose to help change the world! Make your digital tee: http://t.co/zpFGDiko5m #WatchHungerStop http://t.co/Y5WzEtVG7R","fashion"
"14","With social media, everyone can make a difference just by spreading the word‚Äîno act is too big or too small. -xxMK","fashion"
"15","Share your wish and spread the word‚Äîyou can help us deliver meals to hungry children today! http://t.co/YO99E0RaWq #WatchHungerStop","fashion"
"16","Model behavior: you can help others by making your digital t-shirt online! http://t.co/brVBKSe0FX #WatchHungerStop http://t.co/nfM3SCuOgt","fashion"
"17","Stand up for a cause: @AngelCandice, @LilyAldridge &amp; @LiuWenLW helps us #WatchHungerStop. http://t.co/X5VQRgdvnR http://t.co/MYqfBZc2Nf","fashion"
"18","Top chef: Michael is working to help fight hunger at home with @GodsLoveNYC. http://t.co/3jMJY596mW #WatchHungerStop http://t.co/gLOhVQt4nY","fashion"
"19","A picture of hope: see how @WFP‚Äôs school meals are changing lives in Mozambique. http://t.co/BjgNgx1wIt #WatchHungerStop","fashion"
"20","1 in 9 people go to bed hungry every day, according to @WFP. We‚Äôre working to change that. http://t.co/s2yWrAgXJs #WatchHungerStop","fashion"
"21","It‚Äôs time‚Äîdiscover our new #WatchHungerStop watch and help feed children in need. http://t.co/2wC7o8UJTx http://t.co/cyt9Zj7FnZ","fashion"
"22","There are things in the world that we can‚Äôt change, but hunger isn‚Äôt one of them. Together we can make a difference. -xxMK","fashion"
"23","Help us put a smile on the faces of children in need‚Äîmake your digital tee: http://t.co/XJspkPkrBP #WatchHungerStop http://t.co/xeUfrIs7XG","fashion"
"24","Striking a pose‚Äîcan you spot @KendallJenner‚Äôs tee in our gallery? http://t.co/Awxiovk2ky #WatchHungerStop https://t.co/zezrVTPn8h","fashion"
"25","Today I want to‚Ä¶@KendallJenner shares her wish! Make your digital tee here: http://t.co/Xf7rwnGjtV #WatchHungerStop http://t.co/34nNlYEzfg","fashion"
"26","Kors cares: Learn more about how we‚Äôre working to make the world a better place. http://t.co/KuRrUf8OhG #WatchHungerStop","fashion"
"27","I joined the fight against hunger because I like results‚Äîand this is a problem we can solve. ‚ÄìxxMK","fashion"
"28","See what our fans around the world are doing to #WatchHungerStop and make your own digital tee today! http://t.co/BiBcXOsMjn","fashion"
"29","In the stars: Kate Hudson wears our newest #WatchHungerStop watch. Get yours today: http://t.co/IS8LHUOQHm http://t.co/7Z5PWhmA69","fashion"
"30","What do you want to do today? Create and share your digital tee to help change the world. http://t.co/45gb5p6fny #WatchHungerStop","fashion"
"31","The fabulous Kate Hudson is helping us fight to #WatchHungerStop ‚Äì will you join us too? http://t.co/X6dy2YH8vh","fashion"
"32","Tag‚Äîyou‚Äôre it! @HilaryHRhoda shared what she wants to do, what about you? http://t.co/ddAzm2gfIh #WatchHungerStop http://t.co/nP4NytcqL6","fashion"
"33","Did you know? According to @WFP, 795 million people do not have enough food to live a healthy, active life. #WatchHungerStop","fashion"
"34","It‚Äôs time‚Äîour new Bradshaw 100 watch is here, the latest in our #WatchHungerStop collection. http://t.co/UH8xj3HHDV http://t.co/9IooCAWiwT","fashion"
"35","What‚Äôs better than a @liuwenlw selfie? One that‚Äôs for a great cause! http://t.co/KYswWUVHxl #WatchHungerStop  https://t.co/HU9nWFL1rf","fashion"
"36","How does a model prep for a night out? @KPedaru spills all on @IntoTheGloss! http://t.co/KrQeh2gjHZ #FlashYourGold http://t.co/q0550mc3Va","fashion"
"37","The bigger picture: see what Michael Kors is doing to help fight hunger. https://t.co/cmY5Gu1KS5 #WatchHungerStop https://t.co/xiPtOr4A7G","fashion"
"38","Join @AngelCandice, @LilyAldridge and @LiuWen to #WatchHungerStop. Make a digital t-shirt!  https://t.co/SqtGuWJUHk https://t.co/gQJcLZumOI","fashion"
"39","Words to give by‚Äîsee how @AngelCandice, @LilyAldridge and @LiuWenLW are lending their voices to @WatchHungerStop. https://t.co/6p36QtSh3A","fashion"
"40","World Food Day is almost here, and the fight against hunger is not over. With your help, we can help create a world with zero hunger. ‚ÄìxxMK","fashion"
"41","Running around town? Why not slip into something a little more comfortable‚Ä¶ http://t.co/1YLC1zbDgO #JetSetGo http://t.co/FURbSUDEgK","fashion"
"42","The Sabrina pump‚Äîfor days when you need to take things up a notch. http://t.co/YrhakZm1Qs #JetSetGo http://t.co/RGZlaHANTT","fashion"
"43","When it comes to color this season, burgundy is your new best friend. #StyleTip","fashion"
"44","Because Wednesday afternoons call for a chic pick-me-up. http://t.co/4Mw6NnI4gZ #AutumnLuxe http://t.co/X40ZKVttiz","fashion"
"45","Calling all romantics and rebels, our Jet Set 6 ankle boot was made for you. http://t.co/adm4R3N4ws #JetSetGo http://t.co/jGPIlMDIqq","fashion"
"46","Musicals, comedy, drama‚Äîwhat‚Äôs on the top of your must-see list? #WhatsInYourKors","fashion"
"47","The star of the show? Our Cynthia satchel. http://t.co/kGcu7HkK9r #WhatsInYourKors http://t.co/6exI3rwXiJ","fashion"
"48","Rose-gold hues give evening glamour a romantic twist. #StyleTip","fashion"
"49","The one to watch‚ÄîDarci is a total charmer. http://t.co/NbSX2WcfmP #WhatsInYourKors http://t.co/dRWev0hGvj","fashion"
"50","We‚Äôre making evening elegance easy. http://t.co/WZ64xEMN2D #WhatsInYourKors http://t.co/SW8JoZqq5D","fashion"
"51","Get your Spring fix early‚Äîshop the new collection today at @Bergdorfs! https://t.co/krNHBZ5gnv","fashion"
"52","A phone and card case in one, this is bound to make repeat performances. http://t.co/8HqquyIEmv  #WhatsInYourKors http://t.co/VRM2jbhGKi","fashion"
"53","A ring with this much sparkle is a guaranteed crowd-pleaser. http://t.co/R5DweOThyv  #WhatsInYourKors http://t.co/uDUe3OwowT","fashion"
"54","Great theater can transport you to a different time, a different place, a different life‚ÄîI love it. ‚ÄìxxMK","fashion"
"55","Craving a little drama? Our new #WhatsInYourKors can help with that. http://t.co/orJhbpBXJl http://t.co/KH7U4Y71KQ","fashion"
"56","Beat the Sunday blues‚Äîtake a trip to Paris with @LilyAldridge and our Jet Set 6! http://t.co/di1c3GMVB5 #JetSetGo http://t.co/AeFOgk57JJ","fashion"
"57","The Jet Set 6 collection‚Äîsix snap-worthy shoes to carry you through the season. http://t.co/Ht9WzXLGDs #JetSetGo http://t.co/sjke31ak3L","fashion"
"58","Our Woods ankle boot is totally on point for fall. http://t.co/GwW49t5fgP #JetSetGo http://t.co/MoQeYS30eq","fashion"
"59","A pointed-toe ankle boot gives fall favorites an edgy-chic appeal. #StyleTip","fashion"
"60","Shoe-la-la: @LilyAldridge test-drives our Jet Set 6 shoes on the streets of Paris. http://t.co/jw3If3pbO4 #JetSetGo http://t.co/h3npm29UhO","fashion"
"61","Put your best foot forward this fall‚Ä¶ http://t.co/EI3CEhKj8N #JetSetGo http://t.co/ORERNIEto5","fashion"
"62","A pair of strappy golden sandals will give you legs for days. #StyleTip","fashion"
"63","Need a fall style update? Our Jet Set 6 shoe collection has you covered. http://t.co/BIBHdmmCAU #JetSetGo http://t.co/3JvZWQKpn7","fashion"
"64","One last look at our Spring 2016 show before we jump back into fall! http://t.co/Bq4nwwsrXT #AllAccessKors #NYFW http://t.co/6nbYPKIvAn","fashion"
"65","Coats and jackets are a great investment because almost every city in the world is now super casual. ‚ÄìxxMK #AllAccessKors #NYFW","fashion"
"66","Street style is in the bag when you‚Äôve got our Collins stud. http://t.co/sYqaJu5oID #AllAccessKors #NYFW http://t.co/jIL9CEMTay","fashion"
"67","It‚Äôs officially leather weather‚Äî@ChiaraFerragni during #NYFW. http://t.co/6bZZocdUlC #AllAccessKors http://t.co/LMnbGq3jmA","fashion"
"68","Looking graphically glamorous on-the-go: @GalaGonzalez before our show. http://t.co/9CkciUnEVk #AllAccessKors #NYFW http://t.co/wDRELxhRmC","fashion"
"69","Street style chic: @MichelleSalasB in our grommeted shirtdress during #NYFW. http://t.co/psvyPdMGjo #AllAccessKors http://t.co/w9t60WpBlZ","fashion"
"70","I think the world needs a little romance. ‚ÄìxxMK #AllAccessKors #NYFW","fashion"
"71","Red hot: @SofiaVergara in a look from our Transeason collection. #FameFrame http://t.co/95iIXHoqTQ","fashion"
"72","Texture gives spring‚Äôs florals a whole new feel in our Spring collection. http://t.co/xRLzNIPqYg #AllAccessKors #NYFW http://t.co/sN6XGGr8up","fashion"
"73","Thank you @THR @Pretareporter‚Äîwe love being one of your covers! #RedCarpet25  https://t.co/OmKnGcYgBI","fashion"
"74","The dynamic duo: Michael Kors and @BlakeLively on the cover of @THR‚Äôs Red Carpet issue. http://t.co/fOJ88JYYfb http://t.co/lJniEw5Q6U","fashion"
"75","The sexiest thing is when blouses or dresses slide and move. ‚ÄìxxMK #AllAccessKors #NYFW http://t.co/Tp3VjYK2ua","fashion"
"76","Behind-the-scenes: @KendallJenner strikes a pose before the runway. http://t.co/SiVomAZ1no #AllAccessKors #NYFW http://t.co/q5k4ml4x1i","fashion"
"77","Missed our Spring runway show? Or just want to see it again? See it all in 60 seconds! http://t.co/i95ym5ICTz #AllAccessKors #NYFW","fashion"
"78","Poetic license: an embroidered skirt and poet blouse from Spring 2016. http://t.co/iuS38732r6 #AllAccessKors #NYFW http://t.co/W8MoFjpaOp","fashion"
"79","Model moment: Ryan Keating, Piero Mendez and @LuckyBSmith after our show. http://t.co/EwENxPfdvq #AllAccessKors #NYFW http://t.co/D6wrap3C3K","fashion"
"80","Pretty in print: @HanneliM outside our show. See more street style here: http://t.co/uH9kDkb5os #AllAccessKors #NYFW http://t.co/7jZ57wNJy6","fashion"
"81","Ahead of the pack‚Äî@KendallJenner leads the finale walk. http://t.co/1BiMh6EnJQ #AllAccessKors #NYFW http://t.co/I44QmamTyk","fashion"
"82","We‚Äôre holding on to the last bits of summer with @VogueMagazine and @GigiHadid. http://t.co/RZUlhvIbVk http://t.co/w56UyF5HF9","fashion"
"83","What a bathing beauty! @GiGiHadid @mariotestino @voguemagazine  https://t.co/CxAWipVxfN","fashion"
"84","The crossbody gets a sleek, streamlined spin for spring. http://t.co/vDEPh0WpM9 #AllAccessKors #NYFW http://t.co/GBHU8s0KWk","fashion"
"85","A picture of beauty behind-the-scenes of Spring 2016. http://t.co/wQOTGKgjZJ #AllAccessKors #NYFW http://t.co/6zVjxvB5BE","fashion"
"86","I wanted to take the structure out of tailored pieces. ‚ÄìxxMK #AllAccessKors #NYFW http://t.co/1bVbwHwrqs","fashion"
"87","A fresh crop‚Äîjust in for Spring 2016. http://t.co/v9vVfLezLa  #AllAccessKors #NYFW http://t.co/GoFiu9E4rz","fashion"
"88","A cut above: Amy Poehler on the #Emmys red carpet. #FameFrame http://t.co/KHJuRT78wX","fashion"
"89","Chic and repeat: Amanda Peet in Michael Kors Collection. #Emmys #FameFrame http://t.co/o21PqrUUKW","fashion"
"90","Front row fun with @THEMISSHAPES and @DelevingnePoppy. http://t.co/bhkdlKM7z0 #AllAccessKors #NYFW http://t.co/ByLrHKzBjP","fashion"
"91","A romantic blouse is a must-have for spring. ‚ÄìxxMK #AllAccessKors #NYFW","fashion"
"92","A little bit of sheer indulgence is always in. http://t.co/dCrQ0Flf4a #AllAccessKors #NYFW http://t.co/IyklceHumP","fashion"
"93","We ‚ù§Ô∏è @DelevingnePoppy in a pop of color too @InStyleMag! #AllAccessKors #NYFW https://t.co/d7GT0HzLev","fashion"
"94","Ladies in red: romance is in the air for spring. http://t.co/LLLjN9Ixl9 #AllAccessKors #NYFW http://t.co/F1mNH0t3Dh","fashion"
"95","Because sometimes fashion is black and white. http://t.co/lZBtKw1Eec #AllAccessKors #NYFW http://t.co/TBhfjhSORG","fashion"
"96","Fit to print: @LilyAldridge, Laura Love , @HarleyVNewton and @AmberLeBon. http://t.co/FuSJpSFUxO #AllAccessKors #NYFW http://t.co/GGkJqssAic","fashion"
"97","The leader of the pack‚Äî@KendallJenner. http://t.co/kQtcsKMOfL #AllAccessKors #NYFW http://t.co/Mn3irlb0NV","fashion"
"98","I'm an optimist, so I‚Äôm always thinking blue skies ahead. ‚ÄìxxMK #AllAccessKors #NYFW","fashion"
"99","Dress obsessed: we‚Äôre into the blue for Spring 2016. http://t.co/a59Wf9JMsh #AllAccessKors #NYFW http://t.co/nUAApNg2Bd","fashion"
"100","Play your cards right: a morning message from Michael. http://t.co/u1CtiKwiFE #AllAccessKors #NYFW http://t.co/CrtRGO17cj","fashion"
"101","The name on everyone‚Äôs lips: @KendallJenner at our Spring 2016 show. http://t.co/fjgWx4DCyZ #AllAccessKors #NYFW http://t.co/dh8SahG4G7","fashion"
"102","A match made in fashion heaven, @amberlebon @DelevingnePoppy! #AllAccessKors #NYFW https://t.co/TlLdOaA0mc","fashion"
"103","Say chic! Front row fun with @HanneliM, @LilyAldridge and @HarleyVNewton. http://t.co/9pvk8LGLwE #AllAccessKors #NYFW http://t.co/7T9Ij9RvoN","fashion"
"104","Stroke of genius: @DickPageFace gives models backstage a natural glow. http://t.co/L4oLn21M6T #AllAccessKors #NYFW http://t.co/D7eGd03c2A","fashion"
"105","Two of a kind: @OliviaWilde and @KendallJenner backstage. http://t.co/QXXJA2q1eY #AllAccessKors #NYFW http://t.co/f8XokIyvdr","fashion"
"106","All smiles before the show! http://t.co/rBQjWfOLKp #AllAccessKors #NYFW http://t.co/AxvZjZWAmy","fashion"
"107","This season I was thinking about strong, creative women who have a sort of natural glamour. ‚ÄìxxMK #AllAccessKors #NYFW","fashion"
"108","The divinely dressed guests of the front row. http://t.co/NAmEntN8oO #AllAccessKors #NYFW http://t.co/NApsDWqNuS","fashion"
"109","It‚Äôs good to be Lucky‚Äî @LuckyBSmith with @FeiFeiSunSun and Vanessa Moody. http://t.co/A8zCA2Isu0 #AllAccessKors #NYFW http://t.co/hTeh7qFHeg","fashion"
"110","Give it a twirl. http://t.co/7BtJ0BbBOV #AllAccessKors #NYFW http://t.co/VFxFBzonfn","fashion"
"111","Face-to-face with @ImaanHammam in a look from Spring 16. http://t.co/7BtJ0BbBOV #AllAccessKors #NYFW http://t.co/uFoxXMikD2","fashion"
"112","A model moment with @KendallJenner. http://t.co/LUK0UtMqyM #AllAccessKors #NYFW http://t.co/5BHMJpjzdt","fashion"
"113","A pretty pair. http://t.co/H5smUdU0jx #AllAccessKors #NYFW http://t.co/eH9s7kKnA1","fashion"
"114","Poppies that pop‚Äîa peek behind-the-scenes of Spring 2016. http://t.co/H5smUdU0jx #AllAccessKors #NYFW http://t.co/vOPr1QytvO","fashion"
"115","Taking a hands-on approach for Spring 2016. http://t.co/H5smUdU0jx #AllAccessKors #NYFW http://t.co/9G727M7qKU","fashion"
"116","You're always a ray of Ì†ºÌºû @OliviaWilde. http://t.co/qHzLGFt4iP #AllAccessKors #NYFW","fashion"
"117","Hair...style. http://t.co/H5smUebBI7 #AllAccessKors #NYFW (Ì†ΩÌ≥∑: @intothegloss) http://t.co/TvRgn95Uab","fashion"
"118","I wanted to take the idea of elegance and turn it into something that is earthy, tactile and textured. ‚ÄìxxMK","fashion"
"119","The halo effect. http://t.co/H5smUebBI7 #AllAccessKors #NYFW http://t.co/KWHnnd38Re","fashion"
"120","Pre-show prep from all sides. http://t.co/H5smUebBI7 #AllAccessKors #NYFW http://t.co/KX6jp9RfjT","fashion"
"121","Ready, set, glow‚Äî@KendallJenner. http://t.co/H5smUebBI7 #AllAccessKors #NYFW http://t.co/U0ZIHcAqtX","fashion"
"122","‚Ä¶Natural Glamour. #AllAccessKors #NYFW","fashion"
"123","The feminine flourishes of tiers and Chantilly lace‚Ä¶ #AllAccessKors #NYFW","fashion"
"124","Sun-kissed shades of sand, nutmeg, vanilla, sky and straw‚Ä¶ #AllAccessKors #NYFW","fashion"
"125","The low-slung shoulder bag and crushable drawstring pouch‚Ä¶ #AllAccessKors #NYFW","fashion"
"126","Perforated suedes and textured python mixed with liquid silks, crushed cottons and crinkled gauze‚Ä¶ #AllAccessKors #NYFW","fashion"
"127","Rugged, strappy sandals and easy, flat slides‚Ä¶ #AllAccessKors #NYFW","fashion"
"128","The sensuous attitude of clothes that wrap, tie and slide‚Ä¶ #AllAccessKors #NYFW","fashion"
"129","Delicate pleating and slashed skirts that catch the wind‚Ä¶ #AllAccessKors #NYFW","fashion"
"130","Romantic softness juxtaposed with relaxed tailoring‚Ä¶ #AllAccessKors #NYFW","fashion"
"131","Spring 2016‚Ä¶Earthy Elegance‚Ä¶ #AllAccessKors #NYFW","fashion"
"132","Rise and shine‚Äîit‚Äôs showtime. ‚ÄìxxMK #AllAccessKors #NYFW","fashion"
"133","Oh snap! From backstage to the front row, catch it all on Snapchat. Follow @MichaelKors Ì†ΩÌ±ª #AllAccessKors #NYFW http://t.co/HgCneErLys","fashion"
"134","Here to make Wednesday a little more glamorous‚Äîwatch our #NFYW runway show live, wherever you are! http://t.co/H5smUdU0jx #AllAccessKors","fashion"
"135","A stylish sprint to the finish line‚Äîtake your front row seat now: http://t.co/nU9FRNfyoh #AllAccessKors #NYFW http://t.co/KodtGx0w16","fashion"
"136","Pretty predictions: what are you hoping to see on tomorrow‚Äôs runway? #AllAccessKors #NYFW","fashion"
"137","Keep your eyes on the prize. http://t.co/ka07kxkJW4 #AllAccessKors #NYFW http://t.co/XfZswpZFXB","fashion"
"138","Fueling up for the final stretch. http://t.co/UENJeW5G8I #AllAccessKors #NYFW https://t.co/iPxYMqwWwP","fashion"
"139","No street style look is complete without a fabulous pair of sunglasses. #StyleTip","fashion"
"140","You lit up the night @HaileeSteinfeld!  https://t.co/RbAhvPhitn","fashion"
"141","All hail fashion week. http://t.co/Himp3kitdp #AllAccessKors #NYFW http://t.co/Hb8TePvDfE","fashion"
"142","Getting swept away in the Rush to the Runway. http://t.co/NHBZXwtmkg #AllAccessKors #NYFW http://t.co/mFnhonmgh0","fashion"
"143","I always think that the middle of the decade really determines the mood. -xxMK","fashion"
"144","Leigh Lezark and @DerekBlasberg catching the beat with @HarleyVNewton. #FlashYourGold http://t.co/ZbCyy6j0I5","fashion"
"145","Golden girl @DevWindsor stops by the gold carpet on her way into the party. #FlashYourGold http://t.co/V7OxGC19Dx","fashion"
"146","Double trouble: Tao Okamoto and @JLJablonski strike a pose. #FlashYourGold http://t.co/klmZ6nDlVV","fashion"
"147","The man and his muses: @Jaime_King, @Mario_Testino and @KateUpton at last night‚Äôs event. #FlashYourGold http://t.co/rWW09u7Q6M","fashion"
"148","We're with the band‚Äî@DuranDuran performing at our #FlashYourGold party. http://t.co/rCecXWq9ue","fashion"
"149","Love this peek behind-the-scenes @Zendaya! https://t.co/6iizIT0Cpr","fashion"
"150","A golden night. -xxMK #FlashYourGold","fashion"
"151","Rocking the red carpet! #FlashYourGold https://t.co/npV83u5dnK","fashion"
"152","The street style, the runway reveals, the celebrities‚Äîwhat do you look forward to most during #NYFW? #AllAccessKors","fashion"
"153","When it comes to #NYFW, we believe in survival of the chicest. http://t.co/2Mz87D4CBS  #AllAccessKors http://t.co/pWiW0x1Vrq","fashion"
"154","A really great pair of sneakers is a New York City essential. #StyleTip","fashion"
"155","Full speed ahead‚Äîfashion week is here! http://t.co/YRYLcVpdv6 #AllAccessKors #NYFW https://t.co/MfNuMiHhMo","fashion"
"156","We're counting down the seconds to our Spring 2016 Runway Show‚ÄîRSVP today! http://t.co/JDSMX4UcLt #AllAccessKors #NYFW","fashion"
"157","Stay on track‚Äîhere‚Äôs what you need to know about our Spring show. http://t.co/7TGgpC5sDC #AllAccessKors #NYFW http://t.co/vQUftfagfI","fashion"
"158","Fashion is a marathon, not a sprint. ‚ÄìxxMK #AllAccessKors #NYFW","fashion"
"159","Calling all fashion lovers‚Ä¶ http://t.co/tZcoPuhaAg #AllAccessKors #NYFW http://t.co/bVn5xeej7q","fashion"
"160","The clock is ticking‚Ä¶RSVP to our Spring Runway Show now!  http://t.co/nbVw245ksj #AllAccessKors #NYFW","fashion"
"161","New York Fashion Week is the ultimate rush. http://t.co/Z2fQmzEJtQ #AllAccessKors #NYFW https://t.co/VvGKMNU6jJ","fashion"
"162","To work in fashion today you need the endurance of an athlete. ‚ÄìxxMK #AllAccessKors #NYFW","fashion"
"163","When it comes to fashion week, there's no such thing as overpacking! http://t.co/1Zu2zDRKAk @KarlieKloss @VogueMagazine #NYFW","fashion"
"164","When you plan your look, what comes first‚Äîthe shoes or the clothes? #JetSetGo","fashion"
"165","Run don‚Äôt walk‚Äîevery pair in our fall Jet Set 6 Collection can be yours now! http://t.co/zgWL4s5ena #JetSetGo http://t.co/3mFaPxmzWU","fashion"
"166","Watch @LilyAldridge take on the cobblestone streets of Paris in our latest Jet Set 6 shoe collection! http://t.co/9bUBlsUpaL #JetSetGo","fashion"
"167","The shoe changes your whole look. -xxMK","fashion"
"168","Knit wit: here‚Äôs everything you need to know about our Aran sweater. http://t.co/7b3VKoDihm #AutumnLuxe http://t.co/9M9ckd4dXC","fashion"
"169","Keep your essentials by your side, in style, all season long. http://t.co/ZckXKMAsxC #AutumnLuxe http://t.co/8v2O1dpQak","fashion"
"170","A Bordeaux crossbody or watch is the easiest way to add fall‚Äôs must-have color to your wardrobe. #StyleTip","fashion"
"171","What we're watching: @GalMeetsGlam and our fave fall pieces in San Francisco. http://t.co/L5cUbgqter #PerfectTiming http://t.co/ExF8W4ahwy","fashion"
"172","This has us dreaming of the West Coast! @WhoWhatWear #PerfectTiming https://t.co/YeQIGhXhjg","fashion"
"173","If you could pick just one thing from our fall collection‚Äîwhat would it be? #AutumnLuxe","fashion"
"174","It‚Äôs about the little things in life... http://t.co/bAMxGvRATe #AutumnLuxe http://t.co/fLssDIfQcX","fashion"
"175","A suede wedge is fall‚Äôs wear-anywhere, walk-anywhere shoe. #StyleTip","fashion"
"176","The forecast for fall? 100% chance of chic, thanks to our new must-have coats. http://t.co/7psJ8nw5ul #AutumnLuxe http://t.co/tuUCMjMZcL","fashion"
"177","The denim debate: high-waisted flairs vs. wide-leg culottes ‚Äî go! #AutumnLuxe","fashion"
"178","We‚Äôve pinned down some of the chicest destinations in the world‚Äîjust for you: http://t.co/GvrF8cxCob #JetSetGo","fashion"
"179","As summer comes to an end, we're dreaming of denim culottes for crisp fall days. http://t.co/EZzRrUNqqw #AutumnLuxe http://t.co/b6wPqAp1Vb","fashion"
"180","There‚Äôs nothing better than a few days in the sand and sun. Happy Labor Day! ‚ÄìxxMK","fashion"
"181","Get swept away to the City of Light with our new Fall catalog. http://t.co/CnObyvo5Zj #AutumnLuxe http://t.co/pU0ff4KOZK","fashion"
"182","Playing the field with our Jamie saddle bag. http://t.co/kVgzKp4y4s #AutumnLuxe http://t.co/CYjFu0DQX0","fashion"
"183","Change is in the air‚Äîfind your new favorite watch on Tumblr: http://t.co/RPcfiQgIZV #PerfectTiming","fashion"
"184","Fall‚Äôs shopping list: something suede, something denim, something burgundy, something new. #StyleTip","fashion"
"185","Down to the details. http://t.co/jBHId56hFb #AutumnLuxe http://t.co/Talrb7jFQs","fashion"
"186","Edgy jewelry + chic staples = a serious style statement. #StyleTip","fashion"
"187","Jet, set, go‚Äîthe coast or the country for Labor Day? #AutumnLuxe","fashion"
"188","Details that make a major impact‚Äîjust in time for the long weekend. http://t.co/Kre6jVPuQI #PerfectTiming http://t.co/4drfm0G4Ji","fashion"
"189","The Greenwich bucket‚Äîtailor-suede for fall. http://t.co/0U2qvjOgWr #AutumnLuxe http://t.co/sDlgq59cpX","fashion"
"190","A streamlined bucket bag is the new crossbody. #StyleTip","fashion"
"191","Michael tells us what you need right now to feel glamorous on the go. http://t.co/20ajUY98VZ #AutumnLuxe","fashion"
"192","Extras that work overtime‚Äîup now on Girl‚Äôs Guide to Watches. http://t.co/hsMOkHV3YB #PerfectTiming http://t.co/eNq00cTkxk","fashion"
"193","A leather band watch with a sophisticated dial is the essence of laid-back luxury. ‚ÄìxxMK","fashion"
"194","Our two-tone Sutton is making fashion-lovers everywhere do a double-take. http://t.co/IdAUEUODHC #AutumnLuxe http://t.co/1m3lztq9WO","fashion"
"195","In a flash: Meet the star of our Fall collection campaign. http://t.co/c4CmGBtvbF #AutumnLuxe http://t.co/Nonm6IytKO","fashion"
"196","Don't even think about storing your white jeans‚Äîthey‚Äôre beyond chic in the dead of winter. ‚ÄìxxMK","fashion"
"197","All of our favorite fall looks‚Äîall in one place. The MICHAEL Michael Kors Fall Lookbook is here: http://t.co/CoJyp8LywV #AutumnLuxe","fashion"
