"","user","type"
"410","For me, every day is National Sunglasses Day. ‚ÄìxxMK","fashion"
"411","The green light: @AngelAlessandra at our #KorsPanama event in a dress from Spring! http://t.co/4itLIKpfl3","fashion"
"412","We found your sole-mates: http://t.co/DXBMNlzztP #JetSetGo","fashion"
"413","You‚Äôve got mail: our envelope clutches are the perfect match all summer long. http://t.co/AHszI5VDu6 #sunkissed http://t.co/x4q94UqfIw","fashion"
"414","Cruise into the season with a little extra glamour: http://t.co/99f1sf3E67 #PerfectTiming http://t.co/9hyVv2qowm","fashion"
"415","Swap out your leather tote for a raffia version to instantly lighten up your look. #StyleTip","fashion"
"416","The chicest game ever played: @GigiHadid and Michael Kors face-off: http://t.co/knD4u51hri #GlamourGames","fashion"
"417","Summer‚Äôs essential bag debate is all squared away‚Äîmeet Mila. http://t.co/65Sp7wR9JU #sunkissed http://t.co/SIStgZn0A2","fashion"
"418","A glamorous journey around the globe is only a click away‚Ä¶ http://t.co/cG038y3shj  #sunkissed","fashion"
"419","I believe in summer cashmere, no matter what. -xxMK","fashion"
"420","A sun-kissed staycation or glamorous getaway‚Äîwhat‚Äôs your dream summer escape? #sunkissed","fashion"
"421","Causing double-takes everywhere: the Susannah bag. http://t.co/0P5IZq0qvi #sunkissed http://t.co/qyDi85r8yb","fashion"
"422","Our Kinley watch‚Äîwhen time is of the essence. http://t.co/nWvGeC0w4f #PerfectTiming http://t.co/HipLiVyDpf","fashion"
"423","Up-to-the-minute must-haves for every sunny adventure. http://t.co/Ecig2kcNqL #PerfectTiming","fashion"
"424","Effortless style can be yours‚Äîjust take a look at our boards! http://t.co/1JBnofl5kT #sunkissed","fashion"
"425","We‚Äôre making summer dressing a breeze‚Ä¶ http://t.co/0hFVfUF0ap #sunkissed http://t.co/MDgCxakaOx","fashion"
"426","There‚Äôs nothing more glamorously romantic than a caftan that‚Äôs blowing in the wind. ‚ÄìxxMK","fashion"
"427","An inside look at how the @WFP School Meals program is changing this family‚Äôs life: http://t.co/jBeewqXEyi #WatchHungerStop","fashion"
"428","Trim is in‚Äîour studded Selma wakes up summer‚Äôs sporty neutrals. http://t.co/7Nub9KeVK4 #JetSetSelma http://t.co/uy8LkAesWW","fashion"
"429","Summer stripes are always right. #StyleTip","fashion"
"430","The must-have of the moment: our Audrina watch. http://t.co/Qx8NPdy3tV #PerfectTiming http://t.co/LdK93YtWhM","fashion"
"431","With a gift this great, he won‚Äôt care if it‚Äôs late: http://t.co/8qcGJqrHUJ #ToTheMan http://t.co/1SeLzPEnp1","fashion"
"432","In celebration of Father‚Äôs Day, we want to know‚Äîwhat‚Äôs the best gift you ever gave Dad? #ToTheMan","fashion"
"433","#ToTheMan who pays attention to detail‚Äîwe‚Äôve found the perfect gift(s): http://t.co/TZxlmaXrhf http://t.co/Gyvo7bTRKc","fashion"
"434","Happy Father's Day from Michael Kors! #ToTheMan","fashion"
"435","Our Evie sandal is here to help elevate every look. http://t.co/1OBeFhivyT #JetSetGo http://t.co/GsoV8mILa4","fashion"
"436","The Smythe satchel is going to be by your side all summer long. http://t.co/w1KuTN8I9C #sunkissed http://t.co/lIVbFE3ZLp","fashion"
"437","Still searching for the perfect gift for Dad? Look no further. http://t.co/w5S9OhYXIa #ToTheMan","fashion"
"438","Game-changing pieces: the polished track pant, the lightweight tailored coat and the slip-on sneaker. #StyleTip","fashion"
"439","London calling: @LookDePernille takes a spin around the English capital. http://t.co/fS6cU5cjrh #JetSetLondon http://t.co/DVmtax3gt0","fashion"
"440","Prepare to be obsessed: the modern mule. http://t.co/euFCaCVLwB #JetSetGo http://t.co/ahXBK3sS48","fashion"
"441","Father‚Äôs Day gift ideas for days... http://t.co/821FwytfaH #ToTheMan","fashion"
"442","It‚Äôs going to be a long haute summer. http://t.co/UxYVsrCttS #sunkissed http://t.co/wYz495zAvk","fashion"
"443","The best accessory, regardless of the look, is confidence. ‚ÄìxxMK","fashion"
"444","Father‚Äôs Day is this Sunday! What do you have planned? #ToTheMan","fashion"
"445","#ToTheMan who is as comfortable barefoot as he is in a button down. http://t.co/pWRf21kOp6 http://t.co/MmievvEpaJ","fashion"
"446","That‚Äôs a wrap‚Äîwe‚Äôve found the best gifts for dad. http://t.co/3bnZTb7wVa #ToTheMan http://t.co/o8VtQqvZ9i","fashion"
"447","A white blazer in summer is everything. ‚ÄìxxMK","fashion"
"448","Trend report: Finished with a bow. http://t.co/a2TZ77ZeLp #sunkissed","fashion"
"449","Get ready to start a chain reaction: http://t.co/K4pcZ7uSa2 #sunkissed http://t.co/k7nExUaynx","fashion"
"450","Slip into something a little more sophisticated‚Ä¶http://t.co/F0Wa6gDOlb #JetSetGo http://t.co/MhD3Edhwoz","fashion"
"451","The summer standby? Head-to-toe pattern. #StyleTip","fashion"
"452","Party time! How to make waves at every summer soir√®e: http://t.co/xhmRv9iNCU #PerfectTiming http://t.co/IOiiP0c1Mn","fashion"
"453","The man who does it all, deserves it all. Shop gifts today: http://t.co/PCVbfumYIR #ToTheMan http://t.co/i99bPrBcfY","fashion"
"454","Our go everywhere totes‚Äîtake a look: http://t.co/yUJmJSB0K7 #sunkissed http://t.co/XkdI4hV0Ez","fashion"
"455","I love sun-kissed skin‚Äîit goes with everything. ‚ÄìxxMK","fashion"
"456","Cheeseburgers and Britney Spears soon, @GiGiHadid!  https://t.co/by7nab2zff","fashion"
"457","You don‚Äôt have to be late to be fashionable. http://t.co/mXZSQlnIvw #PerfectTiming http://t.co/cVzbcY997W","fashion"
"458","Spotlight On: The handbag shape you need now. http://t.co/YXMut9op3f #sunkissed","fashion"
"459","The Marina bag‚Äîcasually cool for a day by the pool. http://t.co/oQe8aGE3pZ #sunkissed http://t.co/QEL0TF7xqz","fashion"
"460","You should always invest in denim‚Äîit‚Äôs not going anywhere. ‚ÄìxxMK","fashion"
"461","The slip-on sneaker has found its high-fashion footing: http://t.co/axd02uKqjw #JetSetGo http://t.co/s7a8t6xVMx","fashion"
"462","My community, my story: our newest series dedicated to raising awareness about @WFP‚Äôs School Meals. http://t.co/fzJGt6Xtfb #WatchHungerStop","fashion"
"463","This Father‚Äôs Day, give him the luxury of time. http://t.co/lMiDuXfuin #ToTheMan http://t.co/owKuh17FLC","fashion"
"464","A rich tie-dye print gives summer dresses an of-the-moment free-spirited flair. #StyleTip","fashion"
"465","We love @luvalyssamiller‚Äôs laid-back glamour in @VogueMexico. http://t.co/yq8sEVmfyJ","fashion"
"466","The Sutton satchel‚Äîhere to put a polished spin on summer essentials. http://t.co/vWcKftgOSn #sunkissed http://t.co/B1GizaB7lL","fashion"
"467","This year‚Äôs tennis favorites? Electric blue takes center court. http://t.co/y08lsHbax8 #WhatsInYourKors http://t.co/2zFjYYCDIa","fashion"
"468","A checked print makes any look a little more modern without being over-the-top trendy. #StyleTip","fashion"
"469","Orange you glad‚Ä¶we have flash lens shades! http://t.co/U9IPoNPEES #WhatsInYourKors http://t.co/VAjUszXaYU","fashion"
"470","Anyone for doubles? Tell us‚Äîwho is your dream tennis partner? #WhatsInYourKors","fashion"
"471","A perforated suede slip-on for spot-on sporty cool. http://t.co/TQdjE4cYe5 #JetSetGo http://t.co/CV1AgiPWV7","fashion"
"472","A crochet dress embodies bohemian glamour. #StyleTip","fashion"
"473","Which tennis star‚Äôs wardrobe would you want to copy? #WhatsInYourKors","fashion"
"474","Go for the gold‚Äîand white! http://t.co/zpHGvMxtDF #WhatsInYourKors http://t.co/Gfky3z16X9","fashion"
"475","Game on: @GigiHadid and Michael Kors compete in the first-ever #GlamourGames! http://t.co/kKcTYbVlqO","fashion"
"476","The simple white tee, reinvented. http://t.co/IMI8NLpeGI #sunkissed http://t.co/FRzAyb89a6","fashion"
"477","Optic white and gold sneakers give any outfit a luxe athleisure touch. #StyleTip","fashion"
