"","user","type"
"881","Save our soils! How to rescue Earth's vital top layer ","technology"
"882","Forecast on Pluto shows blue skies, but water ice underfoot. ","technology"
"883","Saliva test claims to predict male sexual orientation - and researcher quits over misuse fears ","technology"
"884","A digital version of a piece of rat brain has been made. And it fires like the real thing ","technology"
"885","Win a Haynes manual for the Voyager spacecraft: ","technology"
"886","Gay or straight? A spit test can now predict male sexual orientation - but there are issues ","technology"
"887","Now we know why elephants almost never get cancer ","technology"
"888","Meet the robber ants: an entirely new caste of ant ","technology"
"889","The science behind the ""Superman stance"", and other confidence-boosting tricks ","technology"
"890","14 ways the UK has backtracked on climate pledges this year ","technology"
"891","""Hey, Siri, it's me"". Our smartphones can now use our voices to identify us. Now what? ","technology"
"892","Best forgotten: we can’t let a discredited psychotherapy return to wreck lives ","technology"
"893","Code is poetry, and it's not just coders who say so - some poets agree #nationalpoetryday ","technology"
"894","Flu drugs like Tamiflu work and are needed during pandemics - experts agree  ","technology"
"895","There's a resurgence in therapy that unearths ‘forgotten’ memories - it can be risky ","technology"
"896","Migraines are triggered by the protein deep in the brain that controls facial sensations ","technology"
"897","After the apocalypse, how will we access the world's information? ","technology"
"898","How far beyond the visible spectrum does a rainbow extend? It depends which planet you're on. The Last Word: ","technology"
"899","14 ways the UK has backtracked on climate pledges this year ","technology"
"900","Post-apocalpyse, how will anyone be able to access our data? These guys have a plan ","technology"
"901","Here's how science could help spot the warning signs and prevent mass shootings ","technology"
"902","A monster El Niño is here. The world is rushing to prepare and the worst is yet to come ","technology"
"903","Discover the origins of modern humans in Sydney on 28 October with two fascinating speakers ","technology"
"904","Post-apocalpyse, how will anyone be able to access our data? There is one idea... ","technology"
"905","Cosmic microwave background is Einstein’s witness in the sky – but dark spectres haunt it ","technology"
"906","Volcanoes, hobbits, dragons - and a solar eclipse. We're offering the adventure of a lifetime ","technology"
"907","General relativity turns 100, save our soils, UK gov could face climate lawsuit, and more: ","technology"
"908","Special report: The UK is going backwards over climate change - and it could face a lawsuit ","technology"
"909","How science can help spot the warning signs and could prevent mass shootings ","technology"
"910","A real invisibility cloak for heat has helped a mouse (ok a toy one) vanish from snakes ","technology"
"911","Don't miss the first @newscilive careers advice event at @imperialcollege London on 10 Nov ","technology"
"912","As a monster El Niño looms, the world rushes to get ready ","technology"
"913","South Carolina floods are 'once in 1000 years' event - that climate change makes more likely ","technology"
"914","One does not simply walk into Mordor - or anywhere, as nobody agrees on what space is, or even if it exists ","technology"
"915","@sksilverman thanks! can't make them all fit in a tweet!","technology"
"916","Google Lunar X Prize just got an extension to 2017 ","technology"
"917","@Karl_MD just adding! thanks.","technology"
"918","7 DNA Nobels:1962 Watson-Crick1989 Catalysis2001 cell division2002 cell death2006 RNAi2009 protein2015 repair","technology"
"919","@cairdin thanks!","technology"
"920","7 DNA Nobels:1962 (Watson-Crick)1989 (RNA catalysis)2001 (cell division)2002 (cell death)2006 (RNAi)2009 (make protein) 2015 (repair)","technology"
"921","#Chemistry #Nobelprize awarded for the discovery of how DNA is repaired - millions of times every day ","technology"
"922","6 DNA Nobels:1962 (Watson and Crick)1989 (RNA catalysis)2001 (cell division)2002 (prog cell death)2006 (RNAi)2009 (making protein)","technology"
"923","Wildlife is thriving around Chernobyl since the people left ","technology"
"924","Work by #Nobelprize-winner Aziz Sancar suggests you should sunbathe in the morning for a safer tan #chemistry","technology"
"925","Lindahl, Modrich and Sancar get the gong ""for explaining how the cell repairs its DNA and safeguards the genetic information"" #Nobelprize","technology"
"926","and the #Chemistry #Nobelprize goes to... Tomas Lindahl, Paul Modrich and Aziz Sancar ""for mechanistic studies of DNA repair""","technology"
"927","Be part of space history and join the Principia Mission. Free resources for schools:","technology"
"928","Australian judges rule that the key part of a gene is the information stored in it, which is not an invention","technology"
"929","Australia’s high court rules that genes cannot be patented ","technology"
"930","An algorithm used to analyse earthquakes has been adapted to pick up tremors in the brain ","technology"
"931","Chernobyl is now a wildlife haven, teeming with deer, elk, boar and wolves ","technology"
"932","""Quantum indeterminism – what Einstein called 'God playing dice' – is an absurdity"" ","technology"
"933","Australia strikes down #gene #patents, with a stronger decision than the US courts ","technology"
"934","Breaking news: Gene patenting struck down by Australia's High Court ","technology"
"935","How should we treat robots? (our new column from @realavivahr: Not Like Us) ","technology"
"936","Are you a compulsive counter? You're not alone. But why do we develop these mental rituals? ","technology"
"937","Bad news for Facebook. An EU ruling means firms can’t send data to the US #safeharbour ","technology"
"938","How should we treat the robots we live with? (our new column from @realavivahr: Not Like Us) ","technology"
"939","Earthquake algorithm detects the brain's vibrations, helping to detect tumors ","technology"
"940","Expert witness on “shaken baby syndrome” faces misconduct charge ","technology"
"941","what exactly is space? And might it be an illusion? Watch our latest Explanimator to find out ","technology"
"942","Take a virtual hajj to experience Islam’s holiest city ","technology"
"943","Many aid workers are subject to sexual violence - how widespread is it? ","technology"
"944","This year's physics #Nobelprize discovery is passing through your body right now ","technology"
"945","Physics Nobel prize shared for discovering neutrinos can change flavour ","technology"
"946","Join @AlanStern @DidierQueloz @DrStuClark and 4 other amazing speakers at Instant Expert: Frontiers of Astronomy ","technology"
"947","Neutrinos have won twice as many physics Nobels as women - only Marie Curie (1903) and Maria Goeppert Mayer (1963) ","technology"
"948","The Large Magellanic Cloud - if van Gogh had painted it ","technology"
"949","There have been more Nobel Prizes for neutrinos (2015, 2002, 1995, 1988) than there are neutrino families #physics #NobelPrize","technology"
"950","So what did Takaaki Kajita and Arthur B. McDonald win their Nobel for? Let us explain: ","technology"
"951","The Nobel Prize in Physics goes to Takaaki Kajita and Arthur B. McDonald for discovery of neutrino oscillations, showing neutrinos have mass","technology"
"952","@pattym_ramirez Thank you for reading and flagging up.  This advertisement has been updated online ","technology"
"953","@NealHockley Thank you for reading and flagging up.  This advertisement has been updated online ","technology"
"954","Water trouble, from New York state to @Meeratweets 's India ","technology"
"955","A quantum calculation has been run in user-friendly silicon for the first time ","technology"
"956","An earthquake-sensing algorithm could detect the brain's vibrations, helping to detect tumors ","technology"
"957","Volcanic eruptions can change the flow of rivers - boosting it or slowing it to a trickle ","technology"
"958","This is the first example of a plant evolving to look like dung #mimic #beetles","technology"
"959","Wildlife is thriving around Chernobyl since the people left ","technology"
"960","An algorithm used to analyse earthquakes has been adapted to pick up tremors in the brain ","technology"
"961","Probability is as useful to physics as flat-Earth theory, says @DavidDeutschOxf ","technology"
"962","Beetle Sex with Spiky Penis wins Special Jury Award at Jackson Hole Wildlife Film Festival ","technology"
"963","You’re a crap mimic: plant evolves seed that tricks dung beetle ","technology"
"964","Is it OK to be obsessed with sex? #6 in our exploration of the normal mind ","technology"
"965","This year's #NobelPrize for medicine goes to drugs that improved the lives of 3.4 billion people worldwide ","technology"
"966","More than half of EU officially bans genetically modified crops #GMO ","technology"
"967","@sudhamshu yes, it's freely available now - enjoy!","technology"
"968","Congratulations to Youyou Tu on her #nobelprize #malaria #artemisinin ","technology"
"969","@joemuggs Thanks for spotting and flagging up. We're working on a bug fix.  Thanks again for reading New Scientist.","technology"
"970","Youyou Tu was inspired by a 1700-year-old book to develop a recipe for malaria drug artemisinin. #nobelprize ","technology"
"971","Meet Youyou Tu, the modest woman who beat malaria for China - and has just won a #NobelPrize ","technology"
"972","William Campbell, Satoshi Omura and Youyou Tu win 2015 #NobelPrize in Medicine for novel therapies for roundworm parasites and malaria","technology"
"973","@hannah__needham Thanks for reading and sharing! We hope you continue to enjoy reading New Scientist.","technology"
"974","A swimming robot is learning to work out what's unusual or interesting underwater ","technology"
"975","The mega-tsunami, 170 metres high ","technology"
"976","Forget trying to be normal, we should nurture our #neurodiversity ","technology"
"977","This underwater robot has curiosity software that looks for unusual and interesting things ","technology"
"978","Is it normal to hear voices in your head? Advice if you're worried: ","technology"
"979","The struggle for water and why science should call the shots - Fred Pearce on 3 new books ","technology"
"980","""Shunning the sun may be killing you in more ways than you think"" ","technology"
"981","The mellow season of autumn is changing forever - how does that look near you? #FallOfFall ","technology"
"982","A way to monitor nuclear reactors in Iran without sending inspectors   ","technology"
"983","Seen #TheMartian? Here’s the science of survival on Mars ","technology"
"984","Not all smokers die young. Studying why can teach us about longevity, says Morgan E. Levine ","technology"
"985","Ever felt confutrated? We're loving this #thatfeeling suggestion from @BenValsler  ","technology"
"986","Around the world, watt balances are bearing down on the measure of mass. Why? Let us explain ","technology"
"987","100 babies. No adults. One island. What would they become? ","technology"
"988","How many impossible things can you believe before breakfast? normal minds investigation #4 ","technology"
"989","Join New Scientist‘s first voyage of discovery to Indonesia to experience a total eclipse: ","technology"
"990","Ever found yourself roominating? A great #thatfeeling suggestion from @brianjstevenson ","technology"
"991","No such thing as normal, say we: let's celebrate the rise of the #neurodiversity movement ","technology"
"992","Stick a neutrino detector up close to a nuclear reactor to keep sneaky tabs on it ","technology"
"993","Rebooted pancreas cells could ease type 1 diabetes ","technology"
"994","@Ziggy_McKenzie None of these lectures we recorded, but here is a short video of a previous consciousness talk ","technology"
"995","Home-made digital clock sparks explosive overreaction, and Flavor Flav steps in ","technology"
"996","Step back Pluto, it's Charon's turn in the spotlight ","technology"
"997","Subscription sale! Subscribe to get this week’s issue online now and future weekly delivery ","technology"
"998","Cyclists gain advantage from schooling like fish ","technology"
"999","One of our favourite #thatfeeling suggestions - thanks to @rouleur66 ","technology"
"1000","Peeple app to review people... not a five-star idea ","technology"
"1001","What's the collective noun for a group of symbols? A ""crash""? ","technology"
"1002","""Gorilla"" fossil suggests humans split from chimps 2 million years earlier than we thought ","technology"
"1003","Volcanoes plus an asteroid might have been the one-two punch that finished off the dinosaurs ","technology"
"1004","@elliotclowes Thanks for flagging. Are you still experiencing this?  If so, can you send a screenshot to customerhelp@newscientist.com?","technology"
"1005","Are you normal? #3: Highly sensitive, psychopathic and points in between ","technology"
"1006","Guilty #thatfeeling Thanks to @biologizing ","technology"
"1007","Another #thatfeeling favourite - thanks to @ErinKernohan ","technology"
"1008","One of our favourites #thatfeeling Thanks to @_andrewtyrrell_ ","technology"
"1009","Is your mind normal? Here are 7 reasons it probably is ","technology"
"1010","How to measure anything. Bonus: we get to fix the foundations of science too ","technology"
"1011","Musicians’ brains fire symmetrically when they listen to music ","technology"
"1012","Psychedelic maps of Ceres could reveal secrets of its surface ","technology"
"1013","The physics of the peloton: How slow cyclists gain advantage from schooling like fish ","technology"
"1014","Asteroids or hellish Venus? NASA has to decide where to head for next ","technology"
"1015","Software can now comb social media to spread an activist group’s messages ","technology"
"1016","Is there something wrong with your attention span? IS THAT WHY YOU'RE DOING THIS NOW? ","technology"
"1017","Multiverses-in-a-box let us simulate the cosmos before we see it ","technology"
"1018","Earthquake artificial intelligence knows where damage is worst #AI ","technology"
"1019","Foam heart could pump inside you just like the real thing ","technology"
"1020","First digital map of ocean sediments shows the ocean locks up less carbon than thought ","technology"
"1021","""Pay people a living wage and watch them get healthier"" ","technology"
"1022","@Artifactorficti @okn0tok  @aeveltstra @byasgur @ellegist Sorry about that. The correct link is ","technology"
"1023","Are you normal? #1 Memory: is there something wrong with yours? ","technology"
"1024","@RubyJubilee Have you tried our app? Single issues are available Thanks for your interest!","technology"
"1025","Moss on Mars? Plant species engineered to make drugs for astronauts ","technology"
"1026","#TheMartian opened today in the UK: here’s our guide to sciencing the shit out of stuff ","technology"
"1027","Are you normal? #1 Memory: is there something wrong with yours? ","technology"
"1028","Fall of fall, multiverses-in-a-box,the problem with probability and, we ask, are you normal? ","technology"
"1029","The DJ frogs that sing like birds &amp; remix tunes on the hop Listen: ","technology"
"1030","Four future discoveries that could change us forever are revealed in our latest Explanimator video: ","technology"
"1031","The first digital map of ocean sediments has revealed a little surprise about carbon... ","technology"
"1032","This is the world's first artificial microflower. 10 micrometres across.","technology"
"1033","@VeniceLaura @Schroedinger99 @david_colquhoun Sorry about that, and thanks for pointing it out. We've corrected the article now.","technology"
"1034","@OrangeBlossomer Thanks for reading, subscribing, and sharing!","technology"
"1035","@megabren That sounds like a question for the Last Word. You can submit and get answers here: ","technology"
"1036","@bbroom01 Apologies for the delay in response. Are you still experiencing this? Can you screenshot &amp; send to customerhelp@newscientist.com?","technology"
"1037","Womb transplants are coming to the UK: here's what you need to know ","technology"
"1038","@ksenia_a_z Thanks for reading and sharing! We hope you continue to enjoy reading New Scientist.","technology"
"1039","@SimonCopland Thanks for your interest. You can follow our live tweets @newscilive during the event.","technology"
"1040","@Annabelwrites Thanks for reading and sharing, Annabel. We very much appreciate your connection with us.","technology"
"1041","@Richard07456 Thanks for reading and sharing! Much appreciated.","technology"
"1042","Who owns the biggest biotech advance of the century? ","technology"
"1043","Womb transplants are coming to the UK. Here’s why an old uterus is as good as a 20-year-old’s ","technology"
"1044","Floods that hit New York City every 500 years now hit every 24 #climatechange","technology"
"1045","Shell might be out of Alaska. But it's still got plans for elsewhere in the Arctic ","technology"
"1046","Tomorrow night in Melbourne - hear two experts explain one of evolution’s greatest mysteries ","technology"
"1047",".@POTUS: “We have not run out of stuff to make... products we haven’t even dreamed up yet” ","technology"
"1048","A different posture could let runners get a gravity boost- and potentially break world records ","technology"
"1049","The genes that protect smokers are one of the early findings from the Biobank - more will come ","technology"
"1050","VW scandal: Why corporate green claims need a new kind of scrutiny ","technology"
"1051","Shell might be out of Alaska - but it's still got plans for elsewhere in the Arctic ","technology"
"1052","New Urbanist: Why your windowsill will need its own address ","technology"
"1053","Why your windowsill will need its own address (the latest New Urbanist from @bldgblog) ","technology"
"1054","Today on #Explanimator: Four discoveries that would change everything Subscribe &gt;&gt; ","technology"
"1055","Gel scaffold paves way for 3D printing of biological organs ","technology"
"1056","Floods that hit New York City every 500 years now hit every 24 #climatechange  #NYC","technology"
"1057","Sex with a dead animal: most people say it's disgusting, but we need science to say why ","technology"
"1058","Nitrogen oxide has been inexplicably high in Europe. And VW's fraud tallies with the overshoot ","technology"
"1059","Professional athletes are running wrong. Here's how to use gravity to your advantage ","technology"
"1060","Liquid water spotted flowing on Mars. And Curiosity isn't far away ","technology"
"1061","With climate change, the types of flood that once soaked NYC every 500 years now come every 25 ","technology"
"1062","Cool video alert: Gel scaffold paves the way for 3D printing of biological organs ","technology"
"1063","We can now go to the right places on Mars to investigate the question of life ","technology"
"1064","Ancient treasures like this could be sacrificed to copper mining at Mes Aynak in Afghanistan ","technology"
"1065","Alfred McEwen: “the possibility of life in the subsurface of Mars has always been very high” ","technology"
"1066","Comet 67P is a slo-mo mash up - and its onion layers prove it #rosettawatch ","technology"
"1067","(of course, we knew about flowing water on Mars in 2006) ","technology"
"1068","@SciencePunk bleach","technology"
"1069","Wait - is that Matt Damon stumbling around there?  ","technology"
"1070","There's water in them thar Martian hills ","technology"
"1071","Liquid water spotted flowing on Mars. And Curiosity isn't far away ","technology"
"1072","NASA's major announcement: Liquid water has been spotted in these Martian hills. ","technology"
"1073","Today we're going to learn what this spectrometer on board the Mars Reconnaissance Orbiter has found","technology"
"1074","This snail is so tiny that ten can fit through the eye of a needle ","technology"
"1075","VW's cheat might explain why Europe is missing its emissions targets ","technology"
"1076","Nitrogen oxides in car exhaust kill tens of thousands in UK #Volkswagen ","technology"
"1077","Professional athletes are running wrong ","technology"
"1078","...talking of water on Mars, Matt Damon is a right clever clogs making his own   #TheMartian","technology"
"1079","There was also this, in 2011: Dark streaks on Mars bolster case for liquid water ","technology"
"1080","Water flows on Mars, before our eyes (major NASA announcement today, this story from 2006)","technology"
"1081","""I say old chap, is this cave taken?"" Early humans could hear frequencies used in speech ","technology"
"1082","This painting robot follows your eyes to create art ","technology"
"1083","A computer tried this maths problem, but its proof was the size of Wikipedia. Now humans have done better ","technology"
"1084","Here's how Volkwagen might have cheated. And how they could fix the problem ","technology"
"1085","Naming and shaming turned off funding for destructive mining. Rebooting morality: ","technology"
"1086","Drones of contention: Are hobby fliers on a collision course with the law? ","technology"
"1087","Can anything save this lost Afghan temple city from its own wealth? ","technology"
"1088","Trying to eat healthier? Forget fad diets - there's a better way to improve your eating habits ","technology"
"1089","Can Europe’s arts festivals illuminate our crisis-ridden world? ","technology"
"1090","Imagine electric cars could charge themselves by capturing exhaust heat. We've got a road map ","technology"
"1091","Investment in bolstering character traits in the young are on the rise. But do they work? ","technology"
"1092","Painting robot follows your eyes to create art ","technology"
"1093","The Martian: we love sciencing the shit out of stuff ","technology"
"1094","Could humans really be the centre of the universe? ","technology"
"1095","A computer tried this maths problem, but its proof was the size of Wikipedia. Now clever humans have done better ","technology"
"1096","Map lovers, feast your eyes: 6 stunning maps uncover hidden details of the Earth and moon ","technology"
"1097","How did Volkswagen cheat in tests - and can it fix affected cars? ","technology"
"1098","","technology"
"1099","The Martian: The science of surviving a space catastrophe ","technology"
"1100","""I can use intensive-care data to save people's lives,"" says biomedical engineer Thomas Heldt: ","technology"
"1101","The tale of how a giant redwood defeated Wellington, and more in this week's Feedback: ","technology"
"1102","Now we know why lack of sleep makes us emotionally distracted by everything #yawn ","technology"
"1103","These photos, taken 4 years apart, demonstrate water flow on Mars ","technology"
"1104","Now surgeons can use glue to repair damaged hearts ","technology"
"1105","Bumblebees are evolving shorter tongues in response to climate change  ","technology"
"1106","This surgical device repairs damaged still-beating hearts with glue ","technology"
"1107","Deep earthquakes seem to happen more in the Northern Summer - but why? ","technology"
"1108","If carbon emissions don't make people feel guilty, maybe it's time to upgrade morality ","technology"
"1109","Welcome to the everything factory, where we'll make every material you've never heard of ","technology"
"1110","Deep earthquakes seem to happen more in the summer - but why? ","technology"
"1111","This baby robot confirms why infants smile at their mums (so cute... ahem) ","technology"
"1112","The pope is a key ally against climate change, say three climate science veterans ","technology"
"1113","*Sniff* mmmm I'm getting cat pee and cake. How yeasts affect the flavour and aroma of wine ","technology"
"1114","Capturing NASA's mindset is key to The Martian's success ","technology"
"1115","Web-in-a-box lets you take the internet with you - even if you're not hooked up ","technology"
"1116","This man was decapitated more than 9000 years ago ","technology"
"1117","Return to Antikythera: We went back to the famous wreck to hunt for more ancient treasures ","technology"
"1118","Paralysed man uses mind control to walk again ","technology"
"1119","Want a boost? These raptors stand on each other's backs to get a better view #zoologger ","technology"
"1120","A woman’s body has been sliced into more than 5,000 pieces - to be digitally resurrected ","technology"
"1121","Morality 2.0: How manipulating our minds could save the world ","technology"
"1122","Exoplanets are weirder than any in our solar system. But which of these are we still to find? ","technology"
"1123","Race to save lost city, our modern moral compass, stuff of dreams, virtual human, and more: ","technology"
"1124","These raptors stand on each other's backs to get a better view #zoologger ","technology"
"1125","Why fight over Planned Parenthood could shut down the US government ","technology"
"1126","A woman’s body has been sliced into more than 5,000 pieces - to be resurrected digitally ","technology"
"1127","Ooops. A US weapons facility has accidentally shipped excess nuclear material ","technology"
"1128","The horror of the unseen state:  Brendan Byrne visits artist Trevor Paglen's solo show in NYC ","technology"
"1129","Are you satisfied with life? The WHO wants to know  ","technology"
"1130","VW scandal: How real world testing will stop the emissions cheats ","technology"
"1131","Gravitational-wave detector rebooted to sense clashing stars ","technology"
"1132","How happy are you? The WHO wants to know. ","technology"
"1133","Why bother finding a mate to reproduce when you could just generate clones of yourself? ","technology"
"1134","Ever get #thatfeeling? ","technology"
