"","user","type"
"2478","A robot made me (marginally) better at ping pong ","technology"
"2479","Only in Japan: The robot that's a smartphone that's a robot ","technology"
"2480","AI could be the solution to catching tax cheats ","technology"
"2481","ICYMI: Smart measuring leggings, 3D-printed Adidas and moreWatch: ","technology"
"2482","Computer Science is the most popular major for women at Stanford ","technology"
"2483","Hulu's virtual reality app will launch alongside Gear VR in November ","technology"
"2484","Now @elonmusk says Apple has 'a lot of talented people' (that Tesla fired)  ","technology"
"2485","Brain simulation breakthrough reveals clues about sleep, memory ","technology"
"2486","Firefox will stop supporting web plugins (except for Flash) by the end of 2016 ","technology"
"2487","Playdate: Giving away Snake's watch with 'Metal Gear Online' ","technology"
"2488","Want a snazzy Metal Gear Solid-inspired Seiko watch? Tune in to Playdate starting at 6pm ET: ","technology"
"2489","Playdate: Giving away Snake's watch with 'Metal Gear Online' ","technology"
"2490","Can't accept autonomous liability? Get out of the game, says Volvo ","technology"
"2491","Dear @Veronica: Breaching the 'Great Firewall' of China ","technology"
"2492","Stephen Hawking: 'The real risk with AI isn't malice but competence' ","technology"
"2493","Hulu's virtual reality app will launch alongside Gear VR in November ","technology"
"2494","The Trans-Pacific Partnership could spell the end of filesharing sites ","technology"
"2495","TwitchCon made me a Twitch convert ","technology"
"2496","GLAAD updates Spirit Day app for 2015's anti-bullying event ","technology"
"2497","The best $150 over-ear headphones ","technology"
"2498","DARPA wants to build vehicles that disappear after delivering supplies ","technology"
"2499","The Wall Street Journal's customer database was hacked ","technology"
"2500","Ebro Darden: the DJ who curates the sound of New York on Beats 1 ","technology"
"2501","Brain simulation breakthrough reveals clues about sleep, memory ","technology"
"2502","Apple Watch owners can use Facebook Messenger on their wrists ","technology"
"2503","Moto 360 review (2015): more than just good looks this time around ","technology"
"2504","#EngadgetLive is coming to Austin one week from today! ","technology"
"2505","users get privacy controls as enrollment nears ","technology"
"2506","Engadget Live is making one more stop this year: New York City! ","technology"
"2507","Volkswagen may give money to owners of emissions-cheating cars ","technology"
"2508","I found a secondhand telescope, now what? ","technology"
"2509","LastPass gets acquired by remote desktop service LogMeIn ","technology"
"2510","Toyota's hydrogen concept car could power your concept home ","technology"
"2511","NASA details its plans to reach and explore the red planet ","technology"
"2512","I lost my friend, but his voice and music live on in my game ","technology"
"2513","NASA's studying how zero gravity affects the brain ","technology"
"2514","The DMV is publishing self-driving car accident reports ","technology"
"2515","The US government won't force backdoor access, but still wants it ","technology"
"2516","A robot made me (marginally) better at ping pong ","technology"
"2517","#ICYMI: Smart measuring leggings, 3D-printed Adidas &amp; more @mskerryd ","technology"
"2518","Adobe ditches the Creative Cloud requirement for Lightroom mobile ","technology"
"2519","Apple's iPhone 6s and 6s Plus are now available SIM-free ","technology"
"2520","iPhone 6s battery life may vary slightly depending who made the processor ","technology"
"2521","OMRON's Family Eye home camera is both cute and powerful ","technology"
"2522","Lyft partners with Hertz to offer its drivers affordable rental rates ","technology"
"2523","Dell's latest XPS 12 looks like a Surface rival, feels like a step backward ","technology"
"2524","Get ready for more videos (and ads) in your Twitter timeline ","technology"
"2525","DNA nanomachine detects HIV antibodies in minutes, not hours ","technology"
"2526","NASA finds that Pluto has blue skies and surface water ice ","technology"
"2527","Adobe teases 'Monument Mode' for better photos of crowded landmarks ","technology"
"2528","Instead of dislike, Facebook is testing 'Reactions' animated emoji ","technology"
"2529","This sensor knows if you like anime a little too much ","technology"
"2530","Singapore Post trails island-hopping delivery-by-drone program ","technology"
"2531","SwiftKey's latest keyboard is powered by a neural network ","technology"
"2532","Apple pulls ad-blocking apps that can 'compromise' security ","technology"
"2533","You might have to wait until November for the new Apple TV ","technology"
"2534","Burner's disposable phone numbers save everything in the cloud ","technology"
"2535","Illustrated 'Harry Potter' novels come to iBooks ","technology"
"2536","Apple Watch owners can use Facebook Messenger on their wrists ","technology"
"2537","HBO Now is finally on the Roku ","technology"
"2538","BlackBerry could quit hardware as early as next year ","technology"
"2539","California authorities need a warrant to probe your digital life ","technology"
"2540","Elon Musk: Apple hired the Tesla engineers we've fired ","technology"
"2541","#SpaceWeek: The detachment of attachment on #CitizenMars: ","technology"
"2542","GLAAD updates Spirit Day app for 2015's anti-bullying event ","technology"
"2543","The Liberty Trike is a 21st century Rascal ","technology"
"2544","DJI's slick 4K hand-held gimbal is ready for action ","technology"
"2545","Designing Surface Pro 4: a chat with a Microsoft hardware lead ","technology"
"2546","MakerBot lays off another twenty percent of its workers ","technology"
"2547","Chromecast review (2015): Not much new, but still worth $35 ","technology"
"2548","Microsoft's taking HoloLens on tour to woo developers ","technology"
"2549","Volkswagen may give money to owners of emissions-cheating cars ","technology"
"2550","The Big Picture: Mars' fractured surface underneath the dunes ","technology"
"2551","Reuters: Uber hacking investigation is targeting a Lyft exec ","technology"
"2552","HBO Go launching as a standalone streaming service in Latin America ","technology"
"2553","ICYMI: Mars life, bendy smartphone screens and more ","technology"
"2554","Instead of dislike, Facebook is testing 'Reactions' animated emoji ","technology"
"2555","Bowers and Wilkins' new Zeppelin speaker nixes the dock to go wireless ","technology"
"2556","Apple Pay coming to Starbucks, KFC and Chili's in the next year ","technology"
"2557","NASA finds that Pluto has blue skies and surface water ice ","technology"
"2558","Dell's redesigned XPS 15 is a bigger version of our favorite Windows laptop ","technology"
"2559","Playdate: Revisiting 'Uncharted' in 'The Nathan Drake Collection' ","technology"
"2560","iPhone 6s battery life may vary slightly depending who made the processor ","technology"
"2561","The PS4 universal remote hits stores later this month ","technology"
"2562","littleBits Gizmos and Gadgets Kit gives kids a range of DIY projects ","technology"
"2563","Adobe ditches the Creative Cloud requirement for Lightroom mobile ","technology"
"2564","Dear @Veronica: Breaching the 'Great Firewall' of China ","technology"
"2565","The Wirecutter's best deals: a Vizio 4K TV, the UE Roll, and more! ","technology"
"2566","Singapore Post trials island-hopping delivery-by-drone program ","technology"
"2567","Google for iOS can play GIFs in search results, show maps in-app ","technology"
"2568","Medium overhauls its collaborative publishing platform ","technology"
"2569","Facebook tests 'Reactions,' a Like button with more emotions ","technology"
"2570","Adobe teases 'Monument Mode' for better photos of crowded landmarks ","technology"
"2571","AT&amp;T's WiFi calling feature is now available ","technology"
"2572","Chromecast review (2015): Not much new, but still worth $35 ","technology"
"2573","Nintendo revamps Miiverse site with more social features ","technology"
"2574","Lyft partners with Hertz to offer its drivers affordable rental rates ","technology"
"2575","Android founder says next major wave of computing will be AI ","technology"
"2576","DNA nanomachine detects HIV antibodies in minutes, not hours ","technology"
"2577","'Astroneer' is a planetary exploration game on a grand scale ","technology"
"2578","Illustrated 'Harry Potter' novels come to iBooks ","technology"
"2579","BlackBerry could shut down hardware division if not profitable by 2016 ","technology"
"2580","Light's L16 camera challenges DSLRs with 16 lenses in one package ","technology"
"2581","Netflix's most popular streaming plan now costs $10 a month for new customers ","technology"
"2582","You might have to wait until November for the new Apple TV ","technology"
"2583","'Indivisible' is a hand-drawn JRPG that needs your help ","technology"
"2584","HBO Now is finally on the Roku ","technology"
"2585","DJI's slick 4K hand-held gimbal is ready for action ","technology"
"2586","Designing Surface Pro 4: a chat with a Microsoft hardware lead ","technology"
"2587","6 technologies that will help humans survive on Mars ","technology"
"2588","Verizon increases the price of unlimited data plans by $20 a month ","technology"
"2589","SwiftKey's latest keyboard is powered by a neural network ","technology"
"2590","Burner's disposable phone numbers save everything in the cloud ","technology"
"2591","Mitsubishi set to show off its latest far-out EV concept ","technology"
"2592","Chromecast app for iOS gets content and app recommendations ","technology"
"2593","#SpaceWeek: A brief survey of NASA's space imaging technology ","technology"
"2594","Kodak has a new surveillance camera to compete with Nest Cam ","technology"
"2595","Amazon's Snowball is a smart box for shipping tons of cloud data ","technology"
"2596","Nanowire technology will improve brain-stimulating implants ","technology"
"2597","Mozilla proposes three golden rules for ad blockers ","technology"
"2598","#ICYMI: Mars life, bendy smartphone screens and more by @mskerryd ","technology"
"2599","littleBits Gizmos and Gadgets Kit gives kids a range of DIY projects ","technology"
"2600","FAA tests tech to spot illegal drone operators near airports ","technology"
"2601","Meet the laundry-folding washing machine of our lazy-ass future ","technology"
"2602","Video game voice actors vote a resounding 'yes' to strike ","technology"
"2603","Pandora snatches up Ticketfly to become a one-stop shop for music ","technology"
"2604","Sony buys a company that makes Kinect-like depth sensors ","technology"
"2605","Barnes and Noble's Galaxy Tab E Nook is yet another tablet for readers ","technology"
"2606","The Big Picture: Mars' fractured surface underneath the dunes ","technology"
"2607","FAA slaps drone video firm with record $1.9-million fine ","technology"
"2608","Vizio's 120-inch Reference Series 4K TV with HDR costs $130,000 ","technology"
"2609","Amazon launches a Handmade rival to Etsy ","technology"
"2610","Lexus made a working electric car out of cardboard ","technology"
"2611","Bowers and Wilkins' new Zeppelin speaker nixes the dock to go wireless ","technology"
"2612","Adidas Futurecraft 3D: A running shoe made with 3D-printed materials ","technology"
"2613","Google for iOS can play GIFs in search results, show maps in-app ","technology"
"2614","Google is purging hacked spam from your search results ","technology"
"2615","Disney retires a ton of apps to focus on 'more engaging' games ","technology"
"2616","Facebook tests 'Reactions,' a Like button with more emotions ","technology"
"2617","'Star Wars: Battlefront' beta opens wide Thursday at 1PM ET ","technology"
"2618","PlayStation 4 drops to $350 in the US ","technology"
"2619","WhatsApp for Android will use Google Drive to back up your data ","technology"
"2620","Dell's latest XPS 12 looks like a Surface rival, feels like a step backward ","technology"
"2621","Dell's redesigned XPS 15 is a bigger version of our favorite Windows laptop ","technology"
"2622","Android founder says next major wave of computing will be AI ","technology"
"2623","HP's newest gaming notebook is for more casual users ","technology"
"2624","Light's L16 camera challenges DSLRs with 16 lenses in one package ","technology"
"2625","#SpaceWeek: The lives that #CitizenMars candidates leave behind ","technology"
"2626","Everything @Twitch does is for its community ","technology"
"2627","'Astroneer' is a planetary exploration game on a grand scale ","technology"
"2628","'Indivisible' is a hand-drawn JRPG that needs your help ","technology"
"2629","HP's dorky 'Star Wars' laptop is impressive in its attention to detail ","technology"
"2630","Meet the laundry-folding washing machine of our lazy-ass future ","technology"
"2631","Twitter's goal for the next year is to be simpler and easier to use ","technology"
"2632","'Star Wars: Battlefront' beta opens wide Thursday at 1PM ET ","technology"
"2633","HP's updated Stream laptops offer better battery life for your buck ","technology"
"2634","FAA tests tech to spot illegal drone operators near airports ","technology"
"2635","Journalist found guilty of assisting Anonymous hacks ","technology"
"2636","The HP Spectre x2 is like the Surface Pro, but cheaper and lower-specced ","technology"
"2637","Dear Veronica: Breaching the 'Great Firewall' of China ","technology"
"2638","Volkswagen's US head knew of possible emissions trouble in 2014 ","technology"
"2639","HP wants you to use its new 8-inch Windows tablet to get work done ","technology"
"2640","ICYMI: HoloLens gaming, walking talking robot phone and more ","technology"
"2641","DraftKings bans employees from betting on fantasy games ","technology"
"2642","HP's new PCs include an updated convertible, a thin-and-light and some all-one-ones ","technology"
"2643","Adidas Futurecraft 3D: A running shoe made with 3D-printed materials ","technology"
"2644","Chinese hackers attacked the company behind Samsung Pay ","technology"
"2645","The @FCC told us that it's not against folks modding routers, even if it changes the power output -- within limits ","technology"
"2646","Amazon reportedly plans to build its own live video service ","technology"
"2647","Barnes and Noble's Galaxy Tab E Nook is yet another tablet for readers ","technology"
"2648","Pandora snatches up Ticketfly to become a one-stop shop for music ","technology"
"2649","FAA slaps drone video firm with record $1.9-million fine ","technology"
"2650","Lexus made a working electric car out of cardboard ","technology"
"2651","WhatsApp for Android will use Google Drive to back up your data ","technology"
"2652","HP's dorky 'Star Wars' laptop is impressive in its attention to detail ","technology"
"2653","Toyota aims to build autonomous car around 2020 ","technology"
"2654","US Army's new anti-drone gun blasts UAVs from a kilometer away ","technology"
"2655","Engadget Live is coming to Austin next Friday! ","technology"
"2656","Nearly a quarter of Android users are running Lollipop ","technology"
"2657","Everything Twitch does is for its community ","technology"
"2658","Dyson's latest bladeless fan keeps the air pure and your toes warm ","technology"
"2659","Dear Veronica: Breaching the 'Great Firewall' of China ","technology"
"2660","Have your say on the FCC's plan to lock down WiFi routers ","technology"
"2661","The Google XPrize moonshot is a step closer to reality ","technology"
"2662","Google wants to make mobile web browsing faster ","technology"
"2663","These 8K displays may end up on your next tablet ","technology"
"2664","New Chromecast teardown reveals slightly better heat dissipation ","technology"
"2665","Volkswagen will recall its super-polluting cars in 2016 ","technology"
"2666","This paper origami bird actually flies ","technology"
"2667","Windows 10 Mobile begins its roll out this December ","technology"
"2668","#ICYMI: HoloLens gaming, walking talking robot phone &amp; more @mskerryd ","technology"
"2669","This is the Pill+, Beats' first speaker since joining Apple ","technology"
"2670","Microsoft's upgraded Band is a little sleeker, and smarter too ","technology"
"2671","NASA's rocket launch to paint the night sky with colorful vapor clouds ","technology"
"2672","Touchy turns you into an over-friendly, clingy human camera ","technology"
"2673","Thailand's gamers fight to save the open internet ","technology"
"2674","#SpaceWeek: In Mars One we trust ","technology"
"2675","HP wants you to use its new 8-inch Windows tablet to get work done ","technology"
"2676","HP's updated Stream laptops offer better battery life for your buck ","technology"
"2677","HP's newest gaming notebook is for more casual users ","technology"
"2678","HP's new PCs include an updated convertible, a thin-and-light and some all-one-ones ","technology"
"2679","The HP Spectre x2 is like the Surface Pro, but cheaper and lower-specced ","technology"
"2680","Which Android devices are getting Marshmallow and when? ","technology"
"2681","Google denies scooping up your car's data through Android Auto ","technology"
"2682","Makerarm wants to 3D print, plot, and carve its way into your heart ","technology"
"2683","Your Facebook News Feed speed now depends on your connection ","technology"
"2684","Facebook brings Messenger's doodle trick to its main app ","technology"
"2685","HoloLens 'Project X' lets you blast robot armies with a ray gun fist ","technology"
"2686","Lumo's running shorts fix your form to avoid injury ","technology"
"2687","Clean energy is nearly as inexpensive as coal and gas ","technology"
"2688","View-Master introduces kids to VR with space and wild animals ","technology"
"2689","Microsoft has a docking station for your Surface Pro tablet ","technology"
"2690","Google Translate works within apps for Android Marshmallow users ","technology"
"2691","The Surface Pro 4 vs. the competition: Tablets for work first ","technology"
"2692","Surface Book vs. the competition: Battle of the flagship laptops ","technology"
"2693","Thanks to some quick work by our developers, comments are back!","technology"
"2694","The Lumia 950 vs. the competition: A battle of flagships ","technology"
"2695","Jumping robot uses safety tethers to control its fall ","technology"
"2696","Microsoft's October event: by the numbers ","technology"
"2697","Our developers are working on the issue now, and we will have them back open as soon as possible. ","technology"
"2698","We've been alerted to a technical issue with comments (thx @philliphaydon &amp; all!) and have disabled them temporarily ","technology"
"2699","Samsung boasts massive third-quarter profit growth ","technology"
"2700","Amazon-owned Twitch finally overhauls its Fire TV app ","technology"
"2701","#SpaceWeek: What makes a Mars One astronaut? #CitizenMars Episode 2: ","technology"
"2702","Microsoft's upgraded Band is a little sleeker, and smarter too ","technology"
"2703","Verizon's customer-tracking 'supercookies' connect to AOL ads ","technology"
"2704","Engadget giveaway: win an iPhone 6s courtesy of Spigen! ","technology"
"2705","Here's our first look at the Surface Book, Microsoft's answer to the MacBook Pro ","technology"
"2706","Nobel Prize for Physics awarded to neutrino 'flavor' change ","technology"
"2707","Lumia 950 XL vs. the competition: The big flagship phones are here ","technology"
"2708","Synaptics will bring pressure-sensitive screens to Android phones ","technology"
"2709","High-end Windows Phones make a comeback with the Lumia 950 and 950 XL ","technology"
"2710","AT&amp;T's WiFi calling nears launch as FCC grants its waiver request ","technology"
"2711","Mini review video: our verdict on the new iPhones in under a minute: ","technology"
"2712","Google's Meter turns your home screen into an active widget ","technology"
"2713","Tesla Model Y hinted at in deleted Elon Musk Tweet ","technology"
"2714","Hands-on with Surface Pro 4, Microsoft's ideal hybrid tablet ","technology"
"2715","Clean energy is nearly as inexpensive as coal and gas ","technology"
"2716","Verizon: Samsung Pay support is coming in a software update ","technology"
"2717","The new Microsoft Band has a curved screen, fancy metal accents ","technology"
"2718","Microsoft HoloLens reaches developers in early 2016 for $3,000 ","technology"
"2719","Google denies scooping up your car's data through Android Auto ","technology"
"2720","Want an early access code for the Star Wars: Battlefront beta? Check out our @twitch stream: ","technology"
"2721","Here's our very first look at @Microsoft's @surface Book: ","technology"
"2722","ICYMI: Crowdfunded rocket, swimming robotic bees and more Watch: ","technology"
"2723","We go hands-on with @microsoft's Surface Pro 4: ","technology"
"2724","Microsoft's Display Dock turns your Windows phone into a mini PC ","technology"
"2725","Which Android devices are getting Marshmallow and when? ","technology"
"2726","We have early access codes for the Star Wars: Battlefront beta on PS4 and PC. Come join our stream: ","technology"
"2727","Microsoft's Lumia 950 XL puts Windows 10 in your pocket for $649 ","technology"
"2728","Your Facebook News Feed speed now depends on your connection ","technology"
"2729","#EngadgetLive is coming to Austin next Friday! ","technology"
"2730","Playdate: Waging war in the 'Star Wars: Battlefront' beta ","technology"
"2731","Meet the Lumia 950, Microsoft's first Windows 10 flagship ","technology"
"2732","Microsoft's Lumia 550 offers entry-level Windows 10 for $140 ","technology"
"2733","Neil deGrasse Tyson hosts an early Reddit video AMA ","technology"
"2734","'Far Cry Primal' will take humanity back to the stone age ","technology"
"2735","HoloLens 'Project X' lets you blast robot armies with a ray gun fist ","technology"
"2736","Microsoft's October event: by the numbers ","technology"
"2737","The Lumia 950 vs. the competition: A battle of flagships ","technology"
"2738","UV-light enabled catheter fixes heart defects without surgery ","technology"
"2739","Surface Book vs. the competition: Battle of the flagship laptops ","technology"
"2740","The Surface Pro 4 vs. the competition: Tablets for work first ","technology"
"2741","High-end Windows Phones make a comeback with the Lumia 950 and 950 XL ","technology"
"2742","Happy birthday, @neiltyson! ","technology"
"2743","VAIO's convertible PC for creatives lands in the US ","technology"
"2744","Las Vegas bets that SpaceX will make it to Mars before NASA ","technology"
"2745","Reddit experiment brings you news without the community ","technology"
"2746","Hands-on with Surface Pro 4, Microsoft's ideal hybrid tablet ","technology"
"2747","The new Roku does 4K and finds the remote for you ","technology"
"2748","Here's our first look at the Surface Book, Microsoft's answer to the MacBook Pro ","technology"
"2749","'RoboHon' is the tiny robot smartphone you never knew you needed ","technology"
"2750","Artists rejoice: The Surface Pro 4's stylus has 1,024 touch levels ","technology"
"2751","Microsoft has a docking station for your Surface Pro tablet ","technology"
"2752","Microsoft's Surface Book is its first (and 'ultimate') laptop ","technology"
"2753","Microsoft's Surface Pro 4 type cover has 'laptop class' feel ","technology"
"2754","Surface Book has a 13.5-inch screen, with 267 ppi ","technology"
"2755","""We made the ultimate laptop; we made Surface Book."" ","technology"
"2756","Surface Pro 4 starts at $899, with pre-orders kicking off on October 7th.  ","technology"
"2757","There's also a new Surface Pro Type Cover, the lightest &amp; thinnest yet.  And it'll work with Surface Pro's 4 AND 3. ","technology"
"2758","Microsoft announces Surface Pro 4 ","technology"
"2759","You can stuff up to 16GB of RAM and 1TB of storage in the Surface Pro 4. ","technology"
"2760","There are now five colors for the Surface Pen, as well as interchangeable pen tips. ","technology"
"2761","Microsoft's Display Dock turns your Windows phone into a mini PC ","technology"
"2762","The Surface Pro 4's Pen has all year battery life and an ""eraser"" on the back.  ","technology"
"2763","""This product (Surface Pro 4) is the thinnest, most powerful (Intel) Core PC shipped."" ","technology"
"2764","The Surface Pro 4 is the same size as the last model, but Microsoft managed to cram in a slightly bigger screen by reducing the bezel.","technology"
"2765","Microsoft's Lumia 550 offers entry-level Windows 10 for $140 ","technology"
"2766","Engadget giveaway: win an iPhone 6s courtesy of Spigen! ","technology"
"2767","Lumia 950 starts at $549, and the 950XL starts at $649. Both are coming in November. ","technology"
"2768","The Display Dock spits out 1080p video, naturally. And the sound quality is pretty good too. ","technology"
"2769","You can plug in the Lumia 950 into the Display Dock and it becomes a full desktop computer. ","technology"
"2770","#SpaceWeek: What you need to know about life on the International Space Station ","technology"
"2771","This is the new Microsoft Display Dock. And a guy with a celebratory  Fedora. ","technology"
"2772","Both phones also have USB Type-C connectors, which should allow for 5 Gbps data transfers and fast charging.","technology"
"2773","Microsoft's Lumia 950 XL is the latest supersized Windows 10 phone ","technology"
"2774","Meet the Lumia 950, Microsoft's first Windows 10 flagship ","technology"
"2775","They also have octa-core and hexa-core processors, as well as liquid cooling tech (lifted from the Surface design).","technology"
"2776","And now we have the Lumia 950 and 950 XL ","technology"
"2777","Microsoft HoloLens reaches developers in early 2016 for $3,000 ","technology"
"2778","The new Microsoft Band has a curved screen, fancy metal accents ","technology"
"2779","Windows 10 is now installed on 110 million devices ","technology"
"2780","Microsoft shows off 'Project XRay' mixed reality game for HoloLens ","technology"
