"","user","type"
"1","Netgear router exploit detected ","technology"
"2","VIDEO: 4K camera films drone-like video ","technology"
"3","US groups want Experian hack probed ","technology"
"4","Pre-roll ads come to Twitter videos ","technology"
"5","Amazon launches handicraft store ","technology"
"6","VIDEO: Islamic State prioritise Telegram app to spread propaganda ","technology"
"7","VIDEO: The robots that talk to each other ","technology"
"8","Tracking the two-wheeled speed demon ","technology"
"9","BBC to screen live e-sports tournament ","technology"
"10","VIDEO: Drone flies over sea to deliver package ","technology"
"11","'Liking' on Facebook is changing ","technology"
"12","UK firms develop drone-freezing ray ","technology"
"13","Whose fault is a driverless car crash? ","technology"
"14","Webcam hacker spied on sex acts ","technology"
"15","3D technology 'changes girl's life' ","technology"
"16","Games voice actors approve strike ","technology"
"17","Firms backed by China tech giants merge ","technology"
"18","Samsung payment data 'safe' after hack ","technology"
"19","US journalist guilty in hacking case ","technology"
"20","Cyber-thieves hit YouTube Fifa gamers ","technology"
"21","VIDEO: How to be in two places at once ","technology"
"22","VIDEO: The smartphone that thinks it's a robot ","technology"
"23","Toyota tests driverless car ","technology"
"24","The so-called Islamic State shifts to the Telegram mobile app to spread its propaganda ","technology"
"25","IS shifts propaganda to Telegram app ","technology"
"26","Lunar X Prize team books rocket ","technology"
"27","Digital memory 'eroding human memory' ","technology"
"28","Mobiles to load news articles faster ","technology"
"29","Cisco disrupts $30m Angler hacking operation that targeted 90,000 people per day ","technology"
"30","Cisco disrupts $30m hacking operation ","technology"
"31","AI had IQ of a four-year-old child ","technology"
"32","Belgian parents get spy-in-the-car ","technology"
"33","Drone firm under threat of $2m fine ","technology"
"34","Samsung profit forecast up 80% ","technology"
"35","Twitter launches Moments for top stories ","technology"
"36","Safe Harbour: Is Silicon Valley worried? ","technology"
"37","Can we live in harmony with robots? ","technology"
"38","VIDEO: The drone that can plant trees ","technology"
"39","VIDEO: Microsoft launches Windows laptop ","technology"
"40","VIDEO: Colouring in augmented reality art ","technology"
"41","Microsoft launches Windows laptop ","technology"
"42","Drone leaflet drop urges agents to quit ","technology"
"43","Reddit 'to launch news site' ","technology"
"44","VIDEO: Court strikes blow to EU-US data pact ","technology"
"45","Are dating apps killing romance? ","technology"
"46","Call of Duty flood footage criticised ","technology"
"47","EU-US data transfer pact ruled invalid ","technology"
"48","Instagram says @music is just the start ","technology"
"49","Locked-in sufferer 'DJs using his eyes' ","technology"
"50","VIDEO: Being controlled by electric shocks ","technology"
"51","Facebook plans satellite ‘in 2016' ","technology"
"52","Fishy business makes more sense with sensors ","technology"
"53","Social media firms 'not helping police' ","technology"
"54","Twitter's Jack of all trades ","technology"
"55","VIDEO: ""Nosey Smurf was hacking codename"" ","technology"
"56","VIDEO: Lorry drives itself on German motorway ","technology"
"57","GCHQ 'can take control of smartphones' ","technology"
"58","Peeple sites 'disappear' from web ","technology"
"59","Court case questions Uber's future ","technology"
"60","11 tweets about Twitter's new permanent CEO #JackDorsey #Twitter ","technology"
"61","11 facts about Twitter chief Dorsey ","technology"
"62","Driverless lorry tested on motorway ","technology"
"63","Will you (virtually) marry me? ","technology"
"64","'Butt dials' - a strain on the system ","technology"
"65","VIDEO: The app that will let you rate people ... and other trends of the week ","technology"
"66","Cyber 'risk' for nuclear plants ","technology"
"67","Tackling the network intruders ","technology"
"68","VIDEO: Semantic Paint improving computer vision ","technology"
"69","Will plastic bags go out of fashion? ","technology"
"70","Crowdfunding site hacked data leaked ","technology"
"71","Uber: Cab plan against public interest ","technology"
"72","VIDEO: Google shows off its driverless car ","technology"
"73","Texas judge throws out patent claims ","technology"
"74","Cardiff Uni develops virtual assistant ","technology"
"75","Google's driverless car is so boring ","technology"
"76","Routers 'vaccinated' by benign virus ","technology"
"77","Amazon bars Apple and Google devices ","technology"
"78","VIDEO: MIT builds 3D printed robotic hands ","technology"
"79","'Pay by smart watch? That'll do nicely' ","technology"
"80","T-Mobile US customer data stolen ","technology"
"81","You can 'Super Like' people on Tinder ","technology"
"82","Technology crucial to teen romance ","technology"
"83","Uproar over new people-rating app ","technology"
"84","EU probes TVs over energy test scores ","technology"
"85","CIA pulls staff from China after hack ","technology"
"86","VIDEO: Could AI help shape call centres? ","technology"
"87","PC support scams net $1.5bn return ","technology"
"88","Wide-angle selfies with new LG phone ","technology"
"89","Games aid search for cyber-talent ","technology"
"90","Facebook: Profile videos are coming ","technology"
"91","Is there such a thing as a nuclear button? ","technology"
"92","Google's gadget game ","technology"
"93","The day Singapore came 'under attack' in Call of Duty ","technology"
"94","Tesla belatedly unveils Model X car ","technology"
"95","VIDEO: Instagram's boss wants whole world using network ","technology"
"96","VIDEO: Telsa unveils Model X electric car ","technology"
"97","VIDEO: The simulator bringing movement to VR ","technology"
"98","London taxi rules would 'end Uber' ","technology"
"99","#Google wants to breathe new life into old hi-fis with its latest gadget  ","technology"
"100","Google adds wi-fi to old hi-fis ","technology"
"101","Snowden launches Twitter account ","technology"
"102","Facebook reacts to hoax privacy posts ","technology"
"103","Medical devices attract hackers ","technology"
"104","Russian crackdown on pirated music ","technology"
"105","Tinder fights STD ad campaign in US ","technology"
"106","How to stop Apple Music auto-subscription ","technology"
"107","VIDEO: Could AI bring a cure for cancer? ","technology"
"108","Google search chief looks to the future ","technology"
"109","Is your home about to get a lot smarter? ","technology"
"110","Facebook down for second time in week ","technology"
"111","US and China agree cybercrime truce ","technology"
"112","Chinese smartphones mount web attack ","technology"
"113","Hilton investigates hack claims ","technology"
"114","App helps children find next generation antibiotics in nature ","technology"
"115","Silicon Valley - still the capital of tech ","technology"
"116","VIDEO: Bad content will 'destroy' VR industry ","technology"
"117","Revamped 'privacy' phone launched ","technology"
"118","VIDEO: Blackphone 2 aims to protect privacy ","technology"
"119","Do we really need to fear AI? ","technology"
"120","Highways and 'i-ways': How Modi wooed Silicon Valley ","technology"
"121","VIDEO: Why is Modi so interested in Facebook? ","technology"
"122","Modi hails social media at Facebook HQ ","technology"
"123","VIDEO: See the telescopes of the future ","technology"
"124","VIDEO: Facebook boosts refugee internet access ","technology"
"125","VIDEO: Kit helps children hunt new antibiotics ","technology"
"126","VIDEO: Bill Gates: Meeting poverty goals 'won't be easy' ","technology"
"127","Facebook in refugee internet pledge ","technology"
"128","How to get a job in gaming ","technology"
"129","Porn sites hit by advert malware ","technology"
"130","Old net addresses run out in US ","technology"
"131","How events are becoming digital playgrounds ","technology"
"132","Virtual reality: So near, yet so far ","technology"
"133","NHS approved apps 'leaking' ID data ","technology"
"134","VIDEO: How hair tech could allow you to text ","technology"
"135","One-armed factory robot goes on sale ","technology"
"136","VIDEO: Can AI predict the stock market? ","technology"
"137","All About That Bass: 178m streams = $5k? ","technology"
"138","BT sets date for IPv6 network move ","technology"
"139","VIDEO: Time lapse footage of 1,000mph car ","technology"
"140","Video game actors consider strike ","technology"
"141","Brain reader helps man move legs again ","technology"
"142","1,000mph Bloodhound car unveiled ","technology"
"143","VIDEO: Robots sell robots in Silicon Valley ","technology"
"144","Robots that sell you robots ","technology"
"145","Fingerprints stolen in OPM hack ","technology"
"146","Price hike for mobile spectrum ","technology"
"147","China President Xi meets US tech CEOs ","technology"
"148","Supermoon and eclipse cause Nasa problems ","technology"
"149","Facebook hosts 360 Star Wars video clip ","technology"
"150","VIDEO: The world's most Instagrammed place? ","technology"
"151","Apple malware 'infected 4,000 apps' ","technology"
"152","VW: Call for car software law change ","technology"
"153","How do you test a car's emissions exactly? We made this to show you #vw #volkswagen #tech ","technology"
"154","VIDEO: How do you test a car's emissions? ","technology"
"155","How do you test a car's emissions exactly? We made this to show you #vw #volkswagen #tech ","technology"
"156","Google 'charges when bots view ads' ","technology"
"157","Facebook dealt blow in privacy fight ","technology"
"158","VIDEO: Hitachi boss's travel tip ","technology"
"159","VIDEO: New scan aims to aid tumour detection ","technology"
"160","Smart devices get security tune-up ","technology"
"161","Does China engage in economic espionage? ","technology"
"162","Cyberbullying 'worse than face-to-face' ","technology"
"163","VIDEO: Humans cross bridge built by drones ","technology"
"164","BT pledges better broadband for UK ","technology"
"165","India withdraws encryption policy ","technology"
"166","Hitachi boss offers travel advice. #tech ","technology"
"167","The John McAfee circus rolls on ","technology"
"168","India exempts social media from policy ","technology"
"169","VIDEO: The tech to keep your bike safe ","technology"
"170","Want superfast broadband? Do it yourself ","technology"
"171","Cheating virus hits poker players ","technology"
"172","VIDEO: Can you build a robot in one day? ","technology"
"173","The transhumanist running for president ","technology"
"174","Can a machine become an artist? ","technology"
"175","VIDEO: The car that transforms at speed ","technology"
"176","Does ad blocking herald the end of the free internet? ","technology"
"177","VIDEO: Robots work in world's biggest building ","technology"
"178","American Airlines flights halted in US ","technology"
"179","Delays to rollout of BBC Micro Bit ","technology"
"180","Will Amazon's new launch keep us taking the tablets? ","technology"
"181","VIDEO: Hands-on with Amazon's £50 tablet ","technology"
"182","'Clock boy' Ahmed's amazing invite list ","technology"
"183","Airports test remote traffic control ","technology"
"184","Big banks consider basic Bitcoin tech ","technology"
"185","KSI: They should teach YouTube in school ","technology"
"186","MI5 boss warns of online terror risk ","technology"
"187","Warning over drone threat to prisons ","technology"
"188","Sperm donors enticed with iPhone cash ","technology"
"189","VIDEO: Rugby World Cup: Digital referee Hawk-Eye ","technology"
"190","The search for a thinking machine ","technology"
"191","VIDEO: The tech to connect smart devices ","technology"
"192","Rugby World Cup: Hawk-Eye ready for action ","technology"
"193","Apple delays Watch software update ","technology"
"194","VIDEO: Helicopter uses robot legs to land ","technology"
"195","Rockstar Games not impressed with BBC drama ","technology"
"196","First 8K TV screen to go on sale ","technology"
"197","VIDEO: Microsoft kills Zune music service ","technology"
"198","Facebook posts UK missing kids alerts ","technology"
"199","Lock screen flaw found in Android ","technology"
"200","VIDEO: First look at Peugeot Fractal car ","technology"
"201","VIDEO: The dairy using robots to process milk ","technology"
"202","Sharp-eye Surrey satellites see Earth ","technology"
"203","Man fined over stadium drone flying ","technology"
"204","The grandmother tackling online bullies ","technology"
"205","Hewlett-Packard to cut 25-30,000 jobs ","technology"
"206","Misuse of artificial intelligence 'could do harm' ","technology"
"207","VIDEO: OAP video gamers outscore youngsters ","technology"
"208","VIDEO: 'West must beat China to Mars' ","technology"
"209","VIDEO: Facebook founder gives reasons for 'dislike' button ","technology"
"210","How video games can change your brain ","technology"
"211","Meeting the power couple of AI ","technology"
"212","VIDEO: Mad Men creator blasts TV ads ","technology"
"213","'Dislike' button coming to Facebook ","technology"
"214","Amazon founder signals space intent ","technology"
"215","Girl, 12, finds porn on Amazon search ","technology"
"216","VIDEO: Porsche car posts to social media ","technology"
"217","VIDEO: Could AI eventually outsmart humans? ","technology"
"218","VIDEO: Robot takes a tour of the BBC studios ","technology"
"219","Apology follows Minecraft event anger ","technology"
"220","My day with a robot ","technology"
"221","'Super Voice' promises better signal ","technology"
"222","Google launches virtual Kenya safari map ","technology"
"223","Google faces Android fines in Russia ","technology"
"224","Facebook joins German anti-racism drive ","technology"
"225","School computers 'do not raise results' ","technology"
"226","Raging fires prompt drone law change ","technology"
"227","Meet the transhumanists ","technology"
"228","A spider-proof shed? ","technology"
"229","VIDEO: How some black cab drivers declared online war on Uber ","technology"
"230","Finance firms targeted by cyber gang ","technology"
"231","VIDEO: Hands-on with iPad Pro and Apple Pencil ","technology"
"232","Apple's big event: the online reaction ","technology"
"233","VIDEO: iPad grows up at giant Apple event ","technology"
"234","BBC offers Doctor Who maker kits ","technology"
"235","New Apple TV can run games and comes with a Nintendo Wii-style motion sensitive remote control ","technology"
"236","""The future of television is apps"" says Apple chief Tim Cook, launching a TV box with touch-pad remote control. ","technology"
"237","Apple unveils larger iPad Pro ","technology"
"238","Apple makes a u-turn as it announces a stylus for the iPad Pro called Apple Pencil. ","technology"
"239","The new iPad Pro has a keyboard accessory like Microsoft's Surface tablet. ","technology"
"240","Apple has launched its ""biggest"" tablet - the iPad Pro with a 12.9 inch (33cm) screen #AppleEvent ","technology"
"241","Amazon stops selling Fire Phone ","technology"
"242","John McAfee to run for US president ","technology"
"243","Google reduces app prices in India ","technology"
"244","VIDEO: Wozniak gives verdict on Jobs film ","technology"
"245","Helper robots tested inside model flat ","technology"
"246","VIDEO: Battle of set top boxes ","technology"
"247","Facebook-boast deer killer sentenced ","technology"
"248","Woz: Shocked and amazed by Jobs film ","technology"
"249","VIDEO: Exploring Aleppo in 360 degree video ","technology"
"250","Microsoft battles US over 'drug' emails ","technology"
"251","WhatsApp bug could affect millions ","technology"
"252","VIDEO: Nasa's amazing hedgehog space robot ","technology"
"253","Uber to expand service in China ","technology"
"254","Laser can 'disable self-drive car' ","technology"
"255","Fat-shaming video causes YouTube row ","technology"
"256","VIDEO: Could mixed reality aid the military? ","technology"
"257","Apple opens iPhones to ad-blockers ","technology"
"258","Man Utd's plans for digital domination ","technology"
"259","Silicon Valley's 91-year-old designer ","technology"
"260","VIDEO: Is this the end of ads on mobiles? ","technology"
"261","Canon develops 250 megapixel sensor ","technology"
"262","HTC exits main Taiwan share index ","technology"
"263","Porn app took secret photos of users ","technology"
"264","VIDEO: The 'vital' role of mobile phones for refugees ","technology"
"265","Guilty plea for Latvian virus maker ","technology"
"266","British YouTubers get married ","technology"
"267","VIDEO: 'Cycle-in office' with ramp unveiled ","technology"
"268","VIDEO: Scientists create the 'vomit machine' ","technology"
"269","Troubled Toshiba posts $318m loss ","technology"
"270","'Cycle-in office' with ramp unveiled... #london #architecture ","technology"
"271","Thousands not paid after HSBC IT glitch ","technology"
"272","Ashley Madison founder steps down ","technology"
"273","Lizard Squad 'copycats': Teens arrested ","technology"
"274","Instagram images no longer all square ","technology"
"275","VIDEO: Kids pressured to buy in-game extras ","technology"
"276","The digital game that could cure TB ","technology"
"277","Vine takes on Shazam over music discovery ","technology"
"278","VIDEO: The drone guided by a robot ","technology"
"279","Facebook hits billion users in a day ","technology"
"280","How video-on-demand is changing TV ","technology"
"281","Why we still love platform games ","technology"
"282","SoundCloud to be sued over royalties ","technology"
"283","Woman gets gadget sensitivity grant ","technology"
"284","Google rejects EU's abuse complaint ","technology"
"285","Social media 'must rethink autoplay' ","technology"
"286","Ashley Madison hack changing lives ","technology"
"287","The watchmaker that hand delivers ","technology"
"288","VIDEO: Zano's mini-drones ready for launch ","technology"
"289","Facebook's call centre of the future ","technology"
"290","VIDEO: Could airships make a comeback? ","technology"
"291","Zano struggles to achieve lift-off ","technology"
"292","'GPS tagging' of offenders examined ","technology"
"293","How to be a video games designer ","technology"
"294","Why has Apple broken its vow of silence? ","technology"
"295","This is the next-best thing to surfing for the landlocked souls craving waves: ","technology"
"296","Hot from #NYCC: Will @ColonyUSA hold a dark, dystopian future? ","technology"
"297","Is it possible for an island to be too dramatically beautiful?","technology"
"298","California just passed new laws about growing weed. Of course it's drought-related. ","technology"
"299","We get the best art when reality hiccups. ","technology"
"300","A splatter of colourful fizzes bouncing around the Space Station? Perfection. ","technology"
"301","Here's what we just learned about Mr. Robot season 2 ","technology"
"302","The best of Gizmodo this week ","technology"
"303","What happened to Hilton's hotel on the Moon? ","technology"
"304","7 patents that NASA is freeing up for small companies ","technology"
"305","Meet Styx, the wee moon of Pluto ","technology"
"306","4 pumpkin-flavored foods to help you weather the Great Pumpkin Shortage of 2015 ","technology"
"307","We asked a @NASA botanist to help us design a better farm on Mars than the Martian's ","technology"
"308","Betamax and chill but one of you is a robot and the other is a seal ","technology"
"309","Let's talk about whatever you want right now ","technology"
"310","Watch water get tied in a knot!  ","technology"
"311","What are the unwritten rules of winning a Nobel Prize? ","technology"
"312","NASA climatologist says Godzilla El Niño is ""too big to fail"" ","technology"
"313","Man robbed at gunpoint for his ""hoverboard"" ","technology"
"314","The amazingly difficult landings of the U-2 Dragon Lady spy plane ","technology"
"315","Iron Man, Frozen, and Star Wars prosthetics from @OpenBionics will boost kids' confidence ","technology"
"316","Report: China arrested hackers because the US asked ","technology"
"317","Here's the physics behind that insane Chinese traffic jam. (It all comes down to density.) ","technology"
"318","All 163 GI Joe: A Real American Hero action figures, ranked ","technology"
"319","Google just bought ","technology"
"320","Disaster news may actually make us less scared to live in danger zones: ","technology"
"321","Clever microprojectors let @BMW's new 7 Series illuminate a path to your car's door at night ","technology"
"322","Before-and-after pics of California's shrinking Salton Sea shows a catastrophe in the making ","technology"
"323","This extinct penguin was the best animal to waddle the Earth ","technology"
"324","5 ideas that could change the future of trains ","technology"
"325","All the accidents California's driverless cars got in by being too good at driving ","technology"
"326","These hero rats are trained to sniff out land mines and tuberculosis   ","technology"
"327","That time Stephen Hawking inspired a sonnet about relativity, quantum mechanics and (of course) black holes. ","technology"
"328","This intricate digital model of a chunk of brain fires like the real thing: ","technology"
"329","Have you seen the video of the world's most insane traffic jam yet? You should: ","technology"
"330","Can you solve the math problem that stumped most Scottish students? ","technology"
"331","This beautiful timeline lets you explore Wikipedia's world history: ","technology"
"332","It took this robot 10 days to learn how to grasp objects from scratch: ","technology"
"333","Elon Musk says that Apple hires Tesla's rejects: ","technology"
"334","Syria is becoming a test bed for high-tech weapons of electronic warfare: ","technology"
"335","Apple doesn't think the battery difference between its new iPhones is a big deal ","technology"
"336","The USGS now uses your panicked tweets to help track earthquakes ","technology"
"337","So now Uber thinks Lyft's CTO helped hack its driver database ","technology"
"338","Why we're only just now discovering some of Frank Lloyd Wright's ""lost"" homes ","technology"
"339","It's more nutritious for you to eat a bug than a steak ","technology"
"340","Her life as a secret agent was as fascinating as her post-war life was tragic  ","technology"
"341","For this week's Shooting Challenge we wanna see your snacks! ","technology"
"342","Lend us your eyes and subscribe to Gizmodo's Youtube channel. You'll see glorious things. ","technology"
"343","Report: DNA markers accurately predict male homosexuality, at least in this small study. ","technology"
"344","Hackers obviously targeted Hillary Clinton's private servers ","technology"
"345","DNA repair earned the Nobel Prize in Chemistry, and here's why: ","technology"
"346","A massive bleaching event is threatening the world's coral reefs ","technology"
"347","Microsoft Surface vs. MacBook Pro: A head-to-head comparison! ","technology"
"348","New ultrafast swimming drones are tiny ocean explorers ","technology"
"349","How the UN screwed up its cyberviolence report  ","technology"
"350","This amazing claymation video will help you understand meteors, comets and asteroids ","technology"
"351","Sped up YouTube videos + the Benny Hill theme = one amazing website ","technology"
"352","5 ideas that could change the future of trains: ","technology"
"353","Living With Data: Are news sites tracking my clicks and changing what I see? ","technology"
"354","Want to get pregnant? Have sex all month long, not just near ovulation. ","technology"
"355","Ancient Mars was wetter and warmer than we ever realized ","technology"
"356","Accio iBooks: Harry Potter's Apple editions have animations and annotations by Rowling ","technology"
"357","You can see the color of the sky in the newest Pluto pics—and it's blue ","technology"
"358","Here are the biggest health risks to humans in space: ","technology"
"359","How Pixar changed all the rules to make The Good Dinosaur a stunning masterpiece: ","technology"
"360","DJI Osmo hands-on: super steady 4K video is now insanely easy ","technology"
"361","This software engineer job is too weird to be real … right? ","technology"
"362","Swiftkey has a neural network keyboard, and it's creepily good ","technology"
"363","China has the most insane traffic jams on the planet ","technology"
"364","9 viral images that are totally fake ","technology"
"365","Our favorite Android, iOS, and Windows Phone apps of the week: ","technology"
"366","This incredible fossil of an ancient horse still contains its unborn foal ","technology"
"367","Here's your last chance to take the Throb sex education survey! ","technology"
"368","Facebook's testing emoji reactions instead of a ""Dislike"" button ","technology"
"369","Google plans to make mobile web browsing even faster: ","technology"
"370","Bowers &amp; Wilkins Zeppelin Wireless: The big-ass blimp of sound gets an overhaul ","technology"
"371","Amazon just launched an Etsy clone to sell handmade items: ","technology"
"372","Adobe's Monument Mode removes people walking through your frame, in real-time:","technology"
"373","Dell's new XPS 12 is a Surface clone with a keyboard you'll actually want to use: ","technology"
"374","Watch this beautiful 10-minute film on the current state of neuroscience: ","technology"
"375","This is what a trailer for a Michael Dell biopic would be like: ","technology"
"376","Don't expect to edit your tweets any time soon: ","technology"
"377","The hog-nosed rat just got discovered. Twice. Simultaneously. ","technology"
"378","Go find out if your iPhone has a good or a bad processor ","technology"
"379","Former Reuters employee Matthew Keys found guilty of hacking ","technology"
"380","A few mutant genes can turn a stomach bug into the Black Death ","technology"
"381","Google swears Android Auto isn't spying on you (that much) ","technology"
