"","user","type"
"1655","For a female mosquito, the wrong guy can mean no babies: ","technology"
"1656","Dogs flub problem-solving test: ","technology"
"1657","Stonehenge suburb had an imposing stone monument of its own: ","technology"
"1658","Scientists use  diamonds and lasers to re-create the intense conditions of Earth's core: ","technology"
"1659","Video: Are great apes a good model for the early hominid lifestyle? ","technology"
"1660","Researchers have caught fruit fly evolution in flagrante delicto: ","technology"
"1661","The typical height of Atlantic hurricane season just passed without a single major cyclone anywhere on Earth: ","technology"
"1662","Backwash from nursing babies may trigger infection fighters: ","technology"
"1663","Moth-munching bats play a key role in protecting corn crops from pests: ","technology"
"1664","Nearly a decade after getting waves of light to bend backward, physicists have done the same with electrons: ","technology"
"1665","Does evidence-based medicine lack solid supporting evidence? ","technology"
"1666","Soft skin may be just an illusion: ","technology"
"1667","Satellite captures double solar eclipse in action: ","technology"
"1668","Banking on recent trends can be a winning strategy when everyone else is stuck in the past, game theory reveals: ","technology"
"1669","RT @schwartz_sarahL: Evolution, caught in flagrante delicto: ","technology"
"1670","A row of massive, now-buried stones once bordered a site near Stonehenge: ","technology"
"1671","RT @SarahZielinski: Shipwreck provides window into Tudor-era cod fishing--and the start of globalization. ","technology"
"1672","Scientists get fired up over chimp and bonobo smarts: ","technology"
"1673","In rock-paper-scissors (and other games), short memory can be good strategy: ","technology"
"1674","Earth just had its first storm-free hurricane peak in 38 years: ","technology"
"1675","Evolution caught red-handed: ","technology"
"1676","Healthy corn may depend on bug-eating bats: ","technology"
"1677","RT @SarahZielinski: How a seahorse dad is like a pregnant woman. ","technology"
"1678","What a Tudor shipwreck can tell us about Renaissance cod fishing: ","technology"
"1679","Scientists have shed some light — and dark — on biochemical factors in multiple sclerosis: ","technology"
"1680","Electron waves refract negatively: ","technology"
"1681","Harming a plant helped researchers learn how to easily make an important ingredient in a common cancer drug: ","technology"
"1682","The ICE spacecraft became the first probe to fly past a comet 30 years ago: ","technology"
"1683","People find the skin of others’ softer than their own: ","technology"
"1684","Evidence-based medicine lacks solid supporting evidence: ","technology"
"1685","In the dark, sight can be costly, cavefish study finds: ","technology"
"1686","Bad news, good news from the first virus survey of Argentine ants: ","technology"
"1687","Robotic exoskeleton studies reveal body’s ability to quickly economize movements: ","technology"
"1688","It’s time to rethink current blood pressure guidelines: ","technology"
"1689","A sunshine vitamin &amp; a darkness hormone both play key roles in controlling multiple sclerosis: ","technology"
"1690","Impossible Foods’ flagship product is a plant-based cheeseburger ","technology"
"1691","Is China coming around on cybersecurity? ","technology"
"1692","The White House Backs Down On Phone Encryption by @Cat_Zakrzewski","technology"
"1693","Gillmor Gang: Batting Practice by @stevegillmor","technology"
"1694","Kibo iOS App Lets You Hide Messages In Your Messages by @riptari","technology"
"1695","Code Tenderloin connects tech companies with the community ","technology"
"1696","Uber still tops the Unicorn Leaderboard with a post money valuation of $51B ","technology"
"1697","Four Reasons Why Sports Startups Are Scoring Big by @smita622","technology"
"1698","Zuckerberg confirms Facebook is working on augmented reality ","technology"
"1699","The next 10 years of automation and what it might mean for the job market ","technology"
"1700","Series A 101 by @BNarasin","technology"
"1701","Airpaper will cancel your Comcast service for you ","technology"
"1702","What car dealers think about Elon Musk ","technology"
"1703","7 ways Google thinks about hiring, management, and culture ","technology"
"1704","Open Bionics creates Disney-inspired bionic hands for amputee kds ","technology"
"1705","Sell SaaS, they said … it will be easy, they said ","technology"
"1706","IPFS would help the Internet grow into the system we’ve always aspired it to be ","technology"
"1707","Everything you need to know from Microsoft’s massive hardware event ","technology"
"1708","SF nerds can now impress dates with UberSELECT ","technology"
"1709","OneGo promises to give subscribers unlimited flights for a monthly fee ","technology"
"1710","LogMeIn Buys Password Manager LastPass | Crunch Report ","technology"
"1711","Dell has filed confidentially for an IPO for its SecureWorks cybersecurity unit ","technology"
"1712","More funding won’t magically fix your startup ","technology"
"1713","This week on the TC Gadgets Podcast: Google and Microsoft and we’re back!!! ","technology"
"1714","T-Shirts And Tech: Solving The Sartorial Equation by @zfiscr","technology"
"1715","The new Amazon Fire TV could be the ultimate cord-cutting tool ","technology"
"1716","NEA backs on-demand beauty business Glamsquad in $15M Series B ","technology"
"1717","Siliconvicts Are The Tech Slogan T-Shirts You've Always Talked About Making by @nitishpkulkarni","technology"
"1718","Wonderloop is a startup allowing people to showcase themselves through short 10-15 second video profiles ","technology"
"1719","The genius of Twitter Moments is that an entire team within the company agreed on a path and stuck to it ","technology"
"1720","Relay FM launches iOS app to discover new podcast shows ","technology"
"1721","13 TechCrunch stories you don’t want to miss ","technology"
"1722","LogMeIn buys password manager LastPass, Dell files IPO for its cybersecurity unit, and more on #CrunchReport","technology"
"1723","iOS podcast app Overcast adds streaming, drops price to free ","technology"
"1724","CrunchWeek: Jack Has A Moment, Microsoft Goes Big, And Pandora's Selling Tickets ","technology"
"1725","Facebook now lets you frame your profile pic to support your college football team ","technology"
"1726","Is China Coming Around On Cybersecurity? by @Cat_Zakrzewski","technology"
"1727","'The Good Dinosaur' will feature twice as many special effects as any Pixar film ","technology"
"1728","Code Tenderloin Connects Tech Companies With The Community by @meganrosedickey","technology"
"1729","Technology is the great equalizer — but it can only take us so far when outdated regulations are in place ","technology"
"1730","What Car Dealers (Still) Think About Elon Musk and Company ","technology"
"1731","Segment raises $27M for its “one API to rule them all” ","technology"
"1732","Microsoft's new hardware, and more on #CrunchWeek","technology"
"1733","betaworks launches Dexter, an open web platform letting developers build and share modules or “blocks” ","technology"
"1734","Open Bionics Creates Disney-Inspired Bionic Hands For Amputee Kids by @sarahbuhr ","technology"
"1735","Sell SaaS, They Said ․.․ It Will Be Easy, They Said by @danielsaks","technology"
"1736","Meet Sounds, a music app that lets you share songs on Instagram ","technology"
"1737","SF Nerds Can Now Impress Dates With UberSELECT by @sarahbuhr","technology"
"1738","LogMeIn acquires password management software LastPass for $110M ","technology"
"1739","OneGo Goes Nationwide With Its Subscription Plans For Unlimited Flights by @anthonyha","technology"
"1740","Driverless car accident reports make unhappy reading for humans ","technology"
"1741","Dell Files IPO for Cybersecurity Unit by @Katie_Roof","technology"
"1742","Venturra Capital is a big-hitting $150M fund for startups in Southeast Asia ","technology"
"1743","More Funding Won’t Magically Fix Your Startup by @ersf","technology"
"1744","Clue, a period tracker app letting women track monthly cycles and predict their fertile windows, closes $7M Series A ","technology"
"1745","The Dog Ate Our Homework, Google Drive Is Down by @drew","technology"
"1746","AliCloud, the cloud computing business of Alibaba Group, opens its second data center in the U.S. ","technology"
"1747","Want to understand VC in Europe? Catch these top investors at Disrupt London ","technology"
"1748","This Week On The TC Gadgets Podcast: Google And Microsoft And We're Back!!! by @jordanrcrook","technology"
"1749","The New Amazon Fire TV Is A Hi-Resolution Box That Does It All by @johnbiggs","technology"
"1750","The exec who oversees Microsoft’s developer tools and services, S. Somasegar, will leave the company after 27 years ","technology"
"1751","Apple has removed some apps from its App Store for installing a root certificate ","technology"
"1752","The car industry needs to rethink the dashboard user interface design ","technology"
"1753","NEA Backs On-Demand Beauty Business Glamsquad In $15 Million Series B by @sarahintampa","technology"
"1754","Wonderloop Launches A Web Version Of Its Video Profiles App by @mikebutcher","technology"
"1755","The (Predictable) Misunderstanding Of Twitter Moments by @drew","technology"
"1756","Relay FM Launches iOS App To Discover New Podcast Shows by @romaindillet ","technology"
"1757","Meet the new Facebook Reactions ","technology"
"1758","13 TechCrunch Stories You Don't Want To Miss This Week by @annaescher","technology"
"1759","Cloud-based phone system Switch now integrates with Office 365 ","technology"
"1760","iOS Podcast App Overcast Adds Streaming, Drops Price To Free by @romaindillet ","technology"
"1761","Facebook Now Lets You Frame Your Profile Pic To Show Support For Your Favorite College Football ... by @sarahintampa","technology"
"1762","Pixar Studios Doubles Effects In Upcoming Film 'The Good Dinosaur' by @Cat_Zakrzewski","technology"
"1763","Can We Get Entrepreneurs And Politicians To Speed Date? by @ElizabethGore","technology"
"1764","Segment Raises $27 Million For Its ""One API To Rule Them All"" by @sarahintampa","technology"
"1765","betaworks Launches Dexter, An Open Platform For Building Integration-Driven Web Apps by @jordanrcrook","technology"
"1766","Meet Sounds, A Music App That Lets You Share Songs On Instagram by @romaindillet","technology"
"1767","Pinterest engineer launches non-profit to support communities of Black engineers ","technology"
"1768","LogMeIn Acquires Password Management Software LastPass For $110 Million by @sarahintampa","technology"
"1769","Facebook Messenger for Apple Watch officially launches ","technology"
"1770","The Mission district’s Gray Area incubates Fugue Machine, a multi-playhead sequencer ","technology"
"1771","Driverless Car Accident Reports Make Unhappy Reading For Humans by @riptari","technology"
"1772","EMC-Dell rumors could be about storage giant exiting on its own terms ","technology"
"1773","Apple says battery performance of new iPhone’s A9 chips vary only 2-3% ","technology"
"1774","Twitter opens up its Amplify program in a push to scale video advertising ","technology"
"1775","Kitten can walk again thanks to 3D printed wheels ","technology"
"1776","Bitcoin hardware startup ""21"" hires the crypto-currency’s top contributing developers, opens education portal ","technology"
"1777","Venturra Capital Is A Big-Hitting $150M Fund For Startups In Southeast Asia by @jonrussell","technology"
"1778","How telerobotics can reshape our workspace ","technology"
"1779","Period Tracker App Clue Gets $7M To Build A Platform For Female Health by @riptari","technology"
"1780","FCC Commissioner Rosenworcel on key issues in 2016 ","technology"
"1781","Alibaba’s Cloud Unit Opens Its Second U․S․ Data Center by @catherineshu","technology"
"1782","When you read something like Jared’s story, you remember what’s really important ","technology"
"1783","Amazon announces AWS IoT ","technology"
"1784","Want to Understand VC in Europe? Catch These Top Investors at Disrupt London ","technology"
"1785","Trove is a platform that lets users customize and buy personalized, 3D-printed jewelry ","technology"
"1786","Makerbot CEO Jonathan Jaglom has announced that they are laying off about 20% off the company’s 400 staff ","technology"
"1787","Lyft partners with Hertz to offer lower rate car rental services ","technology"
"1788","After being promised Wi-Fi calling for over a year by Apple and AT&amp;T…it’s finally here ","technology"
"1789","TechCrunch Lisbon, Meetup and Pitch-Off, October 19 ","technology"
"1790","Accelerated educational program Flatiron School is switching up its model with the launch of Learn Verified ","technology"
"1791","For the first time, more Google searches were completed on mobile devices than desktop computers ","technology"
"1792","7 ways Google​ thinks about hiring, management and culture ","technology"
"1793","Amazon launches AWS Mobile Hub to help mobile developers build back-end processes ","technology"
"1794","After Nearly 30 Years, Microsoft's Developer Division Head Leaves Company by @catherineshu","technology"
"1795","Netflix just got more expensive ","technology"
"1796","Vimeo invests in three more original series ","technology"
"1797","SendGrid launches new triggered email service for marketers ","technology"
"1798","Amazon today announced a massive new instance type for its AWS EC2 compute service ","technology"
"1799","Box stock spikes on news that CEO @levie recently purchased 15,000 shares ","technology"
"1800","Swiftkey releases predictive keyboard built on a neural network ","technology"
"1801","Sony is slashing the price of its latest gaming console by $50 just in time for the holidays ","technology"
"1802","Littlebits releases a wonderful gadget and gizmo kit ","technology"
"1803","Facebook Adds ""Empathy"" Reactions | Crunch Report ","technology"
"1804","Apple Removes 'A Few' Apps Including Ad Blockers From App Store For Installing Root Certificate by @panzer","technology"
"1805","Burner gets business-ready with auto-renewing lines, connections to Slack, Dropbox, Evernote, and more ","technology"
"1806","HBO NOW is at last coming to Roku ","technology"
"1807","Reflektive raises $3.6M from Andreessen Horowitz to rethink annual performance reviews ","technology"
"1808","New clip from “Steve Jobs” movie asks, “what do you do?” ","technology"
"1809","Munchery hires La Boulange founder Pascal Rigo to improve the customer experience ","technology"
"1810","Facebook supercharges the Like button with 6 empathetic emoji ","technology"
"1811","Why The Car Industry Needs To Rethink The Dashboard User Interface Design ","technology"
"1812","TomTom is applying its GPS technology to self-driving cars and fitness watches ","technology"
"1813","Cloud-Based Phone System Switch Now Integrates With Office 365 by @mattlynley","technology"
"1814","Can decency be legislated? ","technology"
"1815","Pause is a relaxation and meditation app aimed at combating digital stress ","technology"
"1816",".@timarmstrongaol defends Verizon’s data collection for advertising ","technology"
"1817","Facebook adds ""empathy"" Reactions, and more on #CrunchReport ","technology"
"1818","Employees deplane from Flightcar as it undergoes major “restructuring” ","technology"
"1819","Apple is now selling the Harry Potter books directly in the iBooks Store ","technology"
"1820","Pinterest Engineer Launches /dev/color To Support Communities of Black Engineers by @kthomas901","technology"
"1821","Amazon has expanded its ecommerce empire yet again, this time treading on Ety's toes ","technology"
"1822","uBeam finally reveals the secret of how its wireless charging phone case works safely ","technology"
"1823","Facebook Messenger For Apple Watch Officially Launches by @drew","technology"
"1824","Sony buys gesture-tracker and 3D-sensor maker, SoftKinetic ","technology"
"1825","Registration is now open for Country Pavilions at Disrupt London 2015 #TCDisrupt","technology"
"1826","The Mission District's Gray Area Incubates Fugue Machine, A Multi-Playhead Sequencer by @kimmaicutler","technology"
"1827","Google releases ‘experimental’ public transport app for Delhi ","technology"
"1828","Twitter Opens Up Its Amplify Video Ad Program by @anthonyha","technology"
"1829","The Next 10 Years Of Automation And What It Might Mean For The Job Market by @danfaggella","technology"
"1830","INNOVATE2016: FCC Commissioner Rosenworcel On Key Issues In 2016 by @ajkeen","technology"
"1831","Apple Says Battery Performance Of New iPhone's A9 Chips Vary Only 2-3% by @panzer","technology"
"1832","Meituan and Dianping merge in multi-billion dollar deal ","technology"
"1833","Wi-Fi Calling Finally Comes To AT&amp;T by @drew","technology"
"1834","‘Smart menstrual cup’ Looncup deciphers your menstrual flow ","technology"
"1835","Kitten Can Walk Again Thanks To 3D Printed Wheels by @johnbiggs","technology"
"1836","Trove Lets You Customize Gold and Silver Jewelry using 3D Printing by @fitztepper","technology"
"1837","Coming soon to Singapore: robotic mail carriers in the skies ","technology"
"1838","Makerbot Lays Off 20% Of Employees, Restructures Brooklyn Offices by @johnbiggs","technology"
"1839","How Telerobotics Can Reshape Our Workspace by @PeterHirstMBE","technology"
"1840","Alphabet now owns ","technology"
"1841","Lyft Announces Hertz And Shell Partnerships, Plus Express Pay So Drivers Can... by @sarahbuhr ","technology"
"1842","Medium debuts publishing API and new writing features ","technology"
"1843","Our Cousin Jared. by @drew","technology"
"1844","Mobile Searches Surpass Desktop Searches At Google For The First Time by @Cat_Zakrzewski","technology"
"1845","Google has made an investment in the German Research Centre for Artificial Intelligence ","technology"
"1846","EMC-Dell Rumors Could Be About Storage Giant Exiting On Its Own Terms by @ron_miller","technology"
"1847","Twitter will ‘absolutely’ stay an independent company ","technology"
"1848","Netflix Just Raised The Price Of Its Most Popular Plan by @mjburnsy","technology"
"1849","Misen wants to crowdfund a knife for your life ","technology"
"1850","Box Spikes 6% On News That CEO Aaron Levie Recently Purchased 15,000 Shares by @alex","technology"
"1851","Amazon Announces AWS IoT -- A Platform For Building, Managing And Analyzing The Inter... by @ingridlunden @fredericl","technology"
"1852","Bitcoin Hardware Startup 21 Hires The Crypto-Currency's Top Contributing Developers, Opens Educa... by @kimmaicutler","technology"
"1853","Barnes &amp; Noble releases a new Nook-branded Samsung tablet ","technology"
"1854","AWS Launches Container Registry To Simplify Container Management by @ron_miller","technology"
"1855","Amazon Launches AWS Mobile Hub To Help Mobile Developers Build Back-End Processes by @fredericl","technology"
"1856","Local Discovery Aggregator PHIND Launches Major Update, Secures $755k Seed Funding by @lucas_matney","technology"
"1857","TomTom Is Applying Its GPS Technology To Self-Driving Cars And Fitness Watches by @sarahbuhr ","technology"
"1858","When robots come to pray ","technology"
"1859","AWS Announces X1 Instances For EC2 With 2TB Of Memory, Launching Next Year by @fredericl","technology"
"1860","HBO NOW Is At Last Coming To Roku by @sarahintampa","technology"
"1861","Sony Cuts Price Of PlayStation 4 For The First Time To $349 by @romaindillet ","technology"
"1862","New Clip From ""Steve Jobs"" Movie Asks, ""What Do You Do?"" by @anthonyha","technology"
"1863","Butterfleye raises over $600K on Indiegogo​ for its smart home monitoring camera","technology"
"1864","The TC Meetup + Pitch-Off In Nola Goes Down Tonight! by @jordanrcrook","technology"
"1865","Swiftkey Releases Predictive Keyboard Built On A Neural Network by @mikebutcher","technology"
"1866","Vimeo Invests In Three More Original Series by @sarahintampa ","technology"
"1867","Munchery Hires La Boulange Founder Pascal Rigo To Improve The Customer Experience by @meganrosedickey","technology"
"1868","Flatiron School Launches Full Online Curriculum With Learn Verified by @jordanrcrook","technology"
"1869","SendGrid Launches Threads, A Triggered Email Service For Marketers by @anthonyha","technology"
"1870","AOL CEO Tim Armstrong Defends Verizon's Data Collection For Advertising by @Cat_Zakrzewski","technology"
"1871","Burner Gets Business-Ready With Auto-Renewing Lines, Connections To Slack, Dropbox, Evernote &amp; More by @sarahintampa","technology"
"1872","Reflektive Raises $3.6 Million from Andreessen Horowitz to Rethink Annual Performance Reviews ","technology"
"1873","Can Decency Be Legislated? by @jkosseff","technology"
"1874","Employees Deplane From Flightcar As It Undergoes Major ""Restructuring"" ","technology"
"1875","Zuckerberg confirms Facebook is working on augmented reality ","technology"
"1876","Valk Fleet Is Delivery Hero's Stealthy Logistics And Food Delivery Platform by @sohear","technology"
"1877",".@Pypestream raises $2M to help businesses talk to their customers ","technology"
"1878","Littlebits Releases A Wonderful Gadget And Gizmo Kit by @mjburnsy","technology"
"1879","Pause Is A Super Simple Mindfulness App From ustwo by @riptari","technology"
"1880","TechCrunch Lisbon, Meetup And Pitch-Off, October 19 by @mikebutcher","technology"
"1881","Harry Potter Enhanced Books Come To iBooks With Exclusive Animations And Author Notes by @romaindillet","technology"
"1882","Google’s iOS app lets you tap and play GIFs ","technology"
"1883","Massive freelance engineer marketplace @toptalllc now sells designers ","technology"
"1884","uBeam Finally Reveals The Secret of How Its Wireless Charging Phone Case Works Safely by @joshconstine","technology"
"1885","Now you can backup your WhatsApp messages, photos, and videos to Google Drive ","technology"
"1886","Registration Is Now Open For Country Pavilions At Disrupt London 2015 by @mjburnsy","technology"
"1887","Israeli container security startup Scalock lands $4M Series A investment ","technology"
"1888","Google Releases 'Experimental' Public Transport App For Delhi, India by @jonrussell","technology"
"1889","Amazon shuts down its music importer software but points users to Amazon Music ","technology"
"1890","Sony Buys Gesture-Tracker And 3D-Sensor Maker, SoftKinetic by @riptari","technology"
"1891","Amazon Inspector will find your security issues ","technology"
"1892","Meituan and Dianping, China's Top Group Deals Sites, Merge In Multi-Billion Dollar Deal by @jonrussell","technology"
"1893","'Smart Menstrual Cup' Looncup Deciphers Your Flow by @catherineshu","technology"
"1894","A look at Disney’s 2nd accelerator batch ","technology"
"1895","Sunshine, a crowd-sourced weather app, goes live ","technology"
"1896","Giphy wants to become a full-fledged, gif-based media company ","technology"
"1897","Drones Could Soon Be Used To Deliver The Mail In Singapore by @jonrussell","technology"
"1898","Amazon launches Snowball, a rugged storage appliance for importing data to AWS by FedEx ","technology"
"1899","If I could hear anyone speak at Disrupt London, it would be __________. #TCDisrupt","technology"
"1900","Singapore Home Furnishing E-Tailer HipVan Unboxes A $3.3M Series A Round by @jonrussell","technology"
"1901","AWS introduces Kinesis Firehose to move sensor data to cloud ","technology"
"1902","Amazon launches QuickSight business intelligence service for AWS ","technology"
"1903","Amazon’s AWS is now a $7.3B business as it passes 1M active enterprise customers ","technology"
"1904","Discount shopping site @Jet ditches membership fees but says profitability still on track for 2020 ","technology"
"1905","Hulbee bags $9M to grow its pro-privacy search engine ","technology"
"1906","Text-a-pro with @getyourpro for flat-rate pricing on handy tasks ","technology"
"1907","The ascent of ad blockers clears the way for more engaging adtech ","technology"
"1908","Quantcast Launches Audience Grid To Connect Online And Offline Ad Targeting by @anthonyha","technology"
"1909","Now is the time to break into China ","technology"
"1910","Medium Debuts Publishing API And New Writing Features, Including Mentions by @catherineshu","technology"
"1911",".@paribusco raises $2.1M to save online shoppers money ","technology"
"1912","Pandora Is Acquiring Ticketfly | Crunch Report ","technology"
"1913","This week on Bullish: Is India the next tech superpower? ","technology"
"1914","Alphabet Now Owns abcdefghijklmnopqrstuvwxyz․com by @drew","technology"
"1915","Danny Boyle and Aaron Sorkin on Steve Jobs: “Deep down, Steve felt himself to be flawed” ","technology"
"1916","Google announces Accelerated Mobile Pages Project to bring you quick-loading articles ","technology"
"1917","Facebook, Big Switch Networks, and NTT create Open Network Linux ","technology"
"1918","Employee relocation platform @moveguides closes $15.6M Series B ","technology"
"1919","Butterfleye Raises Over $600K On Indiegogo For Its Smart Home Monitoring Camera by @drew","technology"
"1920","Google Invests In DFKI, An Artificial Intelligence Research Center In Germany by @ingridlunden","technology"
"1921","Head Of Product Says Twitter Will 'Absolutely' Stay An Independent Company by @Cat_Zakrzewski","technology"
"1922","Ad-blockers may actually cure publishers’ ad woes ","technology"
"1923","Apple’s Beats announces the $229 Pill+ will hit shelves next month ","technology"
"1924","Journalist Matthew Keys Found Guilty On Hacking Charges by @Cat_Zakrzewski","technology"
"1925","Barnes &amp; Noble Releases A New Nook-Branded Samsung Tablet by @johnbiggs","technology"
"1926","When Robots Come To Pray by @seanlorenz","technology"
"1927","Misen Wants To Crowdfund A Knife For Your Life by @johnbiggs","technology"
