"","user","type"
"257","The thing bonding these model BFFs? Saint Laurent: http://t.co/odgOv4Rsrq","fashion"
"258","Why Zendaya is a front row beauty to watch: http://t.co/khJzur7OlR","fashion"
"259","Just in: Complete runway images from Martin Grant Spring 2016 are here: http://t.co/9jRNbxUJyW","fashion"
"260","Inside the Alexander McQueen after-party: http://t.co/K04FyxX4pn","fashion"
"261","Apple and Hermès launch their new watch in Paris: http://t.co/fl94fkCfit","fashion"
"262","Just in: Complete runway images from Veronique Branquinho Spring 2016 are here: http://t.co/6WDY7U3Lji","fashion"
"263","See every single look from the Saint Laurent Spring 2016 collection as it comes off the runway: http://t.co/LLCMGt0O5H","fashion"
"264","Meet the Saint Laurent model girl gang: http://t.co/2vDtmXFS9m","fashion"
"265","Why are French guys dressing like they're from Brooklyn?: http://t.co/tbjJWyMFF0","fashion"
"266","Vanessa Seward is bringing back classic Parisian chic: http://t.co/KqbdYMUhHk","fashion"
"267","Now you can score a sleek '90s throwback without any of the hard search work: http://t.co/HX4wFxJ5H6","fashion"
"268","Amal Clooney brings a touch of cool to the courtroom: http://t.co/P6ZXOnbyRL","fashion"
"269","“Parisian guys dress more Brooklyn than Brooklyn guys.”: http://t.co/acNsLW3UMl","fashion"
"270","Just in: Complete runway images from Leonard Spring 2016 are here: http://t.co/LEbGjJwfbF","fashion"
"271","Could engagement nose rings take off?: http://t.co/t7VuLSnZd8","fashion"
"272","Just in: Complete runway images from Sacai Spring 2016 are here: http://t.co/GqtuyzCFYx","fashion"
"273","See every look from the Hermès Spring 2016 collection now: http://t.co/3AX6wUw49C","fashion"
"274","Ilona Smet has It-Girl in her DNA: http://t.co/dy4l7iZBoJ","fashion"
"275","The Hermès Spring 2016 show has started! Watch it here: http://t.co/7WyJI62vkM","fashion"
"276","Just in: Complete runway images from Giambattista Valli Spring 2016 are here: http://t.co/OsuUl5MVWu","fashion"
"277","We're livestreaming the Hermès Spring 2016 show here! Don't miss a single look: http://t.co/oqovNtfVTn","fashion"
"278","Get beauty tips for looking like a Parisienne: http://t.co/SQ7HfB9XKt","fashion"
"279","Kenzo offered a sexy and summery go-anywhere beauty look: http://t.co/jsCDpOdyqW","fashion"
"280","Parking lots are having a moment in Paris: http://t.co/UV2S0wzgs0","fashion"
"281","Emmanuelle Alt knows how to throw a party: http://t.co/I2BXp7pjxh","fashion"
"282","Jean Colonna is not interested in the current '90s nostalgia: http://t.co/jkXZqV5fOn","fashion"
"283","Kenzo! Céline! McQueen!: http://t.co/rbmul81efg","fashion"
"284","Alexander McQueen makes the case for fuzzy waves and flushed cheeks: http://t.co/U2026hhxxJ","fashion"
"285","Can crushed shells and natural pigments change the way we do our nails?: http://t.co/N89tLdjCMf","fashion"
"286","Just in: Complete lookbook images from And Re Walker Spring 2016 are here: http://t.co/hYQCymhnla","fashion"
"287","Playing dress up with Kendall and Kylie Jenner: http://t.co/kFUfM8bGiz","fashion"
"288","Just in: Complete lookbook images from Zuhair Murad Spring 2016 are here: http://t.co/yg5LNrXE2d","fashion"
"289","Is Alexander McQueen bringing pretty back?: http://t.co/vptQAtIyoV","fashion"
"290","Just in: Complete lookbook images from Kolor Spring 2016 are here: http://t.co/gRiWYZZLxt","fashion"
"291","Alexander Wang and Anita Bitton always made an epic pair: http://t.co/OCXdCPKKqr","fashion"
"292","Are you caught up on all things #PFW?: http://t.co/zvFw4fynP2","fashion"
"293","Just in: Complete runway images from Noir Kei Ninomiya Spring 2016 are here: http://t.co/nL1CuLmjuj","fashion"
"294","If three makes a trend, then parking lots are having a fashion moment: http://t.co/OaYCGYdj8x","fashion"
"295","Facial jewelry is having another moment: http://t.co/zUKV8rTcX8","fashion"
"296","Just in: Complete images from Comme des Garçons Comme des Garçons Spring 2016 are here: http://t.co/WUe43ry1zz","fashion"
"297","It's time to get familiar with facial glue: http://t.co/Z84lgo7i5S","fashion"
"298","Forget seven years bad luck: http://t.co/qXurlh9kvV","fashion"
"299","What does every editor crave during fashion month? The perfect Instagrammable moment: http://t.co/fUHzwLiKF1","fashion"
"300","Catch up on all the best street style direct from Paris: http://t.co/9pc1479sVF","fashion"
"301","These 9 unforgettable Alexander McQueen shows are available in full online for the first time ever: http://t.co/uBnxGBIkOd","fashion"
"302","How these '90s Alexander McQueen shows turned the designer into a legend: http://t.co/YdEV4FIck1","fashion"
"303","Kanye West, Rihanna, Zöe Kravitz, and more celebrate Vogue Paris's 95th anniversary: http://t.co/myjHsCgyyL","fashion"
"304","“Maybe we can move away from having to wear an engagement ring."": http://t.co/AJkRRhtlUU","fashion"
"305","Vogue believes in the power of images: http://t.co/hY0Dc2qvLu","fashion"
"306","Alexander Wang went out with a bang: http://t.co/cphn6qFNVi","fashion"
"307","Kanye West, Lauren Santo Domingo, Christian Lacroix and more celebrate a decade of Roksanda Ilincic: http://t.co/H3PeFtKW3l","fashion"
"308","This is punk's greatest accessory: http://t.co/W79ZFRhBD9","fashion"
"309","Boys walked the Maison Margiela Spring 2016 runway: http://t.co/jlN3ldJVvg","fashion"
"310","Just in: Complete runway images from Maison Rabih Kayrouz Spring 2016 are here: http://t.co/rl8egqcHrR","fashion"
"311","Alber Elbaz's sequined frocks for Lanvin's Spring 2016 collection are some of his best yet: http://t.co/EBTQVJqNjW","fashion"
"312","Just in: Complete runway images from Akris Spring 2016 are here: http://t.co/8GVwFlbI7h","fashion"
"313","Just in: Complete runway images from John Galliano Spring 2016 are here: http://t.co/NsYLtNxKtZ","fashion"
"314","See every single look from the Alexander McQueen Spring 2016 collection as it comes off the runway: http://t.co/Z6x4QyQRth","fashion"
"315","Karlie Kloss, Giorgio Armani, and Jeremy Scott toast to Chinese Vogue's first decade: http://t.co/bO2cv92LUs","fashion"
"316","Just in: Complete runway images from Emanuel Ungaro Spring 2016 are here: http://t.co/v6ob9xvH0O","fashion"
"317","Alexander Wang's final show at Balenciaga boasted an epic cast: http://t.co/TenfvJpa3q","fashion"
"318","Just in: Complete runway images from Roland Mouret Spring 2016 are here: http://t.co/an0IJdhqsz","fashion"
"319","Anna Wintour hosts a dinner in honor of @Instagram's Kevin Systrom: http://t.co/nLuy3mRjfN","fashion"
"320","Pierre Bergé and John Demsey toast the ANDAM prize winners: http://t.co/KHzQeRplcG","fashion"
"321","Why model Phillipa Hemphrey is Jonathan Anderson's dream girl: http://t.co/TyfzgTHtbv","fashion"
"322","We're playing dress up with Beyoncé, Taylor Swift, Rihanna, and more: http://t.co/olKjESK6yB","fashion"
"323","Hussein Chalayan marks a decade of Swarovski collaborations with a groundbreaking innovation: http://t.co/Nnw0iyvnmL","fashion"
"324","Absolutely everything to know about Céline's Spring 2016 runway: http://t.co/yG0Xi13ax4","fashion"
"325","Emily Ratajkoswki speaks Gaelic and talks presidential ambitions: http://t.co/mjoFTMdo19","fashion"
"326","Meet Jonathan Anderson's dream girl: http://t.co/OXBduQrj69","fashion"
"327","The Maison Margiela show featured boys and girls on the runway: http://t.co/xa6KSuyO11","fashion"
"328","How does Vogue China celebrate a decade in business? With a star-studded party, of course: http://t.co/QMg2EWTHT5","fashion"
"329","Emily Ratajkowski shares the inside of her apartment with us: http://t.co/KqtGJ8uSbA","fashion"
"330","Activewear meets party gear in H&amp;M's latest collection: http://t.co/eD5T73jCI2","fashion"
"331","See every look from the Céline Spring 2016 collection as it comes off the runway: http://t.co/QBGoMUCNGp","fashion"
"332","The newest member of the Balmain Army is a Vogue regular: http://t.co/l2u0FopE05","fashion"
"333","Let these on-screen sirens be your fashion guides this fall: http://t.co/Tmi7novb5j","fashion"
"334","Virgil Abloh's new buzzy brand is taking him around the globe: http://t.co/PNQ6DhmxCn","fashion"
"335","This is the #PFW look we're loving today: http://t.co/ZWEsudAMKl","fashion"
"336","See every look from the Kenzo Spring 2016 collection as it comes off the runway: http://t.co/Yi2QDYOKQk","fashion"
"337","No one parties like the Balmain Army: http://t.co/eF5h9QmrKX","fashion"
"338","H&amp;M's Spring collection is ideal for your next glamping trip: http://t.co/QKv9GoBt5I","fashion"
"339","How Lorde found a sexy new look in her latest music video: http://t.co/AGKhlj4MBo","fashion"
"340","Patrick Robinson tells us about his new activewear line, Paskho: http://t.co/Qa04eVTUes","fashion"
"341","These were the best accessories from Milan Fashion Week: http://t.co/0eevuWCtfn","fashion"
"342","The rising stars who enlivened Galliano’s catwalk were every bit as interesting as the ensembles presented: http://t.co/gFJOnsxRs0","fashion"
"343","Finally, a runway-worthy beauty look for everyday: http://t.co/3N4rdNOTh8","fashion"
"344","Finally, a take on activewear for those who don't like activewear: http://t.co/BrfiAheKp7","fashion"
"345","Dispatches from the best parties in Paris: http://t.co/ZKo7ddegZO","fashion"
"346","The casting at Vetements included Russia's coolest streetwear designer: http://t.co/zIO8dKeN6X","fashion"
"347","For this new activewear line, it's all about the details: http://t.co/dzuoHVad5v","fashion"
"348","Why you need to try the cool-girl uniform: http://t.co/59zMbpPtSv","fashion"
"349","Just in: Complete lookbook images from Joie Spring 2016 are here: http://t.co/mCMHaIn1Ob","fashion"
"350","The Balmain runway was filled with industry superstars alongside up-and-comers: http://t.co/uFdLPSXWWt","fashion"
"351","Just in: Complete lookbook images from A.P.C. Spring 2016 are here: http://t.co/SL2aeG3x33","fashion"
"352","""I was very lucky to win my season—I really didn’t know what a model was until my mom submitted me."": http://t.co/389fu0hVht","fashion"
"353","Just in: Complete lookbook images from Neil Barrett Spring 2016 are here: http://t.co/nVtyr2eKfu","fashion"
"354","These are some kinky boots we can get behind: http://t.co/t1KaSlq8ON","fashion"
"355","Just in: Complete runway images from Olympia Le-Tan Spring 2016 are here: http://t.co/USKUAx269F","fashion"
"356","East Coast met West Coast in the soundtrack at Balenciaga: http://t.co/fKShzVi51L","fashion"
"357","Celebrating the genius of Alexander McQueen: http://t.co/xDtwWgdW4S","fashion"
"358","A brief history of fashion's kinkiest boot: http://t.co/n0YEIYGDeY","fashion"
"359","Just in: Complete runway images from Comme des Garçons Spring 2016 are here: http://t.co/XiJjh82Wpu","fashion"
"360","Just in: Complete lookbook images from Melitta Baumeister Spring 2016 are here: http://t.co/2kC2cBAYuF","fashion"
"361","Just in: Complete runway images from Vivienne Westwood Spring 2016 are here: http://t.co/hDwGlpBfeK","fashion"
"362","Just in: Complete runway images from Elie Saab Spring 2016 are here: http://t.co/ZScEcRv5MA","fashion"
"363","Just in: Complete lookbook images from Alessandra Rich Spring 2016 are here: http://t.co/75Am0d1s7K","fashion"
"364","Just in: Complete runway mages from Nina Ricci Spring 2016 are here: http://t.co/C1Fcc6Sanh","fashion"
"365","Watch Pat McGrath give golden makeovers in Paris: http://t.co/pnptOya76H","fashion"
"366","Just in: Complete runway images from Mugler Spring 2016 are here: http://t.co/LPMI62ELP9","fashion"
"367","A designer walking in another designer's show?: http://t.co/O6OZehTeDZ","fashion"
"368","This is how to handle the cobblestone streets of Paris in style: http://t.co/lkRd9Kxecp","fashion"
"369","Meet fashion's exciting new union of cool kids: http://t.co/AyVho097m7","fashion"
"370","Why Dior's stylish new ponytail was made for statement earrings: http://t.co/eWvpvGQJ7t","fashion"
"371","Dressing doesn't get much easier: http://t.co/6rWtS0k8EM","fashion"
"372","We can't wait to try this subversively sexy style from the Dior runway: http://t.co/sfjEFCtz9n","fashion"
"373","Meet the 16-year-old demigod to Supreme devotees: http://t.co/QDl2dNXZ9s","fashion"
"374","Meet Nahuel Serrano, the 16-year-old streetwear prince of Paris: http://t.co/Y5WM8JSRPG","fashion"
"375","There are few things more coquettish than a bow: http://t.co/1BifsFirRV","fashion"
"376","How to wear the new nudes: http://t.co/9s3fUbh5aT","fashion"
"377","Goga Ashkenazi celebrates Vionnet’s new flagship in Paris: http://t.co/UpWVVjYfNk","fashion"
"378","Proof that one detail can change a whole look: http://t.co/O7EPdLMGr5","fashion"
"379","It's good to be Rihanna: http://t.co/9AN8XiOcgo","fashion"
"380","“I feel very privileged just to get an insight into an industry known for its exclusivity."": http://t.co/sOq9R69wmS","fashion"
"381","Are cool teens the next big thing in fashion?: http://t.co/Wm5KuAXWqa","fashion"
"382","Prints are ruling the streets of Paris: http://t.co/gRZl6VxTHI","fashion"
"383","Rick Owens has always made a statement on the runway: http://t.co/o2SmVxo8QJ","fashion"
"384","A look back at Rick Owens's runway subversions: http://t.co/6acQe92s1w","fashion"
"385","This is how Rihanna does nude makeup: http://t.co/fNmM25zBr6","fashion"
"386","Unraveling the allure of a ladylike bow: http://t.co/Lp4q0gYT04","fashion"
"387","Alexander Wang took the concept of real girls to the next level on the Balenciaga runway: http://t.co/1FB4G0psum","fashion"
"388","Lanvin's ladylike bows follow in the tradition of Grace Kelly and Jackie O: http://t.co/bhCHVAUUrv","fashion"
"389","“I think that the body is the most important cultural symbol, and I think with the body you can tell a lot.”: http://t.co/iNyGEbKhOv","fashion"
"390","Dior's latex style follows in a long line of stocking boots: http://t.co/wX3yfBQQZB","fashion"
"391","Rihanna brought her family to Dior: http://t.co/S0hsZ7LxMs","fashion"
"392","Alexander Wang's famous friends showed up on the runway at his final show for Balenciaga: http://t.co/ts8GFmnRmz","fashion"
"393","Get a glimpse at what it's like to get a makeover from Pat McGrath: http://t.co/i0gphOxhkO","fashion"
"394","Kendall Jenner strays from sleek: http://t.co/X3G7Olrvsi","fashion"
"395","Alexander Wang does real-girl beauty for his final Balenciaga show: http://t.co/NBI6B3xhw9","fashion"
"396","How to style a sneaker with a dress pant, the Kate Moss way: http://t.co/Geu32D6wWM","fashion"
"397","Kendall Jenner adds a chunky sole to her off-duty style: http://t.co/bglptyTIoa","fashion"
"398","Just in: Complete runway images from Andrew Gn Spring 2016 are here: http://t.co/NxdPQEO0rq","fashion"
"399","Rihanna makes the Dior front row a family affair: http://t.co/dIMq0zoGUp","fashion"
"400","Elizabeth Olsen brings high-impact nude makeup to Dior's front row: http://t.co/7JrTlVeAh3","fashion"
"401","Just in: Complete lookbook images from Faith Connexion Spring 2016 are here: http://t.co/byUQFTBkSE","fashion"
"402","Upside-down models are just the beginning for Rick Owens: http://t.co/ANCY9vMX0m","fashion"
"403","Everything you need to know about Alexander Wang's final show for Balenciaga: http://t.co/ZPwNJXInfS","fashion"
"404","Just in: Complete runway images from Undercover Spring 2016 are here: http://t.co/maGW32ZyrY","fashion"
"405","Just in: Complete runway images from Issey Miyake Spring 2016 are here: http://t.co/sUMGE8qiiQ","fashion"
"406","From Beyoncé to Madonna, these ladies prove the power ponytail is a staple for all female powerhouses: http://t.co/4naLQD07hs","fashion"
"407","Just in: Complete runway images from Julien David Spring 2016 are here: http://t.co/rDygiPRZ4B","fashion"
"408","See every single look from the Balenciaga Spring 2016 collection as it comes off the runway: http://t.co/2D4Ilcr8pY","fashion"
"409","Just in: Complete runway images from Chalayan Spring 2016 are here: http://t.co/2atLuz1Xkf","fashion"
"410","The Balenciaga Spring 2016 show has started! Don't miss a single look: http://t.co/og0OY1YuI0","fashion"
"411","Everything you need to know about day 3 of Paris Fashion Week: http://t.co/suEB74TB4w","fashion"
"412","Just in: Complete runway images from Loewe Spring 2016 are here: http://t.co/1RyRBUcU3w","fashion"
"413","We're livestreaming the Balenciaga Spring 2016 show — don't miss Alexander Wang's final runway for the brand!: http://t.co/MHOg8Yn5r8","fashion"
"414","Just in: Complete runway images from Alexandre Vauthier Spring 2016 are here: http://t.co/V7INvluZU9","fashion"
"415","The only thing better than a Balmain runway? The Balmain after-party: http://t.co/SfT5cXQp54","fashion"
"416","Just in: Complete lookbook images from Tom Ford Spring 2016 are here: http://t.co/Dc1dnzPHOp","fashion"
"417","Kendall Jenner, Gigi and Bella Hadid, and other Balmain babes got down at the brand's after-party: http://t.co/M3cvEtfNBa","fashion"
"418","We're swooning over the extreme evening eyes at Maison Margiela: http://t.co/n9OvSmnNWS","fashion"
"419","Day 2 of Paris Fashion Week was a gilded affair: http://t.co/z0nFkIdcKn","fashion"
"420","Absolutely everything to know about the Dior Spring 2016 show: http://t.co/Sbpa1062Qo","fashion"
"421","See every look from the Isabel Marant Spring 2016 collection as it comes off the runway: http://t.co/xZHExWPphi","fashion"
"422","Why Balmain's power ponytails and bombshell bodies are a fashion week palate cleanser: http://t.co/7pzup0Xghz","fashion"
"423","See every look from the Christian Dior Spring 2016 collection as it comes off the runway: http://t.co/SakNv57Boa","fashion"
"424","It's not easy to upstage a horse: http://t.co/zBMwxSZcIQ","fashion"
"425","What @instagram has taught Anna Wintour about the fashion industry: http://t.co/jod5ZA21gt","fashion"
"426","Welcome back, Caroline Ribeiro!: http://t.co/tof8onfzjK","fashion"
"427","Caroline Ribeiro is back: http://t.co/2xMnFSzIHr","fashion"
"428","10 things to know about John Galliano's second collection for Maison Margiela: http://t.co/Vrx7ALQJ53","fashion"
"429","Meet the 10-year-old who stole the show at Jacquemus: http://t.co/FbCQekWtuQ","fashion"
"430","Lanvin got guests in a good mood by giving out heart-shaped cookies: http://t.co/FtLZVVV94g","fashion"
"431","Everything you need to know about day 2 of Paris Fashion Week: http://t.co/WnvPGKGcp2","fashion"
"432","Alber Elbaz's 10 most quotable quips: http://t.co/pazfM13Pid","fashion"
"433","Think ink!: http://t.co/G68ZPYiFJm","fashion"
"434","Lanvin's designer is good for a highly-quotable quip: http://t.co/Wnc0n6NDhQ","fashion"
"435","In the hands of John Galliano, a safety pin is not just any old safety pin: http://t.co/VJq6Gii0kN","fashion"
"436","Lanvin put a chic new twist on the chignon: http://t.co/pO5OOjuMwk","fashion"
"437","What could be chicer than the ballet?: http://t.co/jhnkvGKH2y","fashion"
"438","In Paris and in need of a caffeine fix?: http://t.co/GDazQw6nax","fashion"
"439","Where does Emily Ratajkowski go for tacos? She's sharing that and more: http://t.co/yXiogceBpV","fashion"
"440","This winner of ""Korea's Next Top Model"" is having a busy month: http://t.co/jMGRlxyqYC","fashion"
"441","Catch up on all the best street style: http://t.co/GrFmdU3LfG","fashion"
"442","At Maison Margiela, the humble safety pin gets a makeover: http://t.co/EKge0GWl4T","fashion"
"443","Paris's cafe scene has grown more sophisticated: http://t.co/Bwlh2nwBO2","fashion"
"444","Get the secret of the Lanvin-approved chignon: http://t.co/LhzI7jmk4k","fashion"
"445","The incredibly stylish red carpet at the New York City Ballet's Fall 2015 Gala: http://t.co/b8pC4S5tGs","fashion"
"446","Paris's growing coffee scene and the 5 best places to grab a cup: http://t.co/8IPnR9rKpp","fashion"
"447","The Lanvin girl's guide to upping your chignon game this weekend: http://t.co/oFLwbGnXn5","fashion"
"448","""If it's not wearable, it's not fashion."": http://t.co/I7EogGACwD","fashion"
"449","It was another chic affair for The Row: http://t.co/21g8ZBTrqg","fashion"
"450","Hyun Ji Shin is having a very big season: http://t.co/SLjwpY6KQX","fashion"
"451","Ashley Olsen and Mary Kate Olsen host an intimate soiree for The Row: http://t.co/DoKpCYt5IR","fashion"
