"","user","type"
"1","Getting smashed for spring, à la Loewe and Maison Margiela: http://t.co/I98DBMrQAQ","fashion"
"2","Is a pop music career on the horizon for Natasha Poly?: http://t.co/adZowz5QTm","fashion"
"3","'80s favorite Sybilla returns to Paris Fashion Week: http://t.co/arAmXGz76l","fashion"
"4","The fashion flock got sexy at Peter Dundas's intimate dinner: http://t.co/UHGNvdM3yM","fashion"
"5","Why Hugh Hefner is one writer's style icon: http://t.co/tgkqhMUMqK","fashion"
"6","There's no one way to sum up what happened at the Paris Fashion Week collections: http://t.co/U25cJI9Mo4","fashion"
"7","In search of a fall bag? Try the mason style: http://t.co/UoX9ObzejX","fashion"
"8","The appeal of model Mathilde Brandi for designers like Isabel Marant and Céline: http://t.co/nUiIj2iD7K","fashion"
"9","This is the ultimate view of Paris Fashion Week: http://t.co/6iWtnwEIsA","fashion"
"10","How to apply glitter like a pro: http://t.co/elc7SiiOd9","fashion"
"11","Miu Miu's ""romanticism of youth"" included plenty of ballerina tulle: http://t.co/XixaxiqRlJ","fashion"
"12","Miu Miu's Spring 2016 will have you reaching for the ballet slippers: http://t.co/D3vq2AGVcI","fashion"
"13","Instagram is changing the fashion industry: http://t.co/aPpobe8khs","fashion"
"14","From Stella McCartney to Proenza Schouler, Herieth Paul is having her best season yet: http://t.co/5p2SlfJM9C","fashion"
"15","8 style lessons we learned from Hanne Gaby, cool-girl catwalker: http://t.co/CMk9mHN37F","fashion"
"16","Eva Chen and Kristen Joy Watts host an Instagrammable breakfast for the 2014 CFDA/Vogue Fashion Fund finalists: http://t.co/MDarjw3WJr","fashion"
"17","How to get Sonia Rykiel's smoky eyes and brushed waves: http://t.co/K6fAMj7bX3","fashion"
"18","This is the surprising accessory we're revisiting for spring: http://t.co/vYwAUGgMJm","fashion"
"19","Get an insider view of Paris Fashion Week: http://t.co/iAebD7Btca","fashion"
"20","The top 10 Spring 2016 shows in Paris: http://t.co/nAc7hV3edX","fashion"
"21","Phoebe Philo's Spring 2016 collection for Céline was a ticket to ride: http://t.co/qHs3PPMyy5","fashion"
"22","Paris was more than a moveable feast: It was an Instagrammable one: http://t.co/UJt0cWGFxj","fashion"
"23","Could breaking up be your best bet for Spring 2016?: http://t.co/GtgqEAxNqc","fashion"
"24","How many different uses can Pat McGrath find for gold makeup? Let us count the ways: http://t.co/PMi6uZkKqs","fashion"
"25","6 times Pat McGrath reimagined gold makeup: http://t.co/fL2lNgNsnZ","fashion"
"26","The hair accessory phenomenon taking over the Spring 2016 runways: http://t.co/yiA9FzuMfc","fashion"
"27","How to get the glitter eye look seen at Giambattista Valli Spring 2016: http://t.co/LUmQu67eiE","fashion"
"28","Paris Fashion Week taught us that there's more than one way to stand out from the crowd: http://t.co/wOno9lexRH","fashion"
"29","7 beauty lessons we learned from Paris Fashion Week: http://t.co/KjYPPwrdsv","fashion"
"30","We've been coveting these accessories since they hit the runway: http://t.co/5kY2IP1RW6","fashion"
"31","All the best accessories from Paris Fashion Week: http://t.co/0BbStlN9pi","fashion"
"32","Paris Fashion Week offered no shortage of beauty statements: http://t.co/mvr12nfJU0","fashion"
"33","Parisians have a knack for knowing what we'll be wanting next Spring: http://t.co/cCOXtJYs4K","fashion"
"34","You might already have Spring's hottest trend stashed under your kitchen sink: http://t.co/SSHvZvqpA9","fashion"
"35","Zendaya's Paris Fashion Week debut was all about the numbers: http://t.co/xYJlUnMasj","fashion"
"36","Bubblegum pink is having a resurgence: http://t.co/epgNFOHe27","fashion"
"37","Nicolas Ghesquiere unleashes his inner nerd: http://t.co/gZSsKbAJ6j","fashion"
"38","Everything you need to know about day 9 of Paris Fashion Week: http://t.co/ZlE6j6xVzD","fashion"
"39","Where does '80s music meet symbolist painting? The Miu Miu soundtrack: http://t.co/WLbWXEXaPE","fashion"
"40","Sometimes, we save the best for last: http://t.co/JZHua0ciBx","fashion"
"41","Hanne Gaby is always nailing model-off-duty style: http://t.co/ncAxMeMune","fashion"
"42","This new accessories line is part Baywatch, part St. Tropez: http://t.co/Xqq2iOvQSU","fashion"
"43","""Clothes must be worn with love, emotion, and pride."": http://t.co/bKjNLsT2A4","fashion"
"44","100 bridal looks from the spring 2016 runways: http://t.co/xOJyrn9uQu","fashion"
"45","Meet Liv Tyler’s Beauty BFF: http://t.co/hpnQVWqCq2","fashion"
"46","Bella Hadid brings back '80s glamour: http://t.co/3HMIN4W0HB","fashion"
"47","How @gucci is ruling the street style circuit: http://t.co/T19TpMRoAE","fashion"
"48","Is glitter about to become fall's most wearable makeup statement? http://t.co/p27rOzeju9","fashion"
"49","Twin models are taking over the fashion world–here's how to tell who's who: http://t.co/TslxrUjNwp","fashion"
"50","This season’s collections had no shortage of looks for fashion-conscious brides-to-be: http://t.co/6LKpONeDFw","fashion"
"51","5 reasons why PJ Harvey’s subversive style is having a runway renaissance: http://t.co/Ul9ZRptfAb","fashion"
"52","Michael Kors knows glamour: http://t.co/0DTCJtXPbf","fashion"
"53","Why options are everything when it comes to hair: http://t.co/nZ3jfCq07w","fashion"
"54","The best street style looks from Paris Fashion Week: http://t.co/NzsZmTJqtw","fashion"
"55","Vote for Paris Fashion Week's runway queen: http://t.co/oVYhyhWnj9","fashion"
"56","Fashion month went out with a bang: http://t.co/8tNehBmwDJ","fashion"
"57","Who ruled Paris's runways?: http://t.co/5TIjfjEZpe","fashion"
"58","We found the 15 best street style photos of Paris Fashion Week: http://t.co/NdmGmfCWov","fashion"
"59","Ballerina tulle takes the stage at Miu Miu: http://t.co/n8lB4KD5eG","fashion"
"60","The story behind Miu Miu's surreal soundtrack: http://t.co/jgHV7JrPpT","fashion"
"61","The creme de la creme of street style is here: http://t.co/PZtl9lWVWd","fashion"
"62","The 20 best behind-the-scenes photos from Paris Fashion Week: http://t.co/ZcJ6A0lvMi","fashion"
"63","Ciara is having fun playing with her new chop: http://t.co/GM7VJZCKzX","fashion"
"64","Tilda Swinton adds her distinct touch to black tie: http://t.co/elbCh2UwEG","fashion"
"65","Why Instagram is fashion's favorite app: http://t.co/zGOu8ynZcW","fashion"
"66","The best celebrity street style from Paris Fashion Week: http://t.co/Ws9HpXBgYc","fashion"
"67","After 10 years, Sybilla's style hasn't aged at all: http://t.co/hRgJZoGyod","fashion"
"68","Ciara has a knockout new chop: http://t.co/m4XzOyXBJA","fashion"
"69","When it comes to fall's best bags, focus on structure: http://t.co/hMJpFYpd6n","fashion"
"70","How Emily Ratajkowski upgrades her blowout — no brush necessary: http://t.co/UCYgHAci1W","fashion"
"71","The secret anime muses behind Louis Vuitton's Spring 2016 collection: http://t.co/KoNwcUNHIk","fashion"
"72","Just because she recently had a baby doesn't mean Carey Mulligan is slowing down on the red carpet: http://t.co/xNQkL41yjf","fashion"
"73","Two words: Jazz pants: http://t.co/xFvbnXiyCq","fashion"
"74","Love him or hate him, @playboy's Hugh Hefner knows a thing or two about style: http://t.co/BNGvNxAM8e","fashion"
"75","The perfect trend-resistant bag for fall: http://t.co/mKT9czyqaz","fashion"
"76","Carey Mulligan's first post-baby red carpet appearance was naturally very chic: http://t.co/UKi4MRlYp3","fashion"
"77","From Sailor Moon to Evangelion, Louis Vuitton was all about anime this season: http://t.co/Ka2H39p6VC","fashion"
"78","How can Hugh Hefner play style icon to a 20-something feminist?: http://t.co/SbapBND2BT","fashion"
"79","Undeniable magic happens when Emily Ratajkowski ditches the polished hair for a wind-finished look: http://t.co/NSgefStPjH","fashion"
"80","Looks like Emily Ratajkowski has found the Fall version of beach hair: http://t.co/qf0YxYwzlD","fashion"
"81","Which one of these models deserves the title of Paris's Catwalk Queen?: http://t.co/nOLPAIyAOj","fashion"
"82","From Chanel to Vetements, these were the best collections in Paris: http://t.co/EhiVvbRLEy","fashion"
"83","This is how Rihanna styles an art selfie: http://t.co/FwSfbwnBK6","fashion"
"84","The only pants you need this season — straight off the runway: http://t.co/9XTci3fgIy","fashion"
"85","Tilda Swinton puts a polished spin on menswear dressing: http://t.co/Qdt5t2zk4N","fashion"
"86","Few celebrities pull off androgynous dressing as well as Tilda Swinton: http://t.co/zYgembfckl","fashion"
"87","Carey Mulligan's post-baby Chanel couture moment: http://t.co/G1wfGTWwMY","fashion"
"88","It's clear Rihanna is keeping her eye on trends: http://t.co/9qRx5WxYG1","fashion"
"89","The next time you're at a museum, take your selfie to the next level à la Rihanna: http://t.co/0OFZhTXS5a","fashion"
"90","Suddenly, inexplicably, jazz pants feel fresher than ever: http://t.co/xXrbAIWGzc","fashion"
"91","That's a wrap! Catch up on everything you need to know about Paris Fashion Week: http://t.co/JRc0XBcXAx","fashion"
"92","From Rihanna to Zendaya, what all the stylish stars wore to Paris Fashion Week: http://t.co/Y6eTFKqKsK","fashion"
"93","Go behind-the-scenes at all the Paris shows, from Chanel to Rick Owens: http://t.co/mAvrh0RDgN","fashion"
"94","Looking at Instagram's influence on fashion as the app turns 5: http://t.co/ZJKz44n6Fn","fashion"
"95","Happy birthday Hanne Gaby!: http://t.co/4LIhevnT22","fashion"
"96","Sasha Pivovarova channels her inner All-American side for Michael Kors: http://t.co/UxgDtOZHec","fashion"
"97","East meets West at Sacai: http://t.co/5UYoWLrojR","fashion"
"98","The bandanna print gets the high fashion treatment: http://t.co/K5CvX5LSYY","fashion"
"99","Roksanda Ilincic threw a star-studded bash for her 10th anniversary: http://t.co/DUIAaoDhbQ","fashion"
"100","Frame Denim hosted a dinner fêting their new ad starring Natasha Poly: http://t.co/f8aB4Vr3OY","fashion"
"101","At Sacai, Chitose Abe says howdy to the bandanna print: http://t.co/4JbfI6rd2R","fashion"
"102","How Céline picked up the thread of a '70s knitwear wizard: http://t.co/BbMr1FLnV6","fashion"
"103","Tracing fashion week's best ribbons and barrettes: http://t.co/rNElI7bJgm","fashion"
"104","This jaw-dropping fine jewelry is right in step with fashion's new mood: http://t.co/G5f4Acz2EW","fashion"
"105","Meet the 5 models who debuted at Louis Vuitton's Spring 2016 show: http://t.co/b5VVxeNlwL","fashion"
"106","Why we're falling head over heels for this new fine jewelry line: http://t.co/uvPdkR3ibn","fashion"
"107","You didn't expect Zendaya to blend in at fashion week, did you?: http://t.co/aHD8SEmK0T","fashion"
"108","Mathilde Brandi is serving as muse to some of Paris's top designers: http://t.co/tbaVprj7sz","fashion"
"109","“I have always thought of jewelry as miniature sculptures.”: http://t.co/WiNub1ZT4k","fashion"
"110","No one does power casting like Miu Miu: http://t.co/RlltNzfcM9","fashion"
"111","The Rolling Stones made their first fashion week appearance: http://t.co/ckBfz7DnLH","fashion"
"112","Have talent, will travel: http://t.co/NZhxCvAWQC","fashion"
"113","Céline showed smart dresses in packable knits: http://t.co/ZB7evaYYLs","fashion"
"114","Maison d'être: 9 Paris Fashion Week looks to bring into your home: http://t.co/nrfhbv2m3q","fashion"
"115","“I read the New York Times story about the horrible situation with manicurists.”: http://t.co/yZcuxLKvrj","fashion"
"116","For model fans, Miu Miu sums up the essence of Paris Fashion Week: http://t.co/5Ym1zWVcVr","fashion"
"117","Here's one thing Phoebe Philo and Isabel Marant can agree on: http://t.co/NUPq78Xsi5","fashion"
"118","This is your chance to travel in style: http://t.co/ixkqqCrk0e","fashion"
"119","Jennifer Meyer, Greg Chait, Selby Drummond, and Vogue host #AmericansInParis cocktails: http://t.co/qQfqTF2QlP","fashion"
"120","Are you caught up on all things Paris Fashion Week?: http://t.co/oanPhvdYH7","fashion"
"121","Are you caught up on all the latest from Paris Fashion Week?: http://t.co/RQ2YIHIiYX","fashion"
"122","Lucky Blue and Pyper America are co-stars for the new Calvin Klein campaign: http://t.co/rL5lkqCm7n","fashion"
"123","Pastel goes grunge: http://t.co/IGHT6WMskN","fashion"
"124","You might already have Spring's hottest trend stashed under your kitchen sink: http://t.co/WOdIzxR5J4","fashion"
"125","The ever-evolving model as muse at Dior: http://t.co/LSem5t34O9","fashion"
"126","Supermodel Natasha Poly can sing, too!: http://t.co/zIqbBEhoS4","fashion"
"127","The latest supermodel unveiling her own jewelry line: http://t.co/jHcVDhh9sQ","fashion"
"128","When Louis Vuitton says a model is exclusive, it means exclusive: http://t.co/DUBE4JsEYO","fashion"
"129","Zendaya's Paris Fashion Week debut was all about the numbers: http://t.co/P7zDcYWxvV","fashion"
"130","Miu Miu's model moment perfectly sums up Paris Fashion Week: http://t.co/GSObrH7Xpl","fashion"
"131","Paper or plastic?: http://t.co/CrpoaXLuKg","fashion"
"132","Zendaya takes Paris!: http://t.co/1DpSOjumLd","fashion"
"133","We'll take Spring 2016's elevated bodega bags and fanny packs any day: http://t.co/rcsAZeEaPv","fashion"
"134","These trends translate just as easily into your home as they do your closet: http://t.co/361kvLiU3W","fashion"
"135","Léa Seydoux updates vintage French glamour with a single standout detail: http://t.co/ojrZOwn2BY","fashion"
"136","There's nothing more powerful than a single standout detail: http://t.co/4gbfKVR7cY","fashion"
"137","Proof bubblegum pink can work: http://t.co/sY3r7n2ZZs","fashion"
"138","Why limit these trends to your wardrobe when you can bring them into your home?: http://t.co/zNa9lzWxws","fashion"
"139","Just in: Complete lookbook images from Zadig &amp; Voltaire Spring 2016 are here: http://t.co/QkWb0tMGni","fashion"
"140","See all the best front row moments from fashion month: http://t.co/nB30zq1nix","fashion"
"141","Naturally Léa Seydoux nails French glamour: http://t.co/bLWhDjt7Te","fashion"
"142","Just in: Complete lookbook images from Vika Gazinskaya Spring 2016 are here: http://t.co/7SvgG5Upwh","fashion"
"143","Zendaya on her fashion week breakout in 72 hours and at least 10 wardrobe changes: http://t.co/1JGNBPzQiO","fashion"
"144","Bubblegum pink is having a resurgence: http://t.co/PuEmAOpvg9","fashion"
"145","The best front row looks have also been the simplest: http://t.co/3clCj5VG2D","fashion"
"146","How Miranda Kerr does sleek and simple for Louis Vuitton's front row: http://t.co/vE8YX9TX8d","fashion"
"147","Lady Gaga and Cate Blanchett take on Fall's toughest shade: http://t.co/4yXec65y8U","fashion"
"148","Miranda Kerr does ladylike sleek: http://t.co/iWQCHU0Bbf","fashion"
"149","Just in: Complete runway images from Moncler Gamme Rouge Spring 2016 are here: http://t.co/rdbBuM0Prm","fashion"
"150","A new direction for Jackie O's favorite everyday label: http://t.co/NTI1ErQZGv","fashion"
"151","The French are enthralled with all things New York: http://t.co/DLuuBqHtAs","fashion"
"152","Absolutely everything to know about Miu Miu's Spring 2016 show: http://t.co/tgsFxD5IiM","fashion"
"153","How chic was Michelle Williams at Louis Vuitton?: http://t.co/h4c9Um4cVt http://t.co/wC7Yj6dJ2C","fashion"
"154","Braids are invading Paris: http://t.co/CJKnO4qfWJ","fashion"
"155","The top-followed Instagrammer might surprise you: http://t.co/rP9iEgvSti","fashion"
"156","Of course everyone looked sexy at Peter Dundas's party: http://t.co/YVWcBdRuld","fashion"
"157","Calvin Klein's newest ad campaign is a family affair: http://t.co/rcAjIt4Gri","fashion"
"158","Magdalena Frackowiak's next act: http://t.co/OPsHYDWrTy","fashion"
"159","Put down the blow-dryer and makeup bag: http://t.co/0u5TdZ74gP","fashion"
"160","See every single look from the Miu Miu Spring 2016 collection as it comes off the runway: http://t.co/cmkGBkTpml","fashion"
"161","We're livestreaming the Miu Miu show here! Don't miss a single look: http://t.co/fHKZ5h83sb","fashion"
"162","Julia Cumming makes the case for pastel hair on the Saint Laurent runway: http://t.co/qM0txD4UHN","fashion"
"163","Stella McCartney celebrates her show with an after-party: http://t.co/LA3JeCuhiK","fashion"
"164","Why new Balenciaga artistic director Demna Gvasalia is the hottest thing in Paris fashion: http://t.co/2LB4XPx9Sc","fashion"
"165","The street style look taking over Paris: http://t.co/MpWwtOIWV6","fashion"
"166","BREAKING: Alexander Wang's replacement at Balenciaga has been named: http://t.co/S3J1r1VvDR","fashion"
"167","Meet the collaborators and muses who make up Nicolas Ghesquière's Louis Vuitton squad: http://t.co/lSeCSqu3YW","fashion"
"168","Street style phenoms can't get enough of this simple hairstyle: http://t.co/asxIpMTxLF","fashion"
"169","Louis Vuitton has plenty of chic muses: http://t.co/zTi3za771k","fashion"
"170","See every single look from the Louis Vuitton Spring 2016 collection as it comes off the runway:  http://t.co/n8JEiXXtV6","fashion"
"171","We're livestreaming the Louis Vuitton Spring 2016 show here! Don't miss a single look: http://t.co/pWeI1ws5mf","fashion"
"172","Courtney Love is having a style moment: http://t.co/d6d9Dtkeox","fashion"
"173","Fashion's new First Family is here: http://t.co/3uTIZLmlzX","fashion"
"174","The most followed accounts and the most popular photos on Instagram: http://t.co/3YugEmpeF3","fashion"
"175","No model can resist taking a selfie with this doll: http://t.co/EBAXdy3lFd","fashion"
"176","Balenciaga's new artistic director is already a hit among street style stars: http://t.co/EBhNLZAVzy","fashion"
"177","The top 5 most-followed Instagram accounts are all run by women: http://t.co/iq5L60xLhI","fashion"
"178","With Demna Gvasalia in at Balenciaga, we check out Vetements's street style cred: http://t.co/hyGIt7PquF","fashion"
"179","BREAKING: Alexander Wang's replacement at Balenciaga has been named: http://t.co/OWduvvJuiE","fashion"
"180","The Saint Laurent show wasn't the only thing Courtney Love-inspired this week: http://t.co/gHqyqD10j6","fashion"
"181","Study up on Louis Vuitton's muses: http://t.co/rs3T1ht74R","fashion"
"182","Paging Blair Waldorf: The hair accessory is back in a major way: http://t.co/rpXSuUsi5U","fashion"
"183","Meet the backstage doll that's fueling a model-selfie obsession: http://t.co/6TW2LIZXMD","fashion"
"184","Kendall Jenner tries her hand at futuristic dressing: http://t.co/vebVwo4kUE","fashion"
"185","The '90s trend carries down to your ankles, too: http://t.co/MYFlAw5pgK","fashion"
"186","Kendall Jenner steps out in the ladylike look of the future: http://t.co/CIhNdPsIR5","fashion"
"187","Just in: Complete lookbook images from Vanessa Bruno Spring 2016 are here: http://t.co/cLVkeV4Yco","fashion"
"188","Just in: Complete runway images from Paul &amp; Joe Spring 2016 are here: http://t.co/YchKiwpqSV","fashion"
"189","It's good to be Kendall Jenner: http://t.co/K74KV6Hc0M","fashion"
"190","Karl Lagerfeld is a creature of habit: http://t.co/ey2Y0aQnW1","fashion"
"191","Proof that pastel hair can work for any style: http://t.co/qS2xNSSVFw","fashion"
"192","A look back at Karl Lagerfeld's favorite Chanel openers: http://t.co/Ss6tpYzHYP","fashion"
"193","Meet fashion's answer to the traveling gnome: http://t.co/Fp4ViXbhJN","fashion"
"194","Just in: Complete runway images from Ellery Spring 2016 are here: http://t.co/EFgvEZjUPH","fashion"
"195","Karl Lagerfeld mined the airport style of his biggest celebrity muses for Chanel's Spring 2016 collection: http://t.co/a7bedTKDs2","fashion"
"196","How Karl Lagerfeld's celebrity muses inspired his Chanel Spring 2016 show: http://t.co/Bi6Kd2Lr8H","fashion"
"197","Just in: Complete runway images from Vanessa Seward Spring 2016 are here: http://t.co/bPNL8vqLoA","fashion"
"198","Just in: Complete runway images from Longchamp Spring 2016 are here: http://t.co/rjpcnmevRr","fashion"
"199","See the @CHANEL Spring 2016 show from every angle: http://t.co/5QMhXuyPm2 http://t.co/poYKkIPcoa","fashion"
"200","Just in: Complete lookbook images from Alexandre Plokhov Spring 2016 are here: http://t.co/7t4BVmSUBl","fashion"
"201","Celebrate @Instagram's 5th anniversary by following these male models: http://t.co/PfWq4qAsfD","fashion"
"202","The friends that Saint Laurent together stay together: http://t.co/LNRIYecAaM","fashion"
"203","Next Spring promises to be simple: http://t.co/5lNowYwdLS","fashion"
"204","Set down the statement necklace: http://t.co/XcrweAa0u5","fashion"
"205","Everything you need to know about Day 7 of Paris Fashion Week: http://t.co/YRjJ1xil1U","fashion"
"206","Natasha Poly is unleashing her secret talent: http://t.co/cRMm2Tk0SL","fashion"
"207","Kenzo's slick beauty prescription is a globe-trotting minimalist's dream: http://t.co/S3RWClnLzv","fashion"
"208","Sonia Rykiel nails the Parisienne's sultry insouciance: http://t.co/2qOSwbWJrF","fashion"
"209","Fashion happens everywhere in Paris, parking lots included: http://t.co/MQPBZLAjh4","fashion"
"210","Chanel's secret weapon shows us what it's really like behind-the-scenes: http://t.co/F37TLouS30","fashion"
"211","The 10 Valentino menswear looks we hope to see worn by Derek Zoolander and Hansel: http://t.co/nQQsOMvylu","fashion"
"212","Why Lily-Rose Depp's topknot at Chanel is as right for the front row as a jet-set flight: http://t.co/sEqT1ucez5","fashion"
"213","See every single look from Valentino Spring 2016 as it comes off the runway: http://t.co/wsDMQk5Ha6","fashion"
"214","The Valentino Spring 2016 show has started! Watch it here: http://t.co/qthFwpuwKP","fashion"
"215","The Valentino Spring 2016 show is livestreaming here! Don't miss a single look: http://t.co/N0Tt0sQ72d","fashion"
"216","How Marimekko is bringing color into ordinary life: http://t.co/fYnTizcwLI","fashion"
"217","Céline cements the single braid as the look to watch this week: http://t.co/3Muyv51KL8","fashion"
"218","Introducing the nontoxic nail polish that's sweeping Paris Fashion Week: http://t.co/aKX6j4Dc0r","fashion"
"219","Absolutely everything to know about the Chanel Spring 2016 show: http://t.co/8eFh631zYH","fashion"
"220","How to celebrate a decade in business, the Roksanda Ilincic way: http://t.co/KXKlQzVJDR","fashion"
"221","Traveling gets a little more luxe thanks to the CFDA/Vogue Fashion Fund designers: http://t.co/NM9W1Rb2FG","fashion"
"222","Why Vanessa Seward encourages women to individualize their looks: http://t.co/f1H04zhk1J","fashion"
"223","See every look from the Chanel Spring 2016 collection as it comes off the runway: http://t.co/Lz5CzQxQBO","fashion"
"224","Why Loewe might become as known for their plastics as for their leathers: http://t.co/5W9Ts3YtgM","fashion"
"225","Why you'll want to follow Chanel's go-to DJ on Instagram: http://t.co/5Hz9m4ZvWZ","fashion"
"226","Are you a block-heeled or square-toe addict?: http://t.co/oY9wa154cb","fashion"
"227","Zendaya sported some scene-stealing cornrows in Paris: http://t.co/NlQjJDfnKV","fashion"
"228","From Christian Dior to Raf Simons, models have always served as the ultimate muse for the House of Dior: http://t.co/ximfC1X1NM","fashion"
"229","M.I.A. reveals where she stands on ethical fashion: http://t.co/EpJtbovBZx","fashion"
"230","Meet the Insta-famous model who stole the show at Saint Laurent: http://t.co/7W2wo9IfyI","fashion"
"231","Staz Lindes stole the show at Saint Laurent: http://t.co/JzI2B6r746","fashion"
"232","Why this '90s shoe style is here to stay: http://t.co/kAQ4Z4EM3w","fashion"
"233","Why Staz Lindes was a natural choice for the Saint Laurent show: http://t.co/nPR4JCEWUx","fashion"
"234","How French women nail great style: http://t.co/hzNmyVqlzc","fashion"
"235","Party makeup the Parisian way: http://t.co/amvQepoLh7","fashion"
"236","Not every success story is an overnight one: http://t.co/cgjGVt42PL","fashion"
"237","Offbeat opulence is officially trending: http://t.co/t4wQQ63ZFT","fashion"
"238","Leave it to M.I.A. to make a political statement front row at a fashion show: http://t.co/yREqBESsu8","fashion"
"239","Amal Clooney makes nailing a cool outfit at the office look easy: http://t.co/ONLT7nXtng","fashion"
"240","Just in: Complete runway images from Camilla and Marc Spring 2016 are here: http://t.co/eNBLwuMIB5","fashion"
"241","Agyness Deyn is a perfect fit for Saint Laurent's grunge collection: http://t.co/c9sgnPJ0Bn","fashion"
"242","This glitter eye look takes glamour to the next level: http://t.co/cXygFhyB7e","fashion"
"243","Just in: Complete lookbook images from Bernhard Wilhelm Spring 2016 are here: http://t.co/CQ6YagOQdb","fashion"
"244","Consider this your behind-the-scenes ticket to Chanel: http://t.co/j7DslDF9vH","fashion"
"245","Why Chanel fanatics should be following Michel Gaubert on Instagram: http://t.co/StqkjoNlFr","fashion"
"246","Just in: Complete lookbook images from BLK DNM Spring 2016 are here: http://t.co/EUde1bNEQd","fashion"
"247","Of course Agyness Deyn made her return to the runway at Saint Laurent: http://t.co/BlXh6gJnFu","fashion"
"248","How amazing did Salma Hayek look front row at Saint Laurent?: http://t.co/eKu3WZTjEn","fashion"
"249","Just in: Complete runway images from Esteban Cortazar Spring 2016 are here: http://t.co/eDDPw5VbH3","fashion"
"250","Amal Clooney proves chic and professional can coexist: http://t.co/051Drf06ye","fashion"
"251","M.I.A. makes a chic political statement on Stella McCartney's front row: http://t.co/UTVYXipJTw","fashion"
"252","Just in: Complete runway images from Sonia Rykiel Spring 2016 are here: http://t.co/9SfjXeklbr","fashion"
"253","Agyness Deyn is back!: http://t.co/EPhL5um3vR","fashion"
"254","There were only two styles of shoes at Saint Laurent: http://t.co/YdZ6uo7cCV","fashion"
"255","Absolutely everything to know about Saint Laurent's Spring 2016 show: http://t.co/eyB6b0arvA","fashion"
"256","Model Herieth Paul is on the verge of a major breakthrough: http://t.co/B9NHY0OTIy","fashion"
