"","user","type"
"225","How huge tolls on a mountain road could help fix our highways http://t.co/qhffW34HMB http://t.co/kG7ILkVVRZ","technology"
"226","Is iOS 9 making your phone boil? http://t.co/lwDyGdbDjP","technology"
"227","Here's how to fix that frozen iPhone homescreen http://t.co/fUXM5Szpul","technology"
"228","The East Coast’s heavy rains are not from Hurricane Joaquin http://t.co/2lnNRWaHAD http://t.co/O10GOnK2oN","technology"
"229","Here's how to stop your iPhone speaker from glitching out http://t.co/3xMe6S19dg","technology"
"230","If you want to stop gun violence, start with the bullets http://t.co/tT29W3IqtB http://t.co/egDjeH1DD2","technology"
"231","Everything you need to know to keep your iPhone alive http://t.co/5SFDXwTknv","technology"
"232","New footage has surfaced of an Xbox-era South Park game http://t.co/dy66a0aHs5","technology"
"233","Architecture's fine line between stealing and inspiration http://t.co/EZp9WRPTVd","technology"
"234","Trust us: Go see 'The Martian' this weekend http://t.co/WjzpX0nclq http://t.co/3lMBWIVU8l","technology"
"235","How gas-propelled microparticles could stop bleeding in wounds http://t.co/0iXMWfwLkU http://t.co/6lNVeRjyT8","technology"
"236","Scooter dancing is really taking off http://t.co/XOpC0ucAhY http://t.co/SvTe3JNSBH","technology"
"237","Nobel Prize history's littered with examples where the winners weren’t always the deservers http://t.co/Px7vDhUBi3 http://t.co/SR5hXl21Bo","technology"
"238","WOW. This might be the first Craigslist ad to win a Pulitzer: http://t.co/l7ku9pwBmp","technology"
"239","Emails, not emojis, reveal Clinton's real personality http://t.co/eovD4Q6dA4","technology"
"240","Why science can't say when a baby's life begins http://t.co/O2g44MYZpK","technology"
"241","Our Absurd Creature of the Week is a truly terrifying arachnid http://t.co/8k0AcjGZtq http://t.co/fyHlnRFTIK","technology"
"242","After today, Google officially becomes Alphabet http://t.co/ZLEDWBQu6P","technology"
"243","These jailbroken iPhones make it easy to create armies of fembots http://t.co/Tb4KcXE32F via @TheRealFuture","technology"
"244","6 months of WIRED for just $5 + a FREE phone charger (US offer only) https://t.co/1itwrSWBeS http://t.co/o87QzzDwD0","technology"
"245","Breaking: Scottrade alerts 4.6 million brokerage customers of breach http://t.co/WEODKI2gNY","technology"
"246","Gadget Lab podcast: We've got Google products coming out of our ears http://t.co/6IAxFjzn0L","technology"
"247","Man, the scooter moves in this video put Justin Bieber to shame http://t.co/J2cxoDelv9 http://t.co/BtETf2NJ62","technology"
"248","How you can use gadgets may hinge on a printer ink case http://t.co/vob17jn1dj","technology"
"249","Hands-on with the Wove Band, the world's first flexible wearable http://t.co/lQvRdf2NRC http://t.co/toD4NT4S9I","technology"
"250","NASA just dropped new images of Charon, and they're glorious http://t.co/Zo4gEobNC0 http://t.co/NjHFdrP0S6","technology"
"251","VIDEO: What 'The Martian' gets right and wrong about Mars science http://t.co/VxcMlhTZtB","technology"
"252","A building *almost* falling on James Bond? See the trailer for ""Spectre"": http://t.co/j2y8kX0x55 http://t.co/MwpJQiVY02","technology"
"253","Watch the final trailer before 'Spectre' hits theaters http://t.co/0VgYsm9uIc","technology"
"254","How many characters make up the perfect tweet? We asked the experts: http://t.co/d9WzYHYJNX","technology"
"255","Why science can't say when a baby's life begins http://t.co/yGlD1mYYih http://t.co/loDaAki4ds","technology"
"256","""Taken King"" can't quite fix Destiny's fundamental flaws http://t.co/wcIUOYt3vz http://t.co/BoxsWUHiA2","technology"
"257","Hurricane Joaquin looks like a total beast from space http://t.co/r4TViwmR74 http://t.co/mi2gkeF8p2","technology"
"258","You love WIRED right? Then vote for us for Adweek's hottest magazine of the year! http://t.co/1s7hlvtpPa","technology"
"259","You want one of those 'GIF' Facebook profile pics, don't you? Here's how to get it: http://t.co/CPQ5iaNjJ9","technology"
"260","How to kill the new iOS 9 feature that's eating your data http://t.co/Je9r5xPIYQ http://t.co/hkqHaFlOBL","technology"
"261","Thanks to clever tech, Apple’s new iPhones really do hold up under water http://t.co/xCPPdcDp3Y http://t.co/tfq98ItMKi","technology"
"262","When Erykah Badu covers Drake’s “Hotline Bling,” everyone wins. Have a listen: http://t.co/K3aLUV5wUi","technology"
"263","The original Peeple (the thing, not the app) is having a tough week http://t.co/9ufpk3SgqM http://t.co/iX2K3pkriP","technology"
"264","*Welp* This ferocious arachnid is basically death wrapped in mystery http://t.co/5mki4dRSUI http://t.co/sBR01fJ5Pw","technology"
"265","The future of how you can use your own gadgets may hinge on a printer ink case being heard today http://t.co/fj1eJCDZg2","technology"
"266","Snotbot: A drone that collects mucus from spouting whales by hovering over their blowholes. Lets marine biologists gather data.#JargonWatch","technology"
"267","Meet the cats of Walter Chandoha, the godfather of cat photography (PHOTOS) http://t.co/uclEaLhZQp http://t.co/q01v8WwFau","technology"
"268","Architecture's fine line between stealing and inspiration http://t.co/ZsBmIPv4f8 http://t.co/W0D3WhhzbN","technology"
"269","Apple's clever new tech makes the iPhone 6S nearly waterproof http://t.co/MOhIVX9Evi http://t.co/hyN5ngIhBT","technology"
"270","What’s with the aspect ratio on Google’s Pixel C tablet? http://t.co/2LktYC8PUd","technology"
"271","What 2,500 sequenced genomes say about humanity's future http://t.co/9UHoSSaCPe http://t.co/Pm7U4UMd1X","technology"
"272","All the gear, gadgets, and goods we loved this month http://t.co/YlKtq6MCaa http://t.co/9uwLELNBjI","technology"
"273","You can download OS X El Capitan now (and probably should) http://t.co/thzbTZzsYX","technology"
"274","I wasn't expecting the puppet in 'Empire Strikes Back' http://t.co/jvO4pgcY8m http://t.co/REuF0B2PRh","technology"
"275","Soon, you'll be able to use a GIF for your Facebook profile photo http://t.co/zNT9CaXkJP","technology"
"276","Photos of polluted scenery -- tainted with the same pollutants http://t.co/N1skubg3Vm http://t.co/KQypOMuBTP","technology"
"277","In this videogame, death means you’ll never play again http://t.co/IBOnxvImeB","technology"
"278","Why that big security fix for credit cards won't actually stop fraud http://t.co/bM6vbN27LY","technology"
"279","Google’s cell service could snare all the major carriers http://t.co/NAOJmZCPAz","technology"
"280","The government wants you to help it do science experiments http://t.co/BeumJ9w47U","technology"
"281","Tesla's Model X is, in a word, stunning http://t.co/Wu2dNfCZTw (PHOTOS) http://t.co/DI6JI2Kwhn","technology"
"282","What 2,500 sequenced genomes say about humanity's future http://t.co/srEZxtz5Js","technology"
"283","Here's how to get a sweet new ‘GIF’ Facebook profile pic http://t.co/VzJqXOP0it http://t.co/Qi9RJvf220","technology"
"284","Yves Béhar on how smart design can propel social change http://t.co/bMipxOh3My http://t.co/43GANCqsrL","technology"
"285","2 objects are juxtaposed in unexpected ways for these wacky food photos http://t.co/zPTu2CCIYd http://t.co/6bgJxJgPgi","technology"
"286","Europe loves this rideshare startup (Hint: It's not Uber) http://t.co/I8VsPgU10C","technology"
"287","Even with PINs, that new credit card tech will not eliminate fraud http://t.co/U2yrENo3fx","technology"
"288","There’s a Harry Potter jailbreak brewing in London http://t.co/MI1s0bYkTp","technology"
"289","'Agents of S.H.I.E.L.D.' GIF and a graf: Skye/Daisy is the muscle http://t.co/Cfjh4i89b5","technology"
"290","Don't kill the password. Change the password. http://t.co/u1CbLZrKO9","technology"
"291","Facebook is about to completely change your profile http://t.co/9nI0sBV4aD http://t.co/x4pX8Chfd5","technology"
"292","Check out the unexpectedly crazy architecture of Soviet-era bus stops http://t.co/3tHlKN2Efb http://t.co/aZJUrQ9Rio","technology"
"293","The Muppets GIF and a graf: Bobo the cookie salesman http://t.co/gWV73ln1xO","technology"
"294","What’s with the aspect ratio on Google’s Pixel C tablet? http://t.co/mu5syHKV0b","technology"
"295","ICYMI, the 10 new MacArthur Genius scientists are all connected http://t.co/ISpwwSjzpo http://t.co/mYqcJVqkiB","technology"
"296","Just what we need: an algorithm to help politicians pander http://t.co/IYN4778tM5","technology"
"297","How your gut microbiome could put you at higher risk of asthma http://t.co/Ik7yjsJqRv","technology"
"298","What 2,500 sequenced genomes say about humanity's future http://t.co/arKK9lZZgM http://t.co/cP94tdVSAC","technology"
"299","All the gear, gadgets, and goods we loved this month: http://t.co/hwDsXo0TKV http://t.co/eBo8jMCAlW","technology"
"300","If you die in this game, you’re done. You can’t start over. You can never play again. http://t.co/fCREdlZBe8 http://t.co/W004QtTe07","technology"
"301","Report: Jack Dorsey is likely to be named permanent Twitter CEO http://t.co/L4mW3Dx0QZ","technology"
"302","You can download OS X El Capitan now (and probably should) http://t.co/23X4SC2M1Z","technology"
"303","The battle over Crispr rights is playing out on Twitter too http://t.co/GUV0smS8vn http://t.co/ydyiPZR4Uo","technology"
"304","OS X El Capitan is out now, and you should definitely install it. REVIEW: http://t.co/5pLihabugk","technology"
"305","With a new Bolt box, TiVo enter the 4K-streaming arena http://t.co/vIzzMIL3HW http://t.co/tlYs5yTurx","technology"
"306","I wasn't expecting the puppet in 'The Empire Strikes Back' http://t.co/zL7FeXzYyW http://t.co/O9VmE7RETF","technology"
