"","user","type"
"231","@rosssportsautos Murray has shown more the first two weeks. Denver OL should get fixed, but I won't assume it's overnight.","sports"
"232","Daniels is droppable in my mind. Lean Gillmore, but Cook also has a good draw.  https://t.co/sjENvvy7mu","sports"
"233","@slickrick7274 Ebron, only since I could see Chicago scoring 10 points or less.","sports"
"234","@RyanRichey12 Shorts, but I wouldn't watch.","sports"
"235","Joe Haden is a speck overrated in my mind, and he might not see Cooper all day. I roll with the rook.  https://t.co/dUPh1BF97i","sports"
"236","That's what it come to for Cooks. You know what, I know it's a boring floor plan, but give me Baldwin.  https://t.co/IcV2CQV4W5","sports"
"237","@metulhead86 Jets, since they are favored.","sports"
"238","Weak vote to Crowell, since he has to be healthier.  https://t.co/iyd1B91fq5","sports"
"239","@11Carburm Anderson. Broncos OL can only get better.","sports"
"240","My stance on Todd Gurley.  https://t.co/0gw9RniE5r","sports"
"241","@Stephenweisman Hate to sit a Packer WR at home, but Adams is dinged and inconsistent, so I dial up Jackson.","sports"
"242","Landry is a safer floor guy, so consistent. Lions using three backs, annoying us.  https://t.co/Ls0v0AwKgq","sports"
"243","Fleener for me. Worried about Chicago getting annihilated.  https://t.co/EOT41w1qYQ","sports"
"244","Both look terrific, but Big Ben has more to work with. Try to trade one, even at a vacuum loss, next week.  https://t.co/UaCQYQ5SiU","sports"
"245","@DawGFan_71 With Adams in question, I go Wright.","sports"
"246","Tricky, man or matchup? I still will gamble on Megatron, but don't watch. MT @zbing46 Crabtree or Megatron? #AskFFL","sports"
"247","@ggarcia1409 Cam for the rushing backboard, though they are neighbors in my ranks.","sports"
"248","@Bartel25 Hard to trust either at the moment, but give me Mathews.","sports"
"249","When in defense (or kicker) doubt, follow the point spread. Bigger favorite = your play. Arizona in this case.  https://t.co/07CpGUpzjV","sports"
